### ISSUE TITLE
ping failed from node to underlay pod

### ISSUE THREAD

**Issue by liuzhen** [kubeovn/kube-ovn#2283]
# Expected Behavior
ping from node to underlay pod gets replied

# Actual Behavior
no reply

# Steps to Reproduce the Problem

1. create underlay subnet and set u2oInterconnection: true (with namespace of test)
2. create pod in namespace of test
3. ping above pod from node

# Additional Info

- Kubernetes version:

  **Output of `kubectl version`:**

  ```
 WARNING: This version information is deprecated and will be replaced with the output from kubectl version --short.  Use --output=yaml|json to get the full version.
Client Version: version.Info{Major:"1", Minor:"24", GitVersion:"v1.24.6", GitCommit:"b39bf148cd654599a52e867485c02c4f9d28b312", GitTreeState:"clean", BuildDate:"2022-09-21T13:19:24Z", GoVersion:"go1.18.6", Compiler:"gc", Platform:"linux/amd64"}
Kustomize Version: v4.5.4
Server Version: version.Info{Major:"1", Minor:"24", GitVersion:"v1.24.6", GitCommit:"b39bf148cd654599a52e867485c02c4f9d28b312", GitTreeState:"clean", BuildDate:"2022-09-21T13:12:04Z", GoVersion:"go1.18.6", Compiler:"gc", Platform:"linux/amd64"}
  ```

- kube-ovn version:
  
  ```
1.11.0
  ```

- operation-system/kernel version:
  
  **Output of `awk -F '=' '/PRETTY_NAME/ { print $2 }' /etc/os-release`:**
  **Output of `uname -r`:**
  ```
 Red Hat Enterprise Linux 8.7 (Ootpa)
4.18.0-425.3.1.el8.x86_64
  ```

If disable u2oInterconnection, ping works fine.

**Comment by changluyi** [comment]
> # Expected Behavior
> ping from node to underlay pod gets replied
> 
> # Actual Behavior
> no reply
> 
> # Steps to Reproduce the Problem
> 1. create underlay subnet and set u2oInterconnection: true (with namespace of test)
> 2. create pod in namespace of test
> 3. ping above pod from node
> 
> # Additional Info
> * Kubernetes version:
>   **Output of `kubectl version`:**
> 
> WARNING: This version information is deprecated and will be replaced with the output from kubectl version --short. Use --output=yaml|json to get the full version. Client Version: version.Info{Major:"1", Minor:"24", GitVersion:"v1.24.6", GitCommit:"b39bf148cd654599a52e867485c02c4f9d28b312", GitTreeState:"clean", BuildDate:"2022-09-21T13:19:24Z", GoVersion:"go1.18.6", Compiler:"gc", Platform:"linux/amd64"} Kustomize Version: v4.5.4 Server Version: version.Info{Major:"1", Minor:"24", GitVersion:"v1.24.6", GitCommit:"b39bf148cd654599a52e867485c02c4f9d28b312", GitTreeState:"clean", BuildDate:"2022-09-21T13:12:04Z", GoVersion:"go1.18.6", Compiler:"gc", Platform:"linux/amd64"}
> 
> ```
> 
> - kube-ovn version:
> ```
> 
> 1.11.0
> 
> ```
> 
> - operation-system/kernel version:
> 
> **Output of `awk -F '=' '/PRETTY_NAME/ { print $2 }' /etc/os-release`:**
> **Output of `uname -r`:**
> ```
> 
> Red Hat Enterprise Linux 8.7 (Ootpa) 4.18.0-425.3.1.el8.x86_64
> 
> ```
> 
> 
> 
> If disable u2oInterconnection, ping works fine.
> ```

please give detail information, because I can't reproduce the bug

1. ip route on node, the nexthop should be underlay subnet gateway

eg: 172.18.0.17 is the underlay pod
```
# ip r get 172.18.0.17
172.18.0.17 dev br-8ac9461a1c7a src 172.18.0.1
```

2. ip neigh on underlay gateway, there should be underlay pod's ip arp on it. 
```
# ip n |grep 172.18.0.17
172.18.0.17 dev br-8ac9461a1c7a lladdr 00:00:00:4c:93:bd STALE
```

3. tcpdump on your underlay pod, and see if the packets get into the pod

or  on the host nic for pod

```
# tcpdump -i 69cff00d2dbe_h -nel
tcpdump: verbose output suppressed, use -v[v]... for full protocol decode
listening on 69cff00d2dbe_h, link-type EN10MB (Ethernet), snapshot length 262144 bytes
```

4 see the ip route on underlay pod :
```
kubectl exec -it pod-underlay -- ip r
```

**Comment by liuzhen** [comment]
10.31.74.20 is the underlay pod
10.18.8.18 is the node

1. ip route on node, the nexthop should be underlay subnet gateway
```
[@node1 ~]# ip r get 10.31.74.20
10.31.74.20 via 10.18.11.254 dev br-network-v11 src 10.18.8.18 uid 0
    cache
```

2. ip neigh 
```
[@node1 ~]# ip n |grep 10.31.74.20
[@node1 ~]#
```

3. tcpdump on the underlay pod
```
[@node1 ~]# kubectl ko tcpdump test/test-pod-mirror -nn -v icmp
Defaulted container "cni-server" out of: cni-server, install-cni (init)
Defaulted container "cni-server" out of: cni-server, install-cni (init)
+ '[' veth-pair = internal-port ']'
+ kubectl exec kube-ovn-cni-p6c6m -n kube-system -- nsenter --net=/var/run/netns/cni-9578c974-8501-c9bb-3efe-1fcd5b8d9db9 tcpdump -nn -i eth0 -nn -v icmp
Defaulted container "cni-server" out of: cni-server, install-cni (init)
tcpdump: listening on eth0, link-type EN10MB (Ethernet), snapshot length 262144 bytes
11:59:27.029895 IP (tos 0x0, ttl 63, id 15783, offset 0, flags [DF], proto ICMP (1), length 84)
    10.18.8.18 > 10.31.74.20: ICMP echo request, id 213, seq 11, length 64
11:59:27.029928 IP (tos 0x0, ttl 64, id 55380, offset 0, flags [none], proto ICMP (1), length 84)
    10.31.74.20 > 10.18.8.18: ICMP echo reply, id 213, seq 11, length 64
```

on the host nic for pod
```
[@node3 ~]# tcpdump -i 7d07ef2b37ff_h -nn icmp
dropped privs to tcpdump
tcpdump: verbose output suppressed, use -v or -vv for full protocol decode
listening on 7d07ef2b37ff_h, link-type EN10MB (Ethernet), capture size 262144 bytes
12:11:32.101196 IP 10.18.8.18 > 10.31.74.20: ICMP echo request, id 214, seq 1, length 64
12:11:32.101246 IP 10.31.74.20 > 10.18.8.18: ICMP echo reply, id 214, seq 1, length 64
12:11:33.109915 IP 10.18.8.18 > 10.31.74.20: ICMP echo request, id 214, seq 2, length 64
12:11:33.109963 IP 10.31.74.20 > 10.18.8.18: ICMP echo reply, id 214, seq 2, length 64
12:11:34.133776 IP 10.18.8.18 > 10.31.74.20: ICMP echo request, id 214, seq 3, length 64
12:11:34.133817 IP 10.31.74.20 > 10.18.8.18: ICMP echo reply, id 214, seq 3, length 64
12:11:35.158774 IP 10.18.8.18 > 10.31.74.20: ICMP echo request, id 214, seq 4, length 64
12:11:35.158816 IP 10.31.74.20 > 10.18.8.18: ICMP echo reply, id 214, seq 4, length 64
```

4. tcpdump on the underlay subnet gateway
subnet gateway is managed by another team

5. ip route on underlay pod:
```
[@node1 ~]# kubectl exec -ti -n test test-pod-mirror -- ip r
default via 10.31.74.1 dev eth0
10.31.74.0/23 dev eth0 scope link  src 10.31.74.20
```

**Comment by changluyi** [comment]
1. it turns out that your underlay pod can receive packets from the node, and gives a reply.

can you tcpdump on your node gateway or underly subnet gateway, and find if is there any reply packet?

2. when you turn on the u2ointerconnection switch. you should reboot your underlay pod, your pod's default route will change nexthop to subnet.status.u2ointerconnectionIP
