### ISSUE TITLE
[BUG] loadbalancer type service default install example not working

### ISSUE THREAD

**Issue by pasztorl** [kubeovn/kube-ovn#5046]
### Kube-OVN Version

tested with latest 1.12 and 1.13

### Kubernetes Version

1.31.6

### Operation-system/Kernel Version

6.8.x

### Description

for testing i use nodes which have bond0(eth0,eth1) used by two vlan tagged interface one for private and second for public traffic.
after kube-ovn installed successfully I created a test loadbalancerIP service which not worked.

### Steps To Reproduce

kube-ovn installed with the default parameters then u used this link: https://kubeovn.github.io/docs/v1.12.x/en/guide/loadbalancer-service/

### Current Behavior

kube-ovn starts the loadbalancer pod and arping fails, then starting a retry loop.
i used tcpdump on the private interface which was assigned by the network attachement and seen the arping packets but no answer received.

log from the controller:
```
I0302 20:49:34.440308       7 service.go:331] handle update service default/test-service
I0302 20:49:34.474048       7 service_lb.go:316] add eip rules for lb svc pod, [172.18.0.18/16,172.18.0.1]
E0302 20:49:37.526286       7 service_lb.go:272] failed to ExecuteCommandInContainer, errOutput: failed to exec command "arping -f -c 3 -s 172.18.0.18 172.18.0.1"
E0302 20:49:37.526302       7 service_lb.go:277] command terminated with exit code 1
E0302 20:49:37.526306       7 service_lb.go:318] failed to add eip for pod, err: command terminated with exit code 1
E0302 20:49:37.526310       7 service.go:472] failed to update pod attachment network for lb svc default/test-service: command terminated with exit code 1
E0302 20:49:37.526324       7 service.go:238] error syncing 'default/test-service': command terminated with exit code 1, requeuing
```

tcpdump output on all nodes on the private interface like this:
```
20:48:40.116439 ARP, Request who-has 172.18.0.1 (ff:ff:ff:ff:ff:ff) tell 172.18.0.18, length 42
20:48:40.901879 IP6 fe80::f828:e3ff:feff:c058 > ff02::16: HBH ICMP6, multicast listener report v2, 1 group record(s), length 28
20:48:41.116434 ARP, Request who-has 172.18.0.1 (ff:ff:ff:ff:ff:ff) tell 172.18.0.18, length 42
20:48:42.159895 IP6 fe80::f828:e3ff:feff:c058 > ff02::16: HBH ICMP6, multicast listener report v2, 1 group record(s), length 28
20:48:42.198298 ARP, Request who-has 172.18.0.1 (ff:ff:ff:ff:ff:ff) tell 172.18.0.18, length 42
20:48:42.200877 IP6 fe80::f828:e3ff:feff:c058 > ff02::16: HBH ICMP6, multicast listener report v2, 1 group record(s), length 28
20:48:42.293888 IP6 fe80::f828:e3ff:feff:c058 > ff02::16: HBH ICMP6, multicast listener report v2, 1 group record(s), length 28
20:48:42.293888 IP6 fe80::f828:e3ff:feff:c058 > ff02::2: ICMP6, router solicitation, length 16
20:48:42.653897 IP6 fe80::f828:e3ff:feff:c058 > ff02::16: HBH ICMP6, multicast listener report v2, 1 group record(s), length 28
20:48:43.013886 IP6 fe80::f828:e3ff:feff:c058 > ff02::16: HBH ICMP6, multicast listener report v2, 1 group record(s), length 28
20:48:43.198323 ARP, Request who-has 172.18.0.1 (ff:ff:ff:ff:ff:ff) tell 172.18.0.18, length 42
20:48:44.198323 ARP, Request who-has 172.18.0.1 (ff:ff:ff:ff:ff:ff) tell 172.18.0.18, length 42
```

### Expected Behavior

since the two latest stable minor release works the same way in this test i guess i miss something.. what can i check for successfully debug this issue?
if i configure ip addresses to this interfaces the nodes see eachother, so i think this will be not a network hardware problem.

**Comment by oilbeater** [comment]
The log and tcpdump showed that the arping packet is not responded by the underlay gateway. You need to check the underlay network to check if the packet is sent to the gateway.
