### ISSUE TITLE
使用固定出口网关时，非网关节点容器hostPort 返回数据包被转发到 gateway 节点

### ISSUE THREAD

**Issue by Mrtao1028** [kubeovn/kube-ovn#681]
应该是因为设置了集中式出网网关， 导致非网关节点的 DNAT 返回数据包被转发到 网关节点 ， 
期望 应答的数据包 能原路返回

k8s node:
10.17.64.109   label: node-role=ingress-lb
10.17.64.128   label: node-role=ingress-lb
集群外验证节点:  10.17.64.134

测试yaml：
```yaml
kind: Deployment
apiVersion: apps/v1
metadata:
  namespace: kube-public
  name: gateway-check-nginx
  labels:
    app: gateway-check-nginx
spec:
  replicas: 2
  selector:
    matchLabels:
      app: gateway-check-nginx
  template:
    metadata:
      labels:
        app: gateway-check-nginx
    spec:
      affinity:
        nodeAffinity:
          requiredDuringSchedulingIgnoredDuringExecution:
            nodeSelectorTerms:
            - matchExpressions:
              - key: node-role
                operator: In
                values:
                - ingress-lb
      tolerations:
        - key: "node.kubernetes.io/unreachable"
          operator: "Exists"
          effect: "NoExecute"
          tolerationSeconds: 30
        - key: "node.kubernetes.io/not-ready"
          operator: "Exists"
          effect: "NoExecute"
          tolerationSeconds: 30
      containers:
        - name: nginx
          image: hub.2980.com/dockerhub/nginx:latest
          imagePullPolicy: IfNotPresent
          ports:
            - name: web
              containerPort: 80
              hostPort: 80
            - name: websecure
              containerPort: 443
              hostPort: 443
      dnsConfig:
        options:
          - name: ndots
            value: "2"
      dnsPolicy: ClusterFirstWithHostNet
```

curl http://10.17.64.109 应答正常
curl http://10.17.64.128 无应答
![image](https://user-images.githubusercontent.com/7741839/107483668-5b9d6f00-6bbc-11eb-9fe8-e38b389b79ab.png)

**10.17.64.128节点测试Pod tcpdump结果**：
```shell
$ kubectl ko tcpdump kube-public/gateway-check-nginx-9b976b96-xhdrk -vv 
tcpdump: listening on b09d238ab6ce_h, link-type EN10MB (Ethernet), capture size 262144 bytes
08:20:27.851161 IP (tos 0x0, ttl 62, id 24831, offset 0, flags [DF], proto TCP (6), length 60)
    10.17.64.134.52841 > 172.28.0.10.80: Flags [S], cksum 0xd34a (correct), seq 3431534812, win 14600, options [mss 1460,sackOK,TS val 682455075 ecr 0,nop,wscale 7], length 0
08:20:27.851196 IP (tos 0x0, ttl 64, id 0, offset 0, flags [DF], proto TCP (6), length 52)
    172.28.0.10.80 > 10.17.64.134.52841: Flags [S.], cksum 0xf6e3 (incorrect -> 0x4c2a), seq 1673114211, ack 3431534813, win 27200, options [mss 1360,nop,nop,sackOK,nop,wscale 7], length 0
08:20:28.847808 IP (tos 0x0, ttl 62, id 24832, offset 0, flags [DF], proto TCP (6), length 60)
    10.17.64.134.52841 > 172.28.0.10.80: Flags [S], cksum 0xd250 (correct), seq 3431534812, win 14600, options [mss 1460,sackOK,TS val 682455325 ecr 0,nop,wscale 7], length 0
08:20:28.847847 IP (tos 0x0, ttl 64, id 0, offset 0, flags [DF], proto TCP (6), length 52)
    172.28.0.10.80 > 10.17.64.134.52841: Flags [S.], cksum 0xf6e3 (incorrect -> 0x4c2a), seq 1673114211, ack 3431534813, win 27200, options [mss 1360,nop,nop,sackOK,nop,wscale 7], length 0
08:20:29.878122 IP (tos 0x0, ttl 64, id 0, offset 0, flags [DF], proto TCP (6), length 52)
    172.28.0.10.80 > 10.17.64.134.52841: Flags [S.], cksum 0xf6e3 (incorrect -> 0x4c2a), seq 1673114211, ack 3431534813, win 27200, options [mss 1360,nop,nop,sackOK,nop,wscale 7], length 0
08:20:30.851718 IP (tos 0x0, ttl 62, id 24833, offset 0, flags [DF], proto TCP (6), length 60)
    10.17.64.134.52841 > 172.28.0.10.80: Flags [S], cksum 0xd05b (correct), seq 3431534812, win 14600, options [mss 1460,sackOK,TS val 682455826 ecr 0,nop,wscale 7], length 0
08:20:30.851751 IP (tos 0x0, ttl 64, id 0, offset 0, flags [DF], proto TCP (6), length 52)
    172.28.0.10.80 > 10.17.64.134.52841: Flags [S.], cksum 0xf6e3 (incorrect -> 0x4c2a), seq 1673114211, ack 3431534813, win 27200, options [mss 1360,nop,nop,sackOK,nop,wscale 7], length 0
08:20:32.854168 IP (tos 0x0, ttl 64, id 0, offset 0, flags [DF], proto TCP (6), length 52)
```

**10.17.64.109 节点eth0 网卡tcpdump**
```shell
$ tcpdump tcp -i eth0 and dst net 10.17.64.134
tcpdump: verbose output suppressed, use -v or -vv for full protocol decode
listening on eth0, link-type EN10MB (Ethernet), capture size 262144 bytes
16:19:32.187634 IP 172.28.0.10.http > 10.17.64.134.52676: Flags [S.], seq 850335825, ack 1445902724, win 27200, options [mss 1360,nop,nop,sackOK,nop,wscale 7], length 0
16:19:33.186143 IP 172.28.0.10.http > 10.17.64.134.52676: Flags [S.], seq 850335825, ack 1445902724, win 27200, options [mss 1360,nop,nop,sackOK,nop,wscale 7], length 0
16:19:34.201593 IP 172.28.0.10.http > 10.17.64.134.52676: Flags [S.], seq 850335825, ack 1445902724, win 27200, options [mss 1360,nop,nop,sackOK,nop,wscale 7], length 0
16:19:35.189957 IP 172.28.0.10.http > 10.17.64.134.52676: Flags [S.], seq 850335825, ack 1445902724, win 27200, options [mss 1360,nop,nop,sackOK,nop,wscale 7], length 0
16:19:37.209434 IP 172.28.0.10.http > 10.17.64.134.52676: Flags [S.], seq 850335825, ack 1445902724, win 27200, options [mss 1360,nop,nop,sackOK,nop,wscale 7], length 0
16:19:39.194095 IP 172.28.0.10.http > 10.17.64.134.52676: Flags [S.], seq 850335825, ack 1445902724, win 27200, options [mss 1360,nop,nop,sackOK,nop,wscale 7], length 0
16:19:43.321148 IP 172.28.0.10.http > 10.17.64.134.52676: Flags [S.], seq 850335825, ack 1445902724, win 27200, options [mss 1360,nop,nop,sackOK,nop,wscale 7], length 0
16:19:47.210234 IP 172.28.0.10.http > 10.17.64.134.52676: Flags [S.], seq 850335825, ack 1445902724, win 27200, options [mss 1360,nop,nop,sackOK,nop,wscale 7], length 0
16:19:55.352440 IP 172.28.0.10.http > 10.17.64.134.52676: Flags [S.], seq 850335825, ack 1445902724, win 27200, options [mss 1360,nop,nop,sackOK,nop,wscale 7], length 0
```

**env**
os: debian 9.5
kernel: 4.9.0-13
k8s version: 1.17.9
kube-ovn version: 1.6.0

**Comment by oilbeater** [comment]
@Mrtao1028 可以将 kube-ovn-cni 更新成`kubeovn/kube-ovn:b3edefa6fab14ed45a7f43fd80ca535f1729d233-x86`
`iptables -t nat -nvL POSTROUTING` 会增加类似 ` 0     0 MASQUERADE  all  --  *      ovn0   !172.19.0.3           0.0.0.0/0` 的规则
看看能否解决这个问题

**Comment by oilbeater** [comment]
#682 相同问题导致

**Comment by Mrtao1028** [comment]
get

**Comment by Mrtao1028** [comment]
经验证， 问题已解决

> @Mrtao1028 可以将 kube-ovn-cni 更新成`kubeovn/kube-ovn:b3edefa6fab14ed45a7f43fd80ca535f1729d233-x86`
> `iptables -t nat -nvL POSTROUTING` 会增加类似 ` 0 0 MASQUERADE all -- * ovn0 !172.19.0.3 0.0.0.0/0` 的规则
> 看看能否解决这个问题
