### ISSUE TITLE
Overlay 下路由暴露容器网络问题

### ISSUE THREAD

**Issue by JavaCain** [kubeovn/kube-ovn#3414]
# Bug Report
kube-ovn v1.11.0，参考 [[Pod IP 直接对外暴露]](https://kubeovn.github.io/docs/v1.11.x/advance/overlay-with-route/) 文档验证集群外节点访问pod ip功能

## Expected Behavior
```
underlay网络：172.168.2.0/23 ， host：172.168.3.26
ovn-default（容器网络）：10.16.0.0/16 ， Pod IP：10.16.0.3
join：100.64.0.0/16 ， node1：100.64.0.2/172.168.2.214
routed（自定义subnet）：10.166.0.0/16， Pod IP：10.166.0.3
```
使用的是集中式网关方式
目标1：172.168.3.26能够ping通过PodIP
目标2：Pod也能ping通172.168.3.26

## Actual Behavior
目标1和目标2都失败
## Steps to Reproduce the Problem
```
NAME          PROVIDER   VPC           PROTOCOL   CIDR            PRIVATE   NAT     DEFAULT   GATEWAYTYPE   V4USED   V4AVAILABLE   V6USED   V6AVAILABLE   EXCLUDEIPS     U2OINTERCONNECTIONIP
join          ovn        ovn-cluster   IPv4       100.64.0.0/16   false     false   false     distributed   3        65530         0        0             [100.64.0.1]
net1          ovn        vpc-ns1       IPv4       10.0.20.0/24    false     false   false     centralized   1        252           0        0             [10.0.20.1]
net2          ovn        vpc-ns2       IPv4       10.0.21.0/24    false     false   false     distributed   1        252           0        0             [10.0.21.1]
ovn-default   ovn        ovn-cluster   IPv4       10.16.0.0/16    false     false   true      centralized   19       65514         0        0             [10.16.0.1]
routed        ovn        ovn-cluster   IPv4       10.166.0.0/16   false     false   false     centralized   1        65532         0        0             [10.166.0.1]
```

subnet配置
```
apiVersion: kubeovn.io/v1
kind: Subnet
metadata:
  annotations:
    ovn.kubernetes.io/bgp: "true"
  creationTimestamp: "2023-11-01T05:57:01Z"
  finalizers:
  - kube-ovn-controller
  generation: 18
  name: ovn-default
  resourceVersion: "3592978"
  selfLink: /apis/kubeovn.io/v1/subnets/ovn-default
  uid: bb14fcff-df3e-4b83-a644-e73cf32eacff
spec:
  cidrBlock: 10.16.0.0/16
  default: true
  excludeIps:
  - 10.16.0.1
  gateway: 10.16.0.1
  gatewayNode: coffeedatamaster-b17af
  gatewayType: centralized
  natOutgoing: false
  private: false
  protocol: IPv4
  provider: ovn
  vpc: ovn-cluster
```
underlay设备3.26的静态路由
```
10.0.20.0/24 via 172.168.2.214 dev eth0
10.0.21.0/24 via 172.168.2.214 dev eth0
10.16.0.0/16 via 172.168.2.214 dev eth0
10.17.0.0/16 via 172.168.2.191 dev eth0
10.166.0.0/16 via 172.168.2.214 dev eth0
```
np策略也尝试关闭，无效果
`--enable-np=false`

node节点已开启转发
```
cat /proc/sys/net/ipv4/ip_forward
1
```

tcpdump抓包
1、从host上ping Pod IP
在集中式网关上抓ovn0和eth0都是有回包
```
 tcpdump -ieth0 -nn -s0 icmp and host 10.16.0.3
tcpdump: verbose output suppressed, use -v or -vv for full protocol decode
listening on eth0, link-type EN10MB (Ethernet), capture size 262144 bytes
09:51:14.951382 IP 172.168.3.26 > 10.16.0.3: ICMP echo request, id 2984, seq 82, length 64
09:51:14.951727 IP 10.16.0.3 > 172.168.3.26: ICMP echo reply, id 2984, seq 82, length 64
09:51:15.975451 IP 172.168.3.26 > 10.16.0.3: ICMP echo request, id 2984, seq 83, length 64
09:51:15.975868 IP 10.16.0.3 > 172.168.3.26: ICMP echo reply, id 2984, seq 83, length 64
09:51:17.001002 IP 172.168.3.26 > 10.16.0.3: ICMP echo request, id 2984, seq 84, length 64
09:51:17.005136 IP 10.16.0.3 > 172.168.3.26: ICMP echo reply, id 2984, seq 84, length 64
09:51:18.023478 IP 172.168.3.26 > 10.16.0.3: ICMP echo request, id 2984, seq 85, length 64
09:51:18.023821 IP 10.16.0.3 > 172.168.3.26: ICMP echo reply, id 2984, seq 85, length 64
09:51:19.047395 IP 172.168.3.26 > 10.16.0.3: ICMP echo request, id 2984, seq 86, length 64
09:51:19.047811 IP 10.16.0.3 > 172.168.3.26: ICMP echo reply, id 2984, seq 86, length 64
```

在host上抓eth0是没有回包
```
tcpdump -ieth0 -nn -s0 icmp and host 10.16.0.3
tcpdump: verbose output suppressed, use -v or -vv for full protocol decode
listening on eth0, link-type EN10MB (Ethernet), capture size 262144 bytes
09:55:52.936017 IP 172.168.3.26 > 10.16.0.3: ICMP echo request, id 2984, seq 83, length 64
09:55:53.960033 IP 172.168.3.26 > 10.16.0.3: ICMP echo request, id 2984, seq 84, length 64
09:55:54.984048 IP 172.168.3.26 > 10.16.0.3: ICMP echo request, id 2984, seq 85, length 64
09:55:56.008045 IP 172.168.3.26 > 10.16.0.3: ICMP echo request, id 2984, seq 86, length 64
09:55:57.032004 IP 172.168.3.26 > 10.16.0.3: ICMP echo request, id 2984, seq 87, length 64
09:55:58.056069 IP 172.168.3.26 > 10.16.0.3: ICMP echo request, id 2984, seq 88, length 64
```

## Additional Info

- Kubernetes version:

  **Output of `kubectl version`:**

```
Client Version: version.Info{Major:"1", Minor:"17", GitVersion:"v1.17.5", GitCommit:"e0fccafd69541e3750d460ba0f9743b90336f24f", GitTreeState:"clean", BuildDate:"2020-04-16T11:44:03Z", GoVersion:"go1.13.9", Compiler:"gc", Platform:"linux/amd64"}
Server Version: version.Info{Major:"1", Minor:"17", GitVersion:"v1.17.5", GitCommit:"e0fccafd69541e3750d460ba0f9743b90336f24f", GitTreeState:"clean", BuildDate:"2020-04-16T11:35:47Z", GoVersion:"go1.13.9", Compiler:"gc", Platform:"linux/amd64"}
```

- kube-ovn version:
  

`kube-ovn v1.11.0`

- operation-system/kernel version:
  
  **Output of `awk -F '=' '/PRETTY_NAME/ { print $2 }' /etc/os-release`:**
  **Output of `uname -r`:**

  ```bash
  "H3Linux Release 1.1.0 (Core)"
  4.14.131-generic
  ```

请问除了文档中的配置，还有其他需要注意的地方么。

**Comment by zhangzujian** [comment]
1. 检查网关节点能否 ping 通 host 172.168.3.26；
2. 检查 172.168.3.26 上的 rp_filter： sysctl -a | grep rp_filter。

**Comment by JavaCain** [comment]
1、能ping通的
2、
`net.ipv4.conf.32a7a9fe95ff_h.arp_filter = 0
net.ipv4.conf.32a7a9fe95ff_h.rp_filter = 1
net.ipv4.conf.4ba303419406_h.arp_filter = 0
net.ipv4.conf.4ba303419406_h.rp_filter = 1
net.ipv4.conf.a406ccbf9edc_h.arp_filter = 0
net.ipv4.conf.a406ccbf9edc_h.rp_filter = 1
net.ipv4.conf.all.arp_filter = 0
net.ipv4.conf.all.rp_filter = 0
net.ipv4.conf.br-int.arp_filter = 0
net.ipv4.conf.br-int.rp_filter = 1
net.ipv4.conf.da46c335a87f_h.arp_filter = 0
net.ipv4.conf.da46c335a87f_h.rp_filter = 1
net.ipv4.conf.default.arp_filter = 0
net.ipv4.conf.default.rp_filter = 1
net.ipv4.conf.docker0.arp_filter = 0
net.ipv4.conf.docker0.rp_filter = 1
net.ipv4.conf.dummy0.arp_filter = 0
net.ipv4.conf.dummy0.rp_filter = 1
net.ipv4.conf.eth0.arp_filter = 0
net.ipv4.conf.eth0.rp_filter = 1
net.ipv4.conf.f194aa747256_h.arp_filter = 0
net.ipv4.conf.f194aa747256_h.rp_filter = 1
net.ipv4.conf.genev_sys_6081.arp_filter = 0
net.ipv4.conf.genev_sys_6081.rp_filter = 1
net.ipv4.conf.kube-ipvs0.arp_filter = 0
net.ipv4.conf.kube-ipvs0.rp_filter = 1
net.ipv4.conf.lo.arp_filter = 0
net.ipv4.conf.lo.rp_filter = 0
net.ipv4.conf.mirror0.arp_filter = 0
net.ipv4.conf.mirror0.rp_filter = 1
net.ipv4.conf.nodelocaldns.arp_filter = 0
net.ipv4.conf.nodelocaldns.rp_filter = 1
net.ipv4.conf.ovn0.arp_filter = 0
net.ipv4.conf.ovn0.rp_filter = 1
net.ipv4.conf.ovs-system.arp_filter = 0
net.ipv4.conf.ovs-system.rp_filter = 1
sysctl: reading key "net.ipv6.conf.32a7a9fe95ff_h.stable_secret"
sysctl: reading key "net.ipv6.conf.4ba303419406_h.stable_secret"
sysctl: reading key "net.ipv6.conf.a406ccbf9edc_h.stable_secret"
sysctl: reading key "net.ipv6.conf.all.stable_secret"
sysctl: reading key "net.ipv6.conf.br-int.stable_secret"
sysctl: reading key "net.ipv6.conf.da46c335a87f_h.stable_secret"
sysctl: reading key "net.ipv6.conf.default.stable_secret"
sysctl: reading key "net.ipv6.conf.docker0.stable_secret"
sysctl: reading key "net.ipv6.conf.dummy0.stable_secret"
sysctl: reading key "net.ipv6.conf.eth0.stable_secret"
sysctl: reading key "net.ipv6.conf.f194aa747256_h.stable_secret"
sysctl: reading key "net.ipv6.conf.genev_sys_6081.stable_secret"
sysctl: reading key "net.ipv6.conf.kube-ipvs0.stable_secret"
sysctl: reading key "net.ipv6.conf.lo.stable_secret"
sysctl: reading key "net.ipv6.conf.mirror0.stable_secret"
sysctl: reading key "net.ipv6.conf.nodelocaldns.stable_secret"
sysctl: reading key "net.ipv6.conf.ovn0.stable_secret"
sysctl: reading key "net.ipv6.conf.ovs-system.stable_secret"
`

**Comment by JavaCain** [comment]
这是3.26的，上面是网关的

```
net.ipv4.conf.all.arp_filter = 0
net.ipv4.conf.all.rp_filter = 1
net.ipv4.conf.cni0.arp_filter = 0
net.ipv4.conf.cni0.rp_filter = 1
net.ipv4.conf.default.arp_filter = 0
net.ipv4.conf.default.rp_filter = 1
net.ipv4.conf.docker0.arp_filter = 0
net.ipv4.conf.docker0.rp_filter = 1
net.ipv4.conf.dummy0.arp_filter = 0
net.ipv4.conf.dummy0.rp_filter = 1
net.ipv4.conf.eth0.arp_filter = 0
net.ipv4.conf.eth0.rp_filter = 1
net.ipv4.conf.flannel/1.arp_filter = 0
net.ipv4.conf.flannel/1.rp_filter = 1
net.ipv4.conf.kube-ipvs0.arp_filter = 0
net.ipv4.conf.kube-ipvs0.rp_filter = 1
net.ipv4.conf.lo.arp_filter = 0
net.ipv4.conf.lo.rp_filter = 0
net.ipv4.conf.nodelocaldns.arp_filter = 0
net.ipv4.conf.nodelocaldns.rp_filter = 1
net.ipv4.conf.veth5908b170.arp_filter = 0
net.ipv4.conf.veth5908b170.rp_filter = 1
net.ipv4.conf.veth613e3106.arp_filter = 0
net.ipv4.conf.veth613e3106.rp_filter = 1
net.ipv4.conf.veth98ec004b.arp_filter = 0
net.ipv4.conf.veth98ec004b.rp_filter = 1
net.ipv4.conf.vethbbf0944.arp_filter = 0
net.ipv4.conf.vethbbf0944.rp_filter = 1
net.ipv4.conf.vethc2cb012d.arp_filter = 0
net.ipv4.conf.vethc2cb012d.rp_filter = 1
sysctl: reading key "net.ipv6.conf.all.stable_secret"
sysctl: reading key "net.ipv6.conf.cni0.stable_secret"
sysctl: reading key "net.ipv6.conf.default.stable_secret"
sysctl: reading key "net.ipv6.conf.docker0.stable_secret"
sysctl: reading key "net.ipv6.conf.dummy0.stable_secret"
sysctl: reading key "net.ipv6.conf.eth0.stable_secret"
sysctl: reading key "net.ipv6.conf.flannel/1.stable_secret"
sysctl: reading key "net.ipv6.conf.kube-ipvs0.stable_secret"
sysctl: reading key "net.ipv6.conf.lo.stable_secret"
sysctl: reading key "net.ipv6.conf.nodelocaldns.stable_secret"
sysctl: reading key "net.ipv6.conf.veth5908b170.stable_secret"
sysctl: reading key "net.ipv6.conf.veth613e3106.stable_secret"
sysctl: reading key "net.ipv6.conf.veth98ec004b.stable_secret"
sysctl: reading key "net.ipv6.conf.vethbbf0944.stable_secret"
sysctl: reading key "net.ipv6.conf.vethc2cb012d.stable_secret"

```

**Comment by JavaCain** [comment]
我把net.ipv4.conf.eth0.rp_filter 设置为0或2，也不行

**Comment by zhangzujian** [comment]
检查一下防火墙之类的外部网络设施。
