### ISSUE TITLE
[BUG] Unecessary static source route created for subnet to default gateway

### ISSUE THREAD

**Issue by cruickshankpg** [kubeovn/kube-ovn#5490]
### Kube-OVN Version

v1.14.1

### Kubernetes Version

v1.28.6

### Operation-system/Kernel Version

"Ubuntu 22.04.5 LTS" 5.15.0-143-generic

### Description

The controller now adds a source static route for a subnet on it's logical router for the subnet's CIDR to the gateway, i.e. src 10.0.0.0/24 nexthop 10.0.0.1.  Firstly this seems redundant and secondly it interferes with our  configured static routes. 

The src route eventually gets configured as a flow in ovnsb with priority 1 which clashes with our dst 0.0.0.0/0 route that also gets priority 1. This leads to undefined behaviour in OVS. Sometimes we see traffic working, other times we see only ARPs like:

```
16:22:45.701876 ARP, Request who-has 10.0.0.1 tell 10.0.0.1, length 28
16:22:46.701278 ARP, Request who-has 10.0.0.1 tell 10.0.0.1, length 28
16:22:47.701535 ARP, Request who-has 10.0.0.1 tell 10.0.0.1, length 28
```

It looks like the change was made in https://github.com/kubeovn/kube-ovn/pull/5260 to create this route but I don't understand the context enough to propose a fix.

### Steps To Reproduce

I've not managed to reliably trigger the source route to take precedence over the destination route but you can see the clashing flows in ovn-sb.

Create a VPC:

```
apiVersion: kubeovn.io/v1
kind: Vpc
metadata:
  name: my-vpc
spec:
  staticRoutes:
  - bfdId: ""
    cidr: 0.0.0.0/0
    ecmpMode: ""
    nextHopIP: 10.0.0.254
    policy: policyDst
    routeTable: ""
```

Create a subnet:

```
apiVersion: kubeovn.io/v1
kind: Subnet
metadata:
  name: my-subnet
spec:
  cidrBlock: 10.0.0.0/24
  default: false
  disableGatewayCheck: true
  enableLb: true
  excludeIps:
  - 10.0.0.1
  gateway: 10.0.0.1
  gatewayNode: ""
  natOutgoing: false
  private: false
  protocol: IPv4
  provider: my-subnet.my-ns.ovn
  vpc: my-vpc
```

Check ovn-sb:
`ksbctl find logical_flow logical_datapath=<router datapath id> table_id=13`

```
_uuid               : a4d433f0-df41-4f7d-9114-78726f897f74
actions             : "ip.ttl--; reg8[0..15] = 0; reg0 = 10.0.0.1; reg1 = 10.0.0.1; eth.src = 6e:61:d8:b2:01:04; outport = \"my-vpc-my-subnet\"; flags.loopback = 1; next;"
controller_meter    : []
external_ids        : {source="northd.c:11546", stage-hint="0417ae19", stage-name=lr_in_ip_routing}
logical_datapath    : 25a0acd8-6ff0-4001-9a3e-560c48d51abf
logical_dp_group    : []
match               : "ip4.src == 10.0.0.0/24"
pipeline            : ingress
priority            : 1
table_id            : 13
tags                : {}
hash                : 0

_uuid               : 0ba1e81c-a312-498b-9e83-349ab94d5a56
actions             : "ip.ttl--; reg8[0..15] = 0; reg0 = 10.0.0.254; reg1 = 10.0.0.1; eth.src = 6e:61:d8:b2:01:04; outport = \"my-vpc-my-subnet\"; flags.loopback = 1; next;"
controller_meter    : []
external_ids        : {source="northd.c:11546", stage-hint="10697587", stage-name=lr_in_ip_routing}
logical_datapath    : 25a0acd8-6ff0-4001-9a3e-560c48d51abf
logical_dp_group    : []
match               : "reg7 == 0 && ip4.dst == 0.0.0.0/0"
pipeline            : ingress
priority            : 1
table_id            : 13
tags                : {}
hash                : 0
```

### Current Behavior

source route 10.0.0.0/24 next hop 10.0.0.1 is configured

### Expected Behavior

no source route configured

**Comment by zhangzujian** [comment]
VPC Egress Gateway needs the static routes because to make logical router policies work as expected. We suggest you to migrate static routes to `policyRoutes`:

```yaml
apiVersion: kubeovn.io/v1
kind: Vpc
metadata:
  name: my-vpc
spec:
  policyRoutes:
  - priority: 31100
    match: "ip4.dst == 0.0.0.0/0"
    action: "reroute"
    nextHopIP: "10.0.0.254"
```

**Comment by cruickshankpg** [comment]
why does an egress gateway need this route? I don't understand how it would help unless the egress gateway address is the same as the lrp's address

**Comment by zhangzujian** [comment]
VPC Egress Gateway needs LR policy route to:

1. Select workloads via namespace/pod labels;
2. Implement `Local` traffic policy.

**Comment by cruickshankpg** [comment]
But why does every VPC now need this static route, even when there isn't an egress gateway configured?

There are two major consequences of moving to use a policy route for the default route instead of a static route for us:
- we need to change all of our other static routes to be policy routes to prevent the 0.0.0.0/0 policy route that occurs in a later table overwriting the result of static routing
- we can no longer do ECMP routes because as far as I can tell kubeovn policy routes don't support multiple nexthops

**Comment by SkalaNetworks** [comment]
Policy routing doesn't look as flexible in certain aspects. We use one routing table per Subnet in a VPC, so that we can inject a default route (0.0.0.0/0) to a NAT gateway in each VPC.

**Comment by SkalaNetworks** [comment]
@zhangzujian what happens if the Subnet uses a custom route_table? I have one NAT GW per Subnet in a VPC, and each Subnet has its own route_table.

Each table contains a route "0.0.0.0/0 -> IP-OF-NAT-GW" so that the traffic from one subnet isn't accidentally forwarded to another.

But the  logical_router_static_route of Egress GWs are not added to the table in question:

<img width="515" height="144" alt="Image" src="https://github.com/user-attachments/assets/e7cf8d0a-f415-45f8-8ccd-13dd9ebc8424" />

Also, I still don't really understand how the policy works in regards to the egress gateway:

> 
>  1. Select workloads via namespace/pod labels;
>  2. Implement Local traffic policy.

I didn't read the PR too much, how is the route helping those features? Can we replace it with something else to avoid collisions?

**Comment by cruickshankpg** [comment]
Reading the code, it doesn't look like the VPC egress gateway explicitly needs this static route. It just needs a static route to exist and match traffic so that the traffic is not dropped by the logical router before it gets to policy routing.

Instead of the subnet always creating a static route on the VPC, could the VPC egress gateway create a 0.0.0.0/0 to the router address of the internal subnet instead? It could be an ECMP route so that multiple VPC egress gateways don't fight over managing a single 0.0.0.0 route.

It makes sense for the VPC egress gateway to create routes if you've configured it but routes shouldn't be added if it's not in use.

**Comment by cruickshankpg** [comment]
Or could there be a config field to disable this behaviour?

**Comment by isabelleatkins** [comment]
Hi, any thoughts on moving this static route to being created by VPC egress gateways instead?

This static route is conflicting with one of my deployment's static routes - which I can't replace with a policy route as I need to specify the output port, which I can do with a static route and can't with a policy route.

**Comment by oilbeater** [comment]
> The src route eventually gets configured as a flow in ovnsb with priority 1 which clashes with our dst 0.0.0.0/0 route that also gets priority 1.

What if the source route were given a higher priority? Currently, the source static route has a hardcoded priority of 1 due to some legacy implementation handling centralized and distributed gateways. Since we've already moved this functionality to policy routing, I believe we can remove this hardcoded value. @zhangzujian @cruickshankpg

**Comment by isabelleatkins** [comment]
Hi @oilbeater that won't solve the problem for us - it resolves there being a clash, but the static route configured here in this new default behaviour will still override the dst 0.0.0.0/0 route, since it has a smaller mask and so a higher priority. Though I think removing that patch would be good to let OVN handle the prioritisation in the expected way, if you're saying its no longer needed/legacy.

And we can't move to use priority rules from static rules - they're less flexible, and don't offer the features we need.

Can we revisit a) if creating this static route can be created by VPC egress gateways instead, since thats what its required for, or, b) adding a config field so that we can disable this behaviour?

**Comment by oilbeater** [comment]
@zhangzujian what about only creating the static route when egress gateway is created and we set it to a lower priority?

**Comment by isabelleatkins** [comment]
Since this is blocking my ability to use kube-ovn, I'll plan to fork the project next week to address this issue if there's no response by then. Let me know if there's a way I can help move this forward in the meantime. @oilbeater @zhangzujian

**Comment by oilbeater** [comment]
@isabelleatkins We're currently on National Day holiday, so messages may not be processed promptly. I plan to address this issue after the holiday by only generating static routes when the egress gateway is created. If you have time, you could also handle it this way.

**Comment by isabelleatkins** [comment]
Thanks for the update @oilbeater - sounds good.

**Comment by oilbeater** [comment]
After further investigation, I found that in the master branch, the priority of the destination route is 4, which does not conflict with the source route. This is because the master branch uses the latest version of OVN, which changed the default route priority. I have now cherry-picked that change into the release-1.14 branch.

**Comment by cruickshankpg** [comment]
I think `9ee66bd91be65605cffb9a490b4dba3bc13358e9` needs to be updated so /32s & /128s get a higher priority otherwise they'll never get used. I think they could be `(plen * ROUTE_PRIO_OFFSET_MULTIPLIER)`

**Comment by oilbeater** [comment]
You are correct. The /32 & /128 src priority should also be updated at least higher than the /0 dst route priority to make EIP work. I will update it soon.
