### ISSUE TITLE
[Feature Request] Seeking solution for serverless pod scaling (0->1) with VIP monitoring in custom VPC environment.

### ISSUE THREAD

**Issue by MuNeNICK** [kubeovn/kube-ovn#4726]
### Description

Deer Community

I'm working on building a serverless system that can scale pods from zero to one within a custom VPC.

While Knative and KEDA are popular solutions for serverless scaling, I'm concerned that they may not work well in my custom VPC setup since they rely on Kubernetes `Service`.

I'm looking into Kube-OVN's VIP (Virtual IP) functionality as an alternative. What I'd like to do is:

1. Monitor HTTP traffic to these VIPs (like Cilium/Hubble?)
2. Generate notifications when HTTP traffic is detected
3. Use this to trigger pod scaling

Does Kube-OVN have any features for monitoring VIPs in this way? Alternatively, are there any solutions to make KEDA work within a custom VPC?

For context, I'm using OVN-style EIP and FIP configurations.

Any guidance on this would be appreciated!

![serverless drawio](https://github.com/user-attachments/assets/2e85ba78-2522-4ffd-a629-7597c7f99efb)

**Comment by bobz965** [comment]
It seems the `ovn eip and its vip` is settled first, using Cilium/Hubble to monitor the eip (HTTP) traffic on the vpc lrp located chassis node, once the traffic is detected, trigger the pod creation.

**Comment by oilbeater** [comment]
If you use vpc-nat-gateway, there is a pod to serve the eip and fip so you can add some detect program in the pod. This way might be much easier.

**Comment by MuNeNICK** [comment]
> It seems the `ovn eip and its vip` is set first, using Cilium/Hubble to monitor the eip (HTTP) traffic on the vpc lrp located chassis node, once the traffic is detected, trigger the pod creation.

@bobz965 
Thank you for your response. I performed monitoring in Hubble as follows:
```
root@mni-test:/home/mune# kubectl get vip
NAME           V4IP       V6IP   MAC                 PMAC   SUBNET         READY   TYPE
test-fip-vip   10.0.1.9          7a:7c:76:5d:32:2e          vpc1-subnet1   true    
root@mni-test:/home/mune# 
root@mni-test:/home/mune# kubectl get ofip
NAME          VPC    V4EIP          V4IP       READY   IPTYPE   IPNAME
eip-for-vip   vpc1   192.168.0.56   10.0.1.9   true    vip      test-fip-vip
eip-static    vpc1   192.168.0.53   10.0.1.2   true             vpc1-pod.vpc1
root@mni-test:/home/mune# 
root@mni-test:/home/mune# curl 192.168.0.56 #Sending HTTP request from node
^C
root@mni-test:/home/mune# 
root@mni-test:/home/mune# kubectl exec -it -n vpc1 vpc1-pod -- sh
/ # curl 192.168.0.56 #Sending HTTP request from inside a VPC Pod (vpc1-pod)
```

As a result, hubble observe was only able to monitor HTTP requests sent from vpc1-pod (Egress Traffic). (The log below only shows Egress from vpc1-pod)
```
root@mni-test:/home/mune/test-vm# hubble observe --all -f --not --pod kube-system/kube-ovn-pinger-b8dbz --not --pod kube-system/coredns-576bfc4dc7-qg58r --not --pod kube-system/metrics-server-557ff575fb-h5sdk --not --pod kube-system/hubble-ui-59bb4cb67b-d428k --not --pod kube-system/hubble-relay-86cd879b55-2smpv --not --pod kube-system/local-path-provisioner-86f46b7bf7-zthdz
Nov 14 00:54:51.218: vpc1/vpc1-pod:56354 (ID:20160) -> 192.168.0.56:80 (world) to-stack FORWARDED (TCP Flags: SYN)
Nov 14 00:54:58.276: vpc1/vpc1-pod:56354 (ID:20160) -> 192.168.0.56:80 (world) to-stack FORWARDED (TCP Flags: SYN)
Nov 14 00:55:06.468: vpc1/vpc1-pod:56354 (ID:20160) -> 192.168.0.56:80 (world) to-stack FORWARDED (TCP Flags: SYN)
```

In actual operations, we expect access from multiple unspecified sources, so monitoring Ingress traffic will be necessary. Is it possible to monitor Ingress traffic?

**Comment by MuNeNICK** [comment]
> If you use vpc-nat-gateway, there is a pod to serve the eip and fip so you can add some detect program in the pod. This way might be much easier.

@oilbeater 
Thank you for your response. Indeed, I agree that vpc-nat-gateway could meet these requirements.
However, we are particularly interested in the OVN-based EIP approach. We want to provide IaaS to customers on a namespace basis, and we anticipate this to be at a large scale. In this case, we believe the OVN-based approach would be more optimal than the iptables-based method.
If possible, we would like to meet these requirements using the OVN-based approach. (If this proves impossible, we will reconsider the iptables-based method.)

**Comment by bobz965** [comment]
I suggest you config an ip in the br-provider， then you can ping the pod ofip from the br-provider， i think you can see the packet into the ofip pod.

**Comment by MuNeNICK** [comment]
> I suggest you config an ip in the br-provider， then you can ping the pod ofip from the br-provider， i think you can see the packet into the ofip pod.

Thank you. 

Is br-provider the Bridge interface that is created when setting up the Underlay network? In that case, it exists(br-external) as shown below and is assigned as the Node's IP address.

```
2: eth0: <BROADCAST,MULTICAST,UP,LOWER_UP> mtu 1500 qdisc mq master ovs-system state UP group default qlen 1000
    link/ether 00:15:5d:00:7d:02 brd ff:ff:ff:ff:ff:ff
    inet6 fe80::215:5dff:fe00:7d02/64 scope link 
       valid_lft forever preferred_lft forever
3: ovs-system: <BROADCAST,MULTICAST> mtu 1500 qdisc noop state DOWN group default qlen 1000
    link/ether ea:94:ed:bc:18:dc brd ff:ff:ff:ff:ff:ff
4: mirror0: <BROADCAST,MULTICAST,UP,LOWER_UP> mtu 1400 qdisc noqueue state UNKNOWN group default qlen 1000
    link/ether ba:c0:83:63:c0:cb brd ff:ff:ff:ff:ff:ff
    inet6 fe80::b8c0:83ff:fe63:c0cb/64 scope link 
       valid_lft forever preferred_lft forever
5: ovn0: <BROADCAST,MULTICAST,UP,LOWER_UP> mtu 1400 qdisc noqueue state UNKNOWN group default qlen 1000
    link/ether aa:7e:1b:de:c6:e9 brd ff:ff:ff:ff:ff:ff
    inet 100.64.0.2/16 brd 100.64.255.255 scope global ovn0
       valid_lft forever preferred_lft forever
    inet6 fe80::a87e:1bff:fede:c6e9/64 scope link 
       valid_lft forever preferred_lft forever
6: br-int: <BROADCAST,MULTICAST> mtu 1400 qdisc noop state DOWN group default qlen 1000
    link/ether 66:ff:5b:5a:7e:fa brd ff:ff:ff:ff:ff:ff
7: br-external: <BROADCAST,MULTICAST,UP,LOWER_UP> mtu 1500 qdisc noqueue state UNKNOWN group default qlen 1000
    link/ether 00:15:5d:00:7d:02 brd ff:ff:ff:ff:ff:ff
    inet 192.168.0.16/24 brd 192.168.0.255 scope global br-external
       valid_lft forever preferred_lft forever
    inet6 2001:f70:1f20:2b00:215:5dff:fe00:7d02/64 scope global mngtmpaddr noprefixroute 
       valid_lft forever preferred_lft forever
    inet6 fe80::215:5dff:fe00:7d02/64 scope link 
       valid_lft forever preferred_lft forever
```

＜details＞
＜summary＞ProviderNetwork Setting's yaml＜/summary＞

```
apiVersion: kubeovn.io/v1
kind: ProviderNetwork
metadata:
  name: external
  namespace: vpc1
spec:
  defaultInterface: eth0
---
apiVersion: kubeovn.io/v1
kind: Vlan
metadata:
  name: vlan0
spec:
  id: 0
  provider: external
---
apiVersion: kubeovn.io/v1
kind: Subnet
metadata:
  name: external
spec:
  protocol: IPv4
  cidrBlock: 192.168.0.0/24
  gateway: 192.168.0.254
  vlan: vlan0
  excludeIps:
  - 192.168.0.1..192.168.0.50
  - 192.168.0.80..192.168.0.254
```

＜/details＞



Additionally, when sending ICMP and HTTP requests from the node to the nginx pod (vpc1-pod) via oeip, monitoring is possible using hubble observe.

```
root@mni-test:/home/mune# ping 192.168.53
PING 192.168.53 (192.168.0.53) 56(84) bytes of data.
64 bytes from 192.168.0.53: icmp_seq=1 ttl=63 time=2.17 ms
64 bytes from 192.168.0.53: icmp_seq=2 ttl=63 time=1.34 ms
64 bytes from 192.168.0.53: icmp_seq=3 ttl=63 time=0.123 ms
64 bytes from 192.168.0.53: icmp_seq=4 ttl=63 time=0.086 ms
64 bytes from 192.168.0.53: icmp_seq=5 ttl=63 time=0.102 ms
64 bytes from 192.168.0.53: icmp_seq=6 ttl=63 time=0.068 ms
^C
--- 192.168.53 ping statistics ---
6 packets transmitted, 6 received, 0% packet loss, time 5054ms
rtt min/avg/max/mdev = 0.068/0.649/2.174/0.820 ms
root@mni-test:/home/mune# 
root@mni-test:/home/mune# 
root@mni-test:/home/mune# 
root@mni-test:/home/mune# curl 192.168.0.53
<!DOCTYPE html>
<html>
<head>
<title>Welcome to nginx!</title>
<style>
html { color-scheme: light dark; }
body { width: 35em; margin: 0 auto;
font-family: Tahoma, Verdana, Arial, sans-serif; }
</style>
</head>
<body>
<h1>Welcome to nginx!</h1>
<p>If you see this page, the nginx web server is successfully installed and
working. Further configuration is required.</p>

<p>For online documentation and support please refer to
<a href="http://nginx.org/">nginx.org</a>.<br/>
Commercial support is available at
<a href="http://nginx.com/">nginx.com</a>.</p>

<p><em>Thank you for using nginx.</em></p>
</body>
</html>
root@mni-test:/home/mune# 
```

```
root@mni-test:/home/mune/test-vm# hubble observe --all -f --not --pod kube-system/kube-ovn-pinger-b8dbz --not --pod kube-system/coredns-576bfc4dc7-qg58r --not --pod kube-system/metrics-server-557ff575fb-h5sdk --not --pod kube-system/hubble-ui-59bb4cb67b-d428k --not --pod kube-system/hubble-relay-86cd879b55-2smpv --not --pod kube-system/local-path-provisioner-86f46b7bf7-zthdz
Nov 14 02:32:48.870: 192.168.0.16 (host) -> vpc1/vpc1-pod (ID:20160) to-endpoint FORWARDED (ICMPv4 EchoRequest)
Nov 14 02:32:48.870: 192.168.0.16 (host) <- vpc1/vpc1-pod (ID:20160) to-stack FORWARDED (ICMPv4 EchoReply)
Nov 14 02:32:59.379: 192.168.0.16:39480 (host) -> vpc1/vpc1-pod:80 (ID:20160) to-endpoint FORWARDED (TCP Flags: SYN)
Nov 14 02:32:59.379: 192.168.0.16:39480 (host) <- vpc1/vpc1-pod:80 (ID:20160) to-stack FORWARDED (TCP Flags: SYN, ACK)
Nov 14 02:32:59.380: 192.168.0.16:39480 (host) -> vpc1/vpc1-pod:80 (ID:20160) to-endpoint FORWARDED (TCP Flags: ACK, PSH)
Nov 14 02:32:59.380: 192.168.0.16:39480 (host) <- vpc1/vpc1-pod:80 (ID:20160) to-stack FORWARDED (TCP Flags: ACK, PSH)
Nov 14 02:32:59.380: 192.168.0.16:39480 (host) -> vpc1/vpc1-pod:80 (ID:20160) to-endpoint FORWARDED (TCP Flags: ACK, FIN)
Nov 14 02:32:59.380: 192.168.0.16:39480 (host) <- vpc1/vpc1-pod:80 (ID:20160) to-stack FORWARDED (TCP Flags: ACK, FIN)
Nov 14 02:32:59.380: 192.168.0.16:39480 (host) -> vpc1/vpc1-pod:80 (ID:20160) to-endpoint FORWARDED (TCP Flags: ACK)
```

However, when attempting the same with a VIP's oeip that isn't assigned to any Pod, monitoring is not possible.

```
root@mni-test:/home/mune# ping 192.168.0.56
PING 192.168.0.56 (192.168.0.56) 56(84) bytes of data.
^C
--- 192.168.0.56 ping statistics ---
17 packets transmitted, 0 received, 100% packet loss, time 16387ms

root@mni-test:/home/mune#
root@mni-test:/home/mune# curl 192.168.0.56
curl: (28) Failed to connect to 192.168.0.56 port 80 after 129631 ms: Connection timed out
root@mni-test:/home/mune#
```

```
root@mni-test:/home/mune/test-vm# hubble observe --all -f --not --pod kube-system/kube-ovn-pinger-b8dbz --not --pod kube-system/coredns-576bfc4dc7-qg58r --not --pod kube-system/metrics-server-557ff575fb-h5sdk --not --pod kube-system/hubble-ui-59bb4cb67b-d428k --not --pod kube-system/hubble-relay-86cd879b55-2smpv --not --pod kube-system/local-path-provisioner-86f46b7bf7-zthdz

# Nothing is displayed.
```

Does this mean that Hubble can only monitor traffic that passes through Pods?
Is there a way to resolve this issue?

**Comment by bobz965** [comment]
yeah, br-provider is your br-external. 

we tested: if you set the VIP to a real pod, you will see the TCP HTTP packets.

if the VIP is not set to a real pod, can you see the ARP packets in the VPC LRP located node?   can you use the ARP packets?

**Comment by MuNeNICK** [comment]
> if the VIP is not set to a real pod, can you see the ARP packets in the VPC LRP located node? can you use the ARP packets?

I am conducting verification on a single node using k3s. I am running this on the node where the vpc lrp is located.

<details>
<summary>Node Detail</summary>

```
root@mni-test:/home/mune# hostname
mni-test
root@mni-test:/home/mune# kubectl-ko sbctl show
Chassis "bce2439e-04c6-492d-8c8e-26b688761c33"
    hostname: mni-test
    Encap geneve
        ip: "192.168.0.16"
        options: {csum="true"}
    Port_Binding vpc1-pod.vpc1
    Port_Binding hubble-ui-59bb4cb67b-d428k.kube-system
    Port_Binding coredns-576bfc4dc7-qg58r.kube-system
    Port_Binding cr-ovn-cluster-external
    Port_Binding nginx-deployment-576c6b7b6-pxdzm.vpc1
    Port_Binding metrics-server-557ff575fb-h5sdk.kube-system
    Port_Binding local-path-provisioner-86f46b7bf7-zthdz.kube-system
    Port_Binding hubble-relay-86cd879b55-2smpv.kube-system
    Port_Binding cr-vpc1-external
    Port_Binding node-mni-test
    Port_Binding kube-ovn-pinger-b8dbz.kube-system
root@mni-test:/home/mune# kubectl-ko nbctl show vpc1
router 4cc13f01-d4f2-4688-9648-94cf3c947fbf (vpc1)
    port vpc1-vpc1-subnet1
        mac: "22:a3:79:b2:08:73"
        networks: ["10.0.1.1/24"]
    port vpc1-external
        mac: "8a:85:b0:3a:a0:ef"
        networks: ["192.168.0.52/24"]
        gateway chassis: [bce2439e-04c6-492d-8c8e-26b688761c33]
    nat 19722980-d735-41fe-beae-e007a0456530
        external ip: "192.168.0.56"
        logical ip: "10.0.1.9"
        type: "dnat_and_snat"
    nat de279e0b-8b5b-4798-b2ed-7f2717a15ac6
        external ip: "192.168.0.53"
        logical ip: "10.0.1.2"
        type: "dnat_and_snat"
root@mni-test:/home/mune# 
  
```

</details>

The results of arping are as follows:
```
root@mni-test:/home/mune# arping -c 3 192.168.0.56
ARPING 192.168.0.56
58 bytes from 8a:85:b0:3a:a0:ef (192.168.0.56): index=0 time=262.807 usec
58 bytes from 8a:85:b0:3a:a0:ef (192.168.0.56): index=1 time=221.678 usec
58 bytes from 8a:85:b0:3a:a0:ef (192.168.0.56): index=2 time=287.006 usec

--- 192.168.0.56 statistics ---
3 packets transmitted, 3 packets received,   0% unanswered (0 extra)
rtt min/avg/max/std-dev = 0.222/0.257/0.287/0.027 ms
root@mni-test:/home/mune#
```

And the tcpdump results on the node are as follows:
```
root@mni-test:/home/mune/test-vm# tcpdump -i any -v arp
tcpdump: data link type LINUX_SLL2
tcpdump: listening on any, link-type LINUX_SLL2 (Linux cooked v2), snapshot length 262144 bytes
03:13:21.892008 6c11f29eaa4c_h P   ARP, Ethernet (len 6), IPv4 (len 4), Request who-has 10.16.0.1 tell 10.16.0.7, length 28
03:13:21.892472 6c11f29eaa4c_h Out ARP, Ethernet (len 6), IPv4 (len 4), Reply 10.16.0.1 is-at 3a:c8:e0:fd:a2:f0 (oui Unknown), length 28
03:13:21.965723 br-external Out ARP, Ethernet (len 6), IPv4 (len 4), Request who-has 192.168.0.56 tell mni-test, length 44
03:13:21.965869 br-external In  ARP, Ethernet (len 6), IPv4 (len 4), Reply 192.168.0.56 is-at 8a:85:b0:3a:a0:ef (oui Unknown), length 44
03:13:21.965889 eth0  Out ARP, Ethernet (len 6), IPv4 (len 4), Request who-has 192.168.0.56 tell mni-test, length 44
03:13:22.323691 eth0  B   ARP, Ethernet (len 6), IPv4 (len 4), Request who-has 192.168.0.154 tell 192.168.0.133, length 46
03:13:22.323705 br-external B   ARP, Ethernet (len 6), IPv4 (len 4), Request who-has 192.168.0.154 tell 192.168.0.133, length 46
03:13:22.404387 74314ac0a2ca_h Out ARP, Ethernet (len 6), IPv4 (len 4), Request who-has 10.0.1.9 tell 10.0.1.1, length 28
03:13:22.404398 cd8ff815d8fb_h Out ARP, Ethernet (len 6), IPv4 (len 4), Request who-has 10.0.1.9 tell 10.0.1.1, length 28
03:13:22.966421 br-external Out ARP, Ethernet (len 6), IPv4 (len 4), Request who-has 192.168.0.56 tell mni-test, length 44
03:13:22.966559 br-external In  ARP, Ethernet (len 6), IPv4 (len 4), Reply 192.168.0.56 is-at 8a:85:b0:3a:a0:ef (oui Unknown), length 44
03:13:22.966579 eth0  Out ARP, Ethernet (len 6), IPv4 (len 4), Request who-has 192.168.0.56 tell mni-test, length 44
03:13:23.428569 74314ac0a2ca_h Out ARP, Ethernet (len 6), IPv4 (len 4), Request who-has 10.0.1.9 tell 10.0.1.1, length 28
03:13:23.428585 cd8ff815d8fb_h Out ARP, Ethernet (len 6), IPv4 (len 4), Request who-has 10.0.1.9 tell 10.0.1.1, length 28
```

The ARP packets are visible on tcpdump, but they are not visible in hubble observe.

**Comment by bobz965** [comment]
maybe you can extend the function ` ARP detection ` into the hubble

**Comment by MuNeNICK** [comment]
> So, in the case of `VIP not set to the real pod`, only the ARP packet can be seen from the VPC LRP.
> 
> arp is answered by ovs. and just ARP.
> 
> if you want `0-x`, not `1-x`, maybe ARP detection is just the key to trigger `0->1`.

> maybe you can extend the function `ARP detection` into the bubble , or something else which already has the `ARP detection`

Thank you for your detailed explanation.

I understand that Hubble by default can only monitor L3 and above, and cannot monitor ARP Packets which are L2. 
For this reason, I will look into the `iptables` approach and explore other alternatives.

Finally, in a scenario where customer tenants are provisioned per Kubernetes namespace, which do you think is superior between the `iptables` method and `OVN` method for eip/fip? Also, it would be helpful if you could tell me which has more future potential. I would like to incorporate this into our design approach.

**Comment by bobz965** [comment]
for your case, iptables eip set up a pod at first, and map the eip and VIP in the pod.  I think it is the case of `1-x`.

and also, if the VIP not set to the real pod, I think you still can not monitor any packets.

so the block point is just the same (iptables eip vs ovn eip).

the key is the packets send to the VIP can not be seen until the VIP set to a real pod.

if hubble only monitor L3, maybe you can use bpf to make a tool to detect lrp and trigger a event for the case `0-1`.

**Comment by MuNeNICK** [comment]
> for your case, iptables eip set up a pod at first, and map the eip and VIP in the pod. I think it is the case of `1-x`.
> 
> and also, if the VIP not set to the real pod, I think you still can not monitor any packets.
> 
> so the block point is just the same (iptables eip vs ovn eip).
> 
> the key is the packets send to the VIP can not be seen until the VIP set to a real pod.
> 
> if hubble only monitor L3, maybe you can use bpf to make a tool to detect lrp and trigger a event for the case `0-1`.

You're right, I also confirmed that it cannot be done with the Iptables method.

It seems that `svc lb` can meet my requirements, so I will proceed with the design using that approach.

Thank you for your help.
