### ISSUE TITLE
自定义VPC，sg的ingressRules禁止icmp后，pod不能ping通网关

### ISSUE THREAD

**Issue by geniusxiong** [kubeovn/kube-ovn#3823]
# Bug Report
自定义VPC，sg的ingressRules禁止icmp后，pod不能ping通网关，但是能ping通百度和局域网内其他ip
## Expected Behavior
自定义VPC，sg的ingressRules禁止icmp后，pod能够ping通能访问到的地址
## Steps to Reproduce the Problem

1. 自定义VPC内，pod ip 10.50.1.11，子网网关是10.50.1.1
2. 配置安全组，并作用pod
```
apiVersion: kubeovn.io/v1
kind: SecurityGroup
metadata:
  annotations:
    kubesphere.io/alias-name: no-ping
    kubesphere.io/description: ''
  name: sg-we0p1bei
spec:
  allowSameGroupTraffic: true
  egressRules:
    - ipVersion: ipv4
      policy: allow
      priority: 150
      protocol: all
      remoteAddress: 0.0.0.0/0
      remoteType: address
  ingressRules:
    - ipVersion: ipv4
      policy: allow
      priority: 150
      protocol: all
      remoteAddress: 0.0.0.0/0
      remoteType: address
    - ipVersion: ipv4
      policy: allow
      portRangeMax: 22
      portRangeMin: 22
      priority: 100
      protocol: tcp
      remoteAddress: 0.0.0.0/0
      remoteType: address
    - ipVersion: ipv4
      policy: drop
      priority: 100
      protocol: icmp
      remoteAddress: 0.0.0.0/0
      remoteType: address
```
3.  pod ping 网关不通，但是ping其他地址都能通
![1710237255996](https://github.com/kubeovn/kube-ovn/assets/25982171/fb4876f9-5ced-4ebe-a461-333bbe546baf)

4. 这会影响到虚机创建，如果配置了这个规则，虚机重启后，kube-ovn-cni会提示10.50.1.15 network not ready after 18 ping to gateway 10.50.1.1，导致虚机pod创建不起来: Failed to create pod sandbox: rpc error: code = Unknown desc = failed to set up sandbox container "9d7ebf231cd9c595e3047b23affcc89a73d692ae96f0b6a575d962796dc1c29c" network for pod "virt-launcher-i-nk41uyqe-vr2mf": networkPlugin cni failed to set up pod "virt-launcher-i-nk41uyqe-vr2mf_vpc1-ns" network: RPC failed; request ip return 500 configure nic failed no packets received from gateway 10.50.1.1

## Additional Info

- Kubernetes version:

  **Output of `kubectl version`:**

```
Client Version: version.Info{Major:"1", Minor:"18", GitVersion:"v1.18.6", GitCommit:"dff82dc0de47299ab66c83c626e08b245ab19037", GitTreeState:"clean", BuildDate:"2020-07-15T16:58:53Z", GoVersion:"go1.13.9", Compiler:"gc", Platform:"linux/amd64"}
Server Version: version.Info{Major:"1", Minor:"18", GitVersion:"v1.18.6", GitCommit:"dff82dc0de47299ab66c83c626e08b245ab19037", GitTreeState:"clean", BuildDate:"2020-07-15T16:51:04Z", GoVersion:"go1.13.9", Compiler:"gc", Platform:"linux/amd64"}
```

- kube-ovn version:
  
```
1.13.0
```

- operation-system/kernel version:
  
  **Output of `awk -F '=' '/PRETTY_NAME/ { print $2 }' /etc/os-release`:**
  **Output of `uname -r`:**

```
NFS Server 4.0 (G193)
4.19.113-3.nfs.x86_64
```

以上是自定义VPC的情况，默认VPC没有测试，不确定有没有同样问题

**Comment by zcq98** [comment]
```shell
kubectl ko trace {namespace/podname} 10.50.1.1 icmp
```
看一下流表

而且我觉得drop icmp的优先级应该高于放通所有流的规则，不然匹配中高优先级的规则后，低优先级的就不会生效了

**Comment by geniusxiong** [comment]
> ```shell
> kubectl ko trace {namespace/podname} 10.50.1.1 icmp
> ```
> 
> 看一下流表
> 
> 而且我觉得drop icmp的优先级应该高于放通所有流的规则，不然匹配中高优先级的规则后，低优先级的就不会生效了

```
[root@master-0 ovn]# kubectl get pod -n vpc1-ns
NAME                             READY   STATUS              RESTARTS   AGE
aaa-784778bcf4-qzh8m             1/1     Running             0          8d
virt-launcher-i-4xtuup8f-vftdk   0/1     ContainerCreating   0          2m10s
```

```
[root@master-0 ovn]# kubectl ko trace vpc1-ns/virt-launcher-i-4xtuup8f-vftdk 10.50.1.1 icmp
Using the logical gateway mac address as destination
Notice: LSP virt-launcher-i-4xtuup8f-vftdk.vpc1-ns does not exist
+ kubectl exec ovn-central-58bc5c8f87-zmntx -n kube-system -c ovn-central -- ovn-trace vpc1-subnet1 'inport == "i-4xtuup8f.vpc1-ns" && ip.ttl == 64 && icmp && eth.src == 00:00:00:F8:3E:A2 && ip4.src == 10.50.1.17 && eth.dst == 00:00:00:2C:8E:D1 && ip4.dst == 10.50.1.1 && ct.new'
# ct_state=new|trk,icmp,reg14=0x7,vlan_tci=0x0000,dl_src=00:00:00:f8:3e:a2,dl_dst=00:00:00:2c:8e:d1,nw_src=10.50.1.17,nw_dst=10.50.1.1,nw_tos=0,nw_ecn=0,nw_ttl=64,nw_frag=no,icmp_type=0,icmp_code=0

ingress(dp="vpc1-subnet1", inport="i-4xtuup8f.vpc1-ns")
-------------------------------------------------------
 0. ls_in_check_port_sec (northd.c:8758): 1, priority 50, uuid 9d0b16e8
    reg0[15] = check_in_port_sec();
    next;
 4. ls_in_pre_acl (northd.c:5957): ip, priority 100, uuid be40b7db
    reg0[0] = 1;
    next;
 6. ls_in_pre_stateful (northd.c:6231): reg0[0] == 1, priority 100, uuid a9b7a37a
    ct_next;

ct_next(ct_state=est|trk /* default (use --ct to customize) */)
---------------------------------------------------------------
 7. ls_in_acl_hint (northd.c:6319): !ct.new && ct.est && !ct.rpl && ct_mark.blocked == 0, priority 4, uuid 112dc1e8
    reg0[8] = 1;
    reg0[10] = 1;
    next;
 8. ls_in_acl (northd.c:6561): reg0[8] == 1 && (inport == @ovn.sg.sg.zcf3qmd8 && ip4 && ip4.dst == 0.0.0.0/0), priority 3150, uuid edb32abf
    next;
14. ls_in_after_lb (northd.c:7860): reg0[2] == 0, priority 100, uuid 7882a08d
    next;
26. ls_in_l2_lkup (northd.c:9540): eth.dst == 00:00:00:2c:8e:d1, priority 50, uuid 1f2433bd
    outport = "vpc1-subnet1-vpc1";
    output;

egress(dp="vpc1-subnet1", inport="i-4xtuup8f.vpc1-ns", outport="vpc1-subnet1-vpc1")
-----------------------------------------------------------------------------------
 0. ls_out_pre_acl (northd.c:5844): ip && outport == "vpc1-subnet1-vpc1", priority 110, uuid 4d39797d
    next;
 1. ls_out_pre_lb (northd.c:5844): ip && outport == "vpc1-subnet1-vpc1", priority 110, uuid cd428fd6
    next;
 3. ls_out_acl_hint (northd.c:6319): !ct.new && ct.est && !ct.rpl && ct_mark.blocked == 0, priority 4, uuid 2b929fe0
    reg0[8] = 1;
    reg0[10] = 1;
    next;
 8. ls_out_check_port_sec (northd.c:5807): 1, priority 0, uuid 069362e3
    reg0[15] = check_out_port_sec();
    next;
 9. ls_out_apply_port_sec (northd.c:5812): 1, priority 0, uuid c944080b
    output;
    /* output to "vpc1-subnet1-vpc1", type "patch" */

ingress(dp="vpc1", inport="vpc1-vpc1-subnet1")
----------------------------------------------
 0. lr_in_admission (northd.c:11972): eth.dst == 00:00:00:2c:8e:d1 && inport == "vpc1-vpc1-subnet1", priority 50, uuid 955b881d
    xreg0[0..47] = 00:00:00:2c:8e:d1;
    next;
 1. lr_in_lookup_neighbor (northd.c:12149): 1, priority 0, uuid 3c7f2b76
    reg9[2] = 1;
    next;
 2. lr_in_learn_neighbor (northd.c:12158): reg9[2] == 1, priority 100, uuid 01d709e5
    next;
 3. lr_in_ip_input (northd.c:11716): ip4.dst == {10.50.1.1}, priority 60, uuid d2dd186c
    drop;
+ set +x
--------
Start OVS Tracing


+ kubectl exec kube-ovn-cni-4rhjt -c cni-server -n kube-system -- ovs-appctl ofproto/trace br-int in_port=146,icmp,nw_ttl=64,nw_src=10.50.1.17,nw_dst=10.50.1.1,dl_src=00:00:00:F8:3E:A2,dl_dst=00:00:00:2C:8E:D1
Flow: icmp,in_port=146,vlan_tci=0x0000,dl_src=00:00:00:f8:3e:a2,dl_dst=00:00:00:2c:8e:d1,nw_src=10.50.1.17,nw_dst=10.50.1.1,nw_tos=0,nw_ecn=0,nw_ttl=64,nw_frag=no,icmp_type=0,icmp_code=0

bridge("br-int")
----------------
 0. in_port=146, priority 100, cookie 0x8bd7525b
    set_field:0x9->reg13
    set_field:0x3e->reg11
    set_field:0x3d->reg12
    set_field:0x5->metadata
    set_field:0x7->reg14
    resubmit(,8)
 8. metadata=0x5, priority 50, cookie 0x9d0b16e8
    set_field:0/0x1000->reg10
    resubmit(,73)
    73. ip,reg14=0x7,metadata=0x5,dl_src=00:00:00:f8:3e:a2,nw_src=10.50.1.17, priority 90, cookie 0x8bd7525b
            set_field:0/0x1000->reg10
    move:NXM_NX_REG10[12]->NXM_NX_XXREG0[111]
     -> NXM_NX_XXREG0[111] is now 0
    resubmit(,9)
 9. metadata=0x5, priority 0, cookie 0xc48066ec
    resubmit(,10)
10. metadata=0x5, priority 0, cookie 0x323f2d37
    resubmit(,11)
11. metadata=0x5, priority 0, cookie 0x863ddb99
    resubmit(,12)
12. ip,metadata=0x5, priority 100, cookie 0xbe40b7db
    set_field:0x1000000000000000000000000/0x1000000000000000000000000->xxreg0
    resubmit(,13)
13. metadata=0x5, priority 0, cookie 0xb109bc5
    resubmit(,14)
14. ip,reg0=0x1/0x1,metadata=0x5, priority 100, cookie 0xa9b7a37a
    ct(table=15,zone=NXM_NX_REG13[0..15])
    drop
     -> A clone of the packet is forked to recirculate. The forked pipeline will be resumed at table 15.
     -> Sets the packet to an untracked state, and clears all the conntrack fields.

Final flow: icmp,reg0=0x1,reg11=0x3e,reg12=0x3d,reg13=0x9,reg14=0x7,metadata=0x5,in_port=146,vlan_tci=0x0000,dl_src=00:00:00:f8:3e:a2,dl_dst=00:00:00:2c:8e:d1,nw_src=10.50.1.17,nw_dst=10.50.1.1,nw_tos=0,nw_ecn=0,nw_ttl=64,nw_frag=no,icmp_type=0,icmp_code=0
Megaflow: recirc_id=0,eth,icmp,in_port=146,dl_src=00:00:00:f8:3e:a2,dl_dst=00:00:00:2c:8e:d1,nw_src=10.50.1.17,nw_frag=no
Datapath actions: ct(zone=9),recirc(0x2f1b44)

===============================================================================
recirc(0x2f1b44) - resume conntrack with default ct_state=trk|new (use --ct-next to customize)
===============================================================================

Flow: recirc_id=0x2f1b44,ct_state=new|trk,ct_zone=9,eth,icmp,reg0=0x1,reg11=0x3e,reg12=0x3d,reg13=0x9,reg14=0x7,metadata=0x5,in_port=146,vlan_tci=0x0000,dl_src=00:00:00:f8:3e:a2,dl_dst=00:00:00:2c:8e:d1,nw_src=10.50.1.17,nw_dst=10.50.1.1,nw_tos=0,nw_ecn=0,nw_ttl=64,nw_frag=no,icmp_type=0,icmp_code=0

bridge("br-int")
----------------
    thaw
        Resuming from table 15
15. ct_state=+new-est+trk,metadata=0x5, priority 7, cookie 0xa1814fc2
    set_field:0x80000000000000000000000000/0x80000000000000000000000000->xxreg0
    set_field:0x200000000000000000000000000/0x200000000000000000000000000->xxreg0
    resubmit(,16)
16. ip,reg0=0x80/0x80,reg14=0x7,metadata=0x5, priority 3150, cookie 0xcf748f29
    set_field:0x2000000000000000000000000/0x2000000000000000000000000->xxreg0
    resubmit(,17)
17. metadata=0x5, priority 0, cookie 0xb9f6d24a
    resubmit(,18)
18. metadata=0x5, priority 0, cookie 0x6df63b8d
    resubmit(,19)
19. metadata=0x5, priority 0, cookie 0x7cdc2202
    resubmit(,20)
20. metadata=0x5, priority 0, cookie 0xfb21104f
    resubmit(,21)
21. metadata=0x5, priority 0, cookie 0xeba18d2c
    resubmit(,22)
22. reg0=0/0x4,metadata=0x5, priority 100, cookie 0x7882a08d
    resubmit(,23)
23. metadata=0x5, priority 0, cookie 0x7576067a
    resubmit(,24)
24. metadata=0x5, priority 0, cookie 0x49fc54ea
    resubmit(,25)
25. metadata=0x5, priority 0, cookie 0x306ea72
    resubmit(,26)
26. metadata=0x5, priority 0, cookie 0x44e80c08
    resubmit(,27)
27. ip,reg0=0x2/0x2002,metadata=0x5, priority 100, cookie 0x1da5f169
    ct(commit,zone=NXM_NX_REG13[0..15],nat(src),exec(set_field:0/0x1->ct_mark))
    nat(src)
    set_field:0/0x1->ct_mark
     -> Sets the packet to an untracked state, and clears all the conntrack fields.
    resubmit(,28)
28. metadata=0x5, priority 0, cookie 0x8ce88a93
    resubmit(,29)
29. metadata=0x5, priority 0, cookie 0xc19da1ef
    resubmit(,30)
30. metadata=0x5, priority 0, cookie 0x92be28e4
    resubmit(,31)
31. metadata=0x5, priority 0, cookie 0x3974781
    resubmit(,32)
32. metadata=0x5, priority 0, cookie 0xe0066f1f
    resubmit(,33)
33. metadata=0x5, priority 0, cookie 0x368899e1
    resubmit(,34)
34. metadata=0x5,dl_dst=00:00:00:2c:8e:d1, priority 50, cookie 0x1f2433bd
    set_field:0x1->reg15
    resubmit(,37)
37. priority 0
    resubmit(,39)
39. priority 0
    resubmit(,40)
40. reg15=0x1,metadata=0x5, priority 100, cookie 0xa529dc98
    set_field:0x3e->reg11
    set_field:0x3d->reg12
    resubmit(,41)
41. priority 0
    set_field:0->reg0
    set_field:0->reg1
    set_field:0->reg2
    set_field:0->reg3
    set_field:0->reg4
    set_field:0->reg5
    set_field:0->reg6
    set_field:0->reg7
    set_field:0->reg8
    set_field:0->reg9
    resubmit(,42)
42. ip,reg15=0x1,metadata=0x5, priority 110, cookie 0x4d39797d
    resubmit(,43)
43. ip,reg15=0x1,metadata=0x5, priority 110, cookie 0xcd428fd6
    resubmit(,44)
44. metadata=0x5, priority 0, cookie 0xb0903c7c
    resubmit(,45)
45. ct_state=-trk,metadata=0x5, priority 5, cookie 0xd20c8d1d
    set_field:0x100000000000000000000000000/0x100000000000000000000000000->xxreg0
    set_field:0x200000000000000000000000000/0x200000000000000000000000000->xxreg0
    resubmit(,46)
46. metadata=0x5, priority 0, cookie 0xe21b92c5
    resubmit(,47)
47. metadata=0x5, priority 0, cookie 0x9609b205
    resubmit(,48)
48. metadata=0x5, priority 0, cookie 0x7a7bfbc8
    resubmit(,49)
49. metadata=0x5, priority 0, cookie 0x92faf2f3
    resubmit(,50)
50. metadata=0x5, priority 0, cookie 0x69362e3
    set_field:0/0x1000->reg10
    resubmit(,75)
    75. No match.
            drop
    move:NXM_NX_REG10[12]->NXM_NX_XXREG0[111]
     -> NXM_NX_XXREG0[111] is now 0
    resubmit(,51)
51. metadata=0x5, priority 0, cookie 0xc944080b
    resubmit(,64)
64. priority 0
    resubmit(,65)
65. reg15=0x1,metadata=0x5, priority 100, cookie 0xa529dc98
    clone(ct_clear,set_field:0->reg11,set_field:0->reg12,set_field:0->reg13,set_field:0x3c->reg11,set_field:0x3b->reg12,set_field:0x4->metadata,set_field:0x3->reg14,set_field:0->reg10,set_field:0->reg15,set_field:0->reg0,set_field:0->reg1,set_field:0->reg2,set_field:0->reg3,set_field:0->reg4,set_field:0->reg5,set_field:0->reg6,set_field:0->reg7,set_field:0->reg8,set_field:0->reg9,resubmit(,8))
    ct_clear
    set_field:0->reg11
    set_field:0->reg12
    set_field:0->reg13
    set_field:0x3c->reg11
    set_field:0x3b->reg12
    set_field:0x4->metadata
    set_field:0x3->reg14
    set_field:0->reg10
    set_field:0->reg15
    set_field:0->reg0
    set_field:0->reg1
    set_field:0->reg2
    set_field:0->reg3
    set_field:0->reg4
    set_field:0->reg5
    set_field:0->reg6
    set_field:0->reg7
    set_field:0->reg8
    set_field:0->reg9
    resubmit(,8)
 8. reg14=0x3,metadata=0x4,dl_dst=00:00:00:2c:8e:d1, priority 50, cookie 0x955b881d
    set_field:0x2c8ed10000000000000000/0xffffffffffff0000000000000000->xxreg0
    resubmit(,9)
 9. metadata=0x4, priority 0, cookie 0x3c7f2b76
    set_field:0x4/0x4->xreg4
    resubmit(,10)
10. reg9=0x4/0x4,metadata=0x4, priority 100, cookie 0x1d709e5
    resubmit(,11)
11. ip,metadata=0x4,nw_dst=10.50.1.1, priority 60, cookie 0xd2dd186c
    drop

Final flow: recirc_id=0x2f1b44,eth,icmp,reg0=0x300,reg11=0x3e,reg12=0x3d,reg13=0x9,reg14=0x7,reg15=0x1,metadata=0x5,in_port=146,vlan_tci=0x0000,dl_src=00:00:00:f8:3e:a2,dl_dst=00:00:00:2c:8e:d1,nw_src=10.50.1.17,nw_dst=10.50.1.1,nw_tos=0,nw_ecn=0,nw_ttl=64,nw_frag=no,icmp_type=0,icmp_code=0
Megaflow: recirc_id=0x2f1b44,ct_state=+new-est-rel-rpl+trk,ct_mark=0/0x1,eth,icmp,in_port=146,dl_src=00:00:00:f8:3e:a2,dl_dst=00:00:00:2c:8e:d1,nw_src=10.50.1.16/28,nw_dst=10.50.1.1,nw_frag=no,icmp_type=0x0/0xf8
Datapath actions: ct(commit,zone=9,mark=0/0x1,nat(src))
```

**Comment by zcq98** [comment]
> ```shell
> kubectl ko trace {namespace/podname} 10.50.1.1 icmp
> ```
> 
> 看一下流表
> 
> 而且我觉得drop icmp的优先级应该高于放通所有流的规则，不然匹配中高优先级的规则后，低优先级的就不会生效了

这里说错了 `priority` 越小优先级越高
这里网关不通的原因是
```yaml
    - ipVersion: ipv4
      policy: drop
      priority: 100
      protocol: icmp
      remoteAddress: 0.0.0.0/0
      remoteType: address
```
这条规则的高优先级把所有的 `icmp` 流量 drop 了。
可以添加下列规则放行网关，参考 [SecurityGroup 使用](https://kubeovn.github.io/docs/v1.13.x/advance/security-group/#_2)
```yaml
    - ipVersion: ipv4
      policy: allow
      priority: 1
      protocol: icmp
      remoteAddress: 10.50.1.1
      remoteType: address
```

**Comment by geniusxiong** [comment]
> sg的ingressRules禁止icmp后

好像不是呀，我是sg的ingressRules禁止icmp，不是禁止egress的icmp
然后这个pod ping 同网段的其他地址是通的，比如ping 10.50.1.9是通的

**Comment by zcq98** [comment]
> > > ```shell
> > > kubectl ko trace {namespace/podname} 10.50.1.1 icmp
> > > ```
> > > 
> > > 
> > >     
> > >       
> > >     
> > > 
> > >       
> > >     
> > > 
> > >     
> > >   
> > > 看一下流表
> > > 而且我觉得drop icmp的优先级应该高于放通所有流的规则，不然匹配中高优先级的规则后，低优先级的就不会生效了
> > 
> > 
> > 这里说错了 `priority` 越小优先级越高 这里网关不通的原因是
> > ```yaml
> >     - ipVersion: ipv4
> >       policy: drop
> >       priority: 100
> >       protocol: icmp
> >       remoteAddress: 0.0.0.0/0
> >       remoteType: address
> > ```
> > 
> > 
> >     
> >       
> >     
> > 
> >       
> >     
> > 
> >     
> >   
> > 这条规则的高优先级把所有的 `icmp` 流量 drop 了。 可以添加下列规则放行网关，参考 [SecurityGroup 使用](https://kubeovn.github.io/docs/v1.13.x/advance/security-group/#_2)
> > ```yaml
> >     - ipVersion: ipv4
> >       policy: allow
> >       priority: 1
> >       protocol: icmp
> >       remoteAddress: 10.50.1.1
> >       remoteType: address
> > ```
> 
> 好像不是呀，我是sg的ingressRules禁止icmp，不是禁止egress的icmp 然后这个pod ping 同网段的其他地址是通的，比如ping 10.50.1.9是通的

1、是否同网段的其它虚机都绑定了这个安全组，如果绑定了，`allowSameGroupTraffic = true` 会允许同一安全组下的虚机间的通信。
2、`ingressRules` 表示流向虚机的流量，`egressRules` 表示流出虚机的流量。`ingressRules`  禁用 `icmp` 后会导致 `icmp response` 的包被 `drop`，网关就不通了。

**Comment by zcq98** [comment]
我在master分支上创建了和你一样的sg，加上放行网关的规则后，pod就能起了
@geniusxiong

**Comment by geniusxiong** [comment]
> 我在master分支上创建了和你一样的sg，加上放行网关的规则后，pod就能起了 @geniusxiong

放行网关确实可以，但是我有疑问：
1. 能ping通本网段的虚机，也是能ping通外网，但是在这两个基础上，ping不通网关
2. ingressRules 禁用 icmp 后会导致 icmp response 的包被 drop，网关就不通了。如果是这样，为什么ping 本网段其他虚机，ping外网，都是能成功的
3. 如果都要配置放行网关节点，这样安全组就很难做成通用配置了

**Comment by zcq98** [comment]
> > 我在master分支上创建了和你一样的sg，加上放行网关的规则后，pod就能起了 @geniusxiong
> 
> 放行网关确实可以，但是我有疑问：
> 
> 1. 能ping通本网段的虚机，也是能ping通外网，但是在这两个基础上，ping不通网关
> 2. ingressRules 禁用 icmp 后会导致 icmp response 的包被 drop，网关就不通了。如果是这样，为什么ping 本网段其他虚机，ping外网，都是能成功的
> 3. 如果都要配置放行网关节点，这样安全组就很难做成通用配置了

1、能ping外网，你是开启了 natoutgoing 吗？这个为啥能ping外网暂时没思路
2、关于同网段其它虚机能ping通，这些其它虚机是否也绑定了同一个安全组？
3、有道理，感觉可以优化一下

**Comment by geniusxiong** [comment]
> > > 我在master分支上创建了和你一样的sg，加上放行网关的规则后，pod就能起了 @geniusxiong
> > 
> > 
> > 放行网关确实可以，但是我有疑问：
> > 
> > 1. 能ping通本网段的虚机，也是能ping通外网，但是在这两个基础上，ping不通网关
> > 2. ingressRules 禁用 icmp 后会导致 icmp response 的包被 drop，网关就不通了。如果是这样，为什么ping 本网段其他虚机，ping外网，都是能成功的
> > 3. 如果都要配置放行网关节点，这样安全组就很难做成通用配置了
> 
> 1、能ping外网，你是开启了 natoutgoing 吗？这个为啥能ping外网暂时没思路 2、关于同网段其它虚机能ping通，这些其它虚机是否也绑定了同一个安全组？ 3、有道理，感觉可以优化一下

“关于同网段其它虚机能ping通，这些其它虚机是否也绑定了同一个安全组？”
其他虚机是没有绑定这个安全组的，不然禁止ping的话，其他虚机是不能被ping通。这样就测不出ping不通网关的问题。

**Comment by zcq98** [comment]
![image](https://github.com/kubeovn/kube-ovn/assets/52371592/89bcd0de-c696-4873-bd40-e09ce207b48c)
在下发安全组之后有清理过这些数据库吗？安全组的ACL规则在清理后 kubeovn 不会重建，会导致安全组出问题

**Comment by geniusxiong** [comment]
> ![image](https://private-user-images.githubusercontent.com/52371592/314424739-89bcd0de-c696-4873-bd40-e09ce207b48c.png?jwt=eyJhbGciOiJIUzI1NiIsInR5cCI6IkpXVCJ9.eyJpc3MiOiJnaXRodWIuY29tIiwiYXVkIjoicmF3LmdpdGh1YnVzZXJjb250ZW50LmNvbSIsImtleSI6ImtleTUiLCJleHAiOjE3MTA5MjYxOTIsIm5iZiI6MTcxMDkyNTg5MiwicGF0aCI6Ii81MjM3MTU5Mi8zMTQ0MjQ3MzktODliY2QwZGUtYzY5Ni00ODczLWJkNDAtZTA5Y2UyMDdiNDhjLnBuZz9YLUFtei1BbGdvcml0aG09QVdTNC1ITUFDLVNIQTI1NiZYLUFtei1DcmVkZW50aWFsPUFLSUFWQ09EWUxTQTUzUFFLNFpBJTJGMjAyNDAzMjAlMkZ1cy1lYXN0LTElMkZzMyUyRmF3czRfcmVxdWVzdCZYLUFtei1EYXRlPTIwMjQwMzIwVDA5MTEzMlomWC1BbXotRXhwaXJlcz0zMDAmWC1BbXotU2lnbmF0dXJlPWE4MGY5ZTRmNDhmZGMzMjg1MzA0YTc2YTg5ZjM1ZmExMDU0MTJlZjEyMGEyMmEyNzhkMjI0YTE0MjlhMWY4YmEmWC1BbXotU2lnbmVkSGVhZGVycz1ob3N0JmFjdG9yX2lkPTAma2V5X2lkPTAmcmVwb19pZD0wIn0.adijwI-Mgo318SJfFwx9t7KLT1DWx9BvRtpWees5muo) 在下发安全组之后有清理过这些数据库吗？安全组的ACL规则在清理后 kubeovn 不会重建，会导致安全组出问题

没有清理过数据库，比较奇怪呀，只有本子网的网关ping不通，导致虚机创建不起来

**Comment by bobz965** [comment]
如果不配这些安全组就可以ping通网关么？

**Comment by geniusxiong** [comment]
> 如果不配这些安全组就可以ping通网关么？

不配安全组是可以ping通网关的，不然连虚机都创建不出来

**Comment by bobz965** [comment]
- ipVersion: ipv4
      policy: drop
      priority: 100
      protocol: icmp
      remoteAddress: 0.0.0.0/0
      remoteType: address


这条规则可以在 node 上抓到 pod 出去到网关的的流量，但是抓不到进来到 pod 的流量是么？

在  node 的 kube-ovn-cni 中抓包，tcmpdump -ni any host <gwip> -vv

**Comment by geniusxiong** [comment]
> ```
> - ipVersion: ipv4
>   policy: drop
>   priority: 100
>   protocol: icmp
>   remoteAddress: 0.0.0.0/0
>   remoteType: address
> ```
> 
> 这条规则可以在 node 上抓到 pod 出去到网关的的流量，但是抓不到进来到 pod 的流量是么？
> 
> 在 node 的 kube-ovn-cni 中抓包，tcmpdump -ni any host -vv

嗯，从抓包看，网关没有返回
```
tcpdump -i any -n host 10.50.1.17
tcpdump: data link type LINUX_SLL2
tcpdump: verbose output suppressed, use -v[v]... for full protocol decode
listening on any, link-type LINUX_SLL2 (Linux cooked v2), snapshot length 262144 bytes
17:54:51.331879 8de543bc7605_h P   IP 10.50.1.17 > 10.50.1.1: ICMP echo request, id 7223, seq 7, length32
17:54:52.331858 8de543bc7605_h P   IP 10.50.1.17 > 10.50.1.1: ICMP echo request, id 7223, seq 8, length32
17:54:53.331928 8de543bc7605_h P   IP 10.50.1.17 > 10.50.1.1: ICMP echo request, id 7223, seq 9, length32
17:54:54.332024 8de543bc7605_h P   IP 10.50.1.17 > 10.50.1.1: ICMP echo request, id 7223, seq 10, length 32
17:54:55.331899 8de543bc7605_h P   IP 10.50.1.17 > 10.50.1.1: ICMP echo request, id 7223, seq 11, length 32
17:54:56.331337 8de543bc7605_h P   IP 10.50.1.17 > 10.50.1.1: ICMP echo request, id 7223, seq 12, length 32
17:54:57.332119 8de543bc7605_h P   IP 10.50.1.17 > 10.50.1.1: ICMP echo request, id 7223, seq 13, length 32
17:54:58.331572 8de543bc7605_h P   IP 10.50.1.17 > 10.50.1.1: ICMP echo request, id 7223, seq 14, length 32
17:54:59.332260 8de543bc7605_h P   IP 10.50.1.17 > 10.50.1.1: ICMP echo request, id 7223, seq 15, length 32
17:55:00.331598 8de543bc7605_h P   IP 10.50.1.17 > 10.50.1.1: ICMP echo request, id 7223, seq 16, length 32
17:55:01.331627 8de543bc7605_h P   IP 10.50.1.17 > 10.50.1.1: ICMP echo request, id 7223, seq 17, length 32
^C
11 packets captured
44 packets received by filter
0 packets dropped by kernel
```

**Comment by bobz965** [comment]
1. 这里网关要么没收到包
2. 要么网关返回了，但是又直接丢包了

由于默认vpc的网关是分布式的，本地直接响应的，所以抓包好像区分不了这两者。
如果你有underlay 网络的的，配置同样的安全组，就能够抓包区分出来这两者

**Comment by geniusxiong** [comment]
> 1. 这里网关要么没收到包，在端口出来到ovs就丢包了
> 2. 要么网关返回了，但是又直接丢包了
> 
> 由于默认vpc的网关是分布式的，本地直接响应的，所以抓包好像区分不了这两者。 如果你有underlay 网络的的，配置同样的安全组，就能够抓包区分出来这两者

刚才不用虚机，在自定义VPC下创建一个pod，然后添加一个ingress禁ping的安全组，也能复现一样的问题
就是ping 网关ping不通，但是其他地址都能ping的通

**Comment by geniusxiong** [comment]
> 1. 这里网关要么没收到包，在端口出来到ovs就丢包了
> 2. 要么网关返回了，但是又直接丢包了
> 
> 由于默认vpc的网关是分布式的，本地直接响应的，所以抓包好像区分不了这两者。 如果你有underlay 网络的的，配置同样的安全组，就能够抓包区分出来这两者

刚才不用虚机，在自定义VPC下创建一个pod，然后添加一个ingress禁ping的安全组，也能复现一样的问题
就是ping 网关ping不通，但是其他地址都能ping的通。
这个对于平常的pod创建影响不大，因为pod删除后，安全组也消失了，重建的时候还是能重建出pod。
但是对于虚机来说，这些配置是会保存下来，用于虚机重启等重新创建，这样就造成重建的时候，ping不通网关，创建不出虚机的情况。

**Comment by bobz965** [comment]
> > 1. 这里网关要么没收到包，在端口出来到ovs就丢包了
> > 2. 要么网关返回了，但是又直接丢包了
> > 
> > 由于默认vpc的网关是分布式的，本地直接响应的，所以抓包好像区分不了这两者。 如果你有underlay 网络的的，配置同样的安全组，就能够抓包区分出来这两者
> 
> 刚才不用虚机，在自定义VPC下创建一个pod，然后添加一个ingress禁ping的安全组，也能复现一样的问题 就是ping 网关ping不通，但是其他地址都能ping的通。 这个对于平常的pod创建影响不大，因为pod删除后，安全组也消失了，重建的时候还是能重建出pod。 但是对于虚机来说，这些配置是会保存下来，用于虚机重启等重新创建，这样就造成重建的时候，ping不通网关，创建不出虚机的情况。

我提供的思路主要是用于确认是在到网关丢包，还是网关丢包。总体来说是安全组导致的这个问题。如果非要用icmp安全组来控制一下，何不直接ingress egress 都添加好 icmp 呢。

可以把网关检测关闭了，你也可以参考下，如果不调整安全组的话。

**Comment by geniusxiong** [comment]
> > > 1. 这里网关要么没收到包，在端口出来到ovs就丢包了
> > > 2. 要么网关返回了，但是又直接丢包了
> > > 
> > > 由于默认vpc的网关是分布式的，本地直接响应的，所以抓包好像区分不了这两者。 如果你有underlay 网络的的，配置同样的安全组，就能够抓包区分出来这两者
> > 
> > 
> > 刚才不用虚机，在自定义VPC下创建一个pod，然后添加一个ingress禁ping的安全组，也能复现一样的问题 就是ping 网关ping不通，但是其他地址都能ping的通。 这个对于平常的pod创建影响不大，因为pod删除后，安全组也消失了，重建的时候还是能重建出pod。 但是对于虚机来说，这些配置是会保存下来，用于虚机重启等重新创建，这样就造成重建的时候，ping不通网关，创建不出虚机的情况。
> 
> 我提供的思路主要是用于确认是在到网关丢包，还是网关丢包。总体来说是安全组导致的这个问题。如果非要用icmp安全组来控制一下，何不直接ingress egress 都添加好 icmp 呢。
> 
> 可以把网关检测关闭了，你也可以参考下，如果不调整安全组的话。

大佬，我把egressRules加上放行icmp，也是一样ping不通本子网网关
```
apiVersion: kubeovn.io/v1
kind: SecurityGroup
metadata:
  annotations:
    kubesphere.io/alias-name: no-ping
    kubesphere.io/creator: sean
    kubesphere.io/description: ''
  name: sg-we0p1bei
spec:
  allowSameGroupTraffic: true
  egressRules:
    - ipVersion: ipv4
      policy: allow
      priority: 150
      protocol: all
      remoteAddress: 0.0.0.0/0
      remoteType: address
    - ipVersion: ipv4
      policy: allow
      priority: 100
      protocol: icmp
      remoteAddress: 0.0.0.0/0
      remoteType: address
  ingressRules:
    - ipVersion: ipv4
      policy: drop
      priority: 150
      protocol: all
      remoteAddress: 0.0.0.0/0
      remoteType: address
    - ipVersion: ipv4
      policy: allow
      portRangeMax: 22
      portRangeMin: 22
      priority: 100
      protocol: tcp
      remoteAddress: 0.0.0.0/0
      remoteType: address
    - ipVersion: ipv4
      policy: drop
      priority: 100
      protocol: icmp
      remoteAddress: 0.0.0.0/0
      remoteType: address

```

**Comment by bobz965** [comment]
- ipVersion: ipv4
      policy: drop
      priority: 100
      protocol: icmp
      remoteAddress: 0.0.0.0/0
      remoteType: address
这里为什么不是 allow？

**Comment by geniusxiong** [comment]
> ```
> - ipVersion: ipv4
>   policy: drop
>   priority: 100
>   protocol: icmp
>   remoteAddress: 0.0.0.0/0
>   remoteType: address
> ```
> 
> 这里为什么不是 allow？

这个安全组的功能，是想测试不让外面的ping通自己，但是自己能ping别人
然后想验证是以下哪一种
1. 这里网关要么没收到包，在端口出来到ovs就丢包了
2. 要么网关返回了，但是又直接丢包了
所以怀疑是1这里网关要么没收到包，在端口出来到ovs就丢包了

**Comment by bobz965** [comment]
> > ```
> > - ipVersion: ipv4
> >   policy: drop
> >   priority: 100
> >   protocol: icmp
> >   remoteAddress: 0.0.0.0/0
> >   remoteType: address
> > ```
> > 
> > 
> >     
> >       
> >     
> > 
> >       
> >     
> > 
> >     
> >   
> > 这里为什么不是 allow？
> 
> 这个安全组的功能，是想测试不让外面的ping通自己，但是自己能ping别人 然后想验证是以下哪一种
> 
> 1. 这里网关要么没收到包，在端口出来到ovs就丢包了
> 2. 要么网关返回了，但是又直接丢包了
>    所以怀疑是1这里网关要么没收到包，在端口出来到ovs就丢包了

如果把这里去掉或者把这个改成allow，是不是就通了？

**Comment by geniusxiong** [comment]
> > > ```
> > > - ipVersion: ipv4
> > >   policy: drop
> > >   priority: 100
> > >   protocol: icmp
> > >   remoteAddress: 0.0.0.0/0
> > >   remoteType: address
> > > ```
> > > 
> > > 
> > >     
> > >       
> > >     
> > > 
> > >       
> > >     
> > > 
> > >     
> > >   
> > > 这里为什么不是 allow？
> > 
> > 
> > 这个安全组的功能，是想测试不让外面的ping通自己，但是自己能ping别人 然后想验证是以下哪一种
> > 
> > 1. 这里网关要么没收到包，在端口出来到ovs就丢包了
> > 2. 要么网关返回了，但是又直接丢包了
> >    所以怀疑是1这里网关要么没收到包，在端口出来到ovs就丢包了
> 
> 如果把这里去掉或者把这个改成allow，是不是就通了？

那是允许被ping通，就不是要测试的功能了

**Comment by bobz965** [comment]
> > > > ```
> > > > - ipVersion: ipv4
> > > >   policy: drop
> > > >   priority: 100
> > > >   protocol: icmp
> > > >   remoteAddress: 0.0.0.0/0
> > > >   remoteType: address
> > > > ```
> > > > 
> > > > 
> > > >     
> > > >       
> > > >     
> > > > 
> > > >       
> > > >     
> > > > 
> > > >     
> > > >   
> > > > 这里为什么不是 allow？
> > > 
> > > 
> > > 这个安全组的功能，是想测试不让外面的ping通自己，但是自己能ping别人 然后想验证是以下哪一种
> > > 
> > > 1. 这里网关要么没收到包，在端口出来到ovs就丢包了
> > > 2. 要么网关返回了，但是又直接丢包了
> > >    所以怀疑是1这里网关要么没收到包，在端口出来到ovs就丢包了
> > 
> > 
> > 如果把这里去掉或者把这个改成allow，是不是就通了？
> 
> 那是允许被ping通，就不是要测试的功能了

可能有别的什么高级的配置方法，类似`有关联的`，自己ping出去的可以回来。我目前不太清楚。

**Comment by geniusxiong** [comment]
> > > > > ```
> > > > > - ipVersion: ipv4
> > > > >   policy: drop
> > > > >   priority: 100
> > > > >   protocol: icmp
> > > > >   remoteAddress: 0.0.0.0/0
> > > > >   remoteType: address
> > > > > ```
> > > > > 
> > > > > 
> > > > >     
> > > > >       
> > > > >     
> > > > > 
> > > > >       
> > > > >     
> > > > > 
> > > > >     
> > > > >   
> > > > > 这里为什么不是 allow？
> > > > 
> > > > 
> > > > 这个安全组的功能，是想测试不让外面的ping通自己，但是自己能ping别人 然后想验证是以下哪一种
> > > > 
> > > > 1. 这里网关要么没收到包，在端口出来到ovs就丢包了
> > > > 2. 要么网关返回了，但是又直接丢包了
> > > >    所以怀疑是1这里网关要么没收到包，在端口出来到ovs就丢包了
> > > 
> > > 
> > > 如果把这里去掉或者把这个改成allow，是不是就通了？
> > 
> > 
> > 那是允许被ping通，就不是要测试的功能了
> 
> 可能有别的什么高级的配置方法，类似`有关联的`，自己ping出去的可以回来。我目前不太清楚。

不是，同样的安全组下，只有ping网关不通，ping 外网（百度等）和ping 本子网的其他虚机，都可以通

**Comment by bobz965** [comment]
- ipVersion: ipv4
  policy: allow
  priority: 100
  protocol: icmp
  remoteAddress: <gw>
  remoteType: address

这样？

**Comment by geniusxiong** [comment]
> * ipVersion: ipv4
>   policy: allow
>   priority: 100
>   protocol: icmp
>   remoteAddress: ”gw“
>   remoteType: address
> 
> 这样？

这样配是可以，但是这安全组配置不通用，因为子网网关地址，不同的子网是不同的
