### ISSUE TITLE
[BUG] Packet drops with `externalTrafficPolicy: Cluster` and cilium

### ISSUE THREAD

**Issue by kvaps** [kubeovn/kube-ovn#4089]
### Kube-OVN Version

v1.13.0-e1310e1

### Kubernetes Version

v1.30.0

### Operation-system/Kernel Version

Talos v1.7.1
6.6.29-talos

### Description

Hey, I'm not sure if this is cilium bug or kube-ovn bug, so I reported both here and https://github.com/cilium/cilium/issues/32714

I have problem with using cilium and loadbalancer services in `externalTrafficPolicy: Cluster` mode.

In case if external packets SNAT'ed and are going to another node in a cluster, the response packets are not redirected back the client for some reason.

### Steps To Reproduce

1. Run kube-ovn
2. Run cilium in kube-proxy replacement mode
3. Run metallb
4. Run ingress-nginx-controller with two replicas
5. curl from the external node

### Current Behavior

Every second request will be going to another node, and it is reseted by the node, which is doing NAT after recieving `SYN, ACK`

```
11:52:30.232445 IP 192.168.100.13.57196 > 10.244.0.129.80: Flags [S], seq 1862326452, win 65535, options [mss 1460,nop,wscale 6,nop,nop,TS val 1540021380 ecr 0,sackOK,eol], length 0
11:52:30.232539 IP 10.244.0.129.80 > 192.168.100.13.57196: Flags [S.], seq 499673168, ack 1862326453, win 32352, options [mss 1360,sackOK,TS val 2139715536 ecr 1540021380,nop,wscale 7], length 0
11:52:30.232877 IP 192.168.100.13.57196 > 10.244.0.129.80: Flags [R], seq 1862326453, win 0, length 0
```

### Expected Behavior

`SYN, ACK` packet should not be reseted but forwaded back to the client.

**Comment by kvaps** [comment]
Oh, after three days of debugging I found that `ovn0` device has missing bpf program:


now I added it to cilium-config:
```
devices: "en+ ovn0"
```

and everything statred working 🎉 

```
# tc filter show dev ovn0 egress
filter protocol all pref 1 bpf chain 0
filter protocol all pref 1 bpf chain 0 handle 0x1 cil_to_netdev-ovn0 direct-action not_in_hw id 114214 tag 63638179020264a5 jited
```

Is there any way to say "use autodetected device plus another one" in cilium?

Also there is a potencial race condition, because kube-ovn requires cilium to working and starts , and cilium requires `ovn0` interface to add bpf program on it.

**Comment by kvaps** [comment]
Over the past few days, I've been addressing an issue with the non-functioning externalTrafficPolicy: Cluster in Cozystack.

After a deep dive into the BPF program code, it turned out, as usual, that the problem was not where expected but in the list of devices to which Cilium adds the necessary handlers.

By default, Cilium compiles a list of devices that contain the InternalAddress of the nodes and all those for which global unicast routes are specified. The device ovn0 does not appear on this list. However, kube-ovn uses it for delivering pod traffic to the nodes.

Currently, in Cilium, it is possible to explicitly pass a list of devices, but this disables auto-detection, or use auto-detection which is not including `ovn0` and makes `externalTrafficPolicy: Cluster` inoperative.

To resolve this issue, I have prepared a patch that adds the `--enforce-device-detection` option, allowing auto-detection to be used in addition to the devices listed. If you have a relevant user-story, please comment on this PR:

https://github.com/cilium/ciliumpull/32730#issuecomment-2135982096

/cc @lut777 @zhangzujian
