### ISSUE TITLE
[Feature Request] Add optional host access with a per-VPC VRF for custom VPCs

### ISSUE THREAD

**Issue by zhangzujian** [kubeovn/kube-ovn#7130]
### Description

Custom VPCs currently do not have a native Layer 3 attachment to the host network namespace. This creates several special-case paths:

- kubelet HTTP, TCP, and gRPC probes require the TProxy probe forwarding path;
- Pods in a custom VPC cannot transparently reach the Kubernetes API Service;
- node-to-Pod and Pod-to-node traffic requires feature-specific routing or proxying;
- components such as VpcDns need a secondary interface in the default VPC to reach the API server.

Add an optional **host access** capability for non-default VPCs. A possible API is:

```yaml
apiVersion: kubeovn.io/v1
kind: Vpc
metadata:
  name: tenant-a
spec:
  hostAccess:
    enabled: true
```

The default VPC must not be allowed to enable this option because it already uses `ovn0` and the global node switch.

#### Proposed topology

For every enabled custom VPC, the controller should allocate a stable, cluster-wide short ID and create:

1. a dedicated host-transit logical switch connected to the VPC logical router through an LRP;
2. one LSP per node on the host-transit switch;
3. one OVS internal port per node, such as `ovn1`, `ovn2`, and so on;
4. one Linux VRF per node, such as `vrf1`, `vrf2`, and so on, with a dedicated routing table;
5. the host-transit address and all VPC-specific routes in that VRF table.

Decimal suffixes should be used instead of base36 because they map directly to the persisted ID and are easier to correlate across VPC status, logs, and node diagnostics. Even the maximum `uint32` value fits within the Linux 15-character limit (`ovn4294967295` and `vrf4294967295` are 13 characters), so base36 compression is unnecessary.

The OVS internal port should be enslaved to the corresponding VRF. The short ID, interface name, VRF name, routing table ID, transit allocation, and readiness conditions should be persisted in VPC status instead of being derived from process-local state.

A cluster-level host-transit address pool may be required. Enabling the feature should not require per-VPC address configuration, but the controller must validate that allocated transit addresses do not overlap with the VPC networks.

#### Expected behavior

When host access is ready:

- the controller automatically installs VPC logical-router routes and policies for node-to-Pod and Pod-to-node communication;
- kubelet liveness, readiness, and startup probes using HTTP, TCP, HTTPS, or gRPC can reach Pods without TProxy in supported topologies;
- Pods can reach the `default/kubernetes` Service without Pod annotations or an additional Multus interface;
- Pods can reach configured external networks through a controlled routed or SNAT path on eligible nodes when host egress is enabled;
- different VPCs remain disconnected in OVN and use different host VRF routing tables;
- disabling the option removes the generated routes, policies, LSPs, OVS ports, and VRFs in a dependency-safe and idempotent order.

Transparent API access requires more than a host route. The controller should project the `default/kubernetes` ClusterIP, ports, and current backends into every ready host-access VPC load balancer, maintain routes to the API endpoints or nodes, and install narrow ACLs for the API destination. This should work with iptables, nftables, IPVS, and deployments without kube-proxy.

DNS is intentionally outside the scope of this feature. Users may deploy NodeLocal DNS or another DNS solution, provided its target address is reachable from the VPC. Host access can remove the need for VpcDns to use a default-VPC interface only for API connectivity, but it does not inject DNS configuration into application Pods.

#### External connectivity through the host network

Host access should also define an optional path for custom VPC Pods to reach networks outside the cluster through node host networking. This is a separate capability from basic node/Pod reachability and must be reconciled explicitly rather than inheriting the main routing table by accident.

The logical router may install selected-prefix or default routes toward one or more ready node host-transit addresses. On each selected node, the daemon should install the corresponding routes in the VPC VRF and provide a controlled connection to the physical uplink. A physical interface cannot be enslaved to multiple VRFs, so the implementation must define either an explicit route-leak boundary, a per-VPC uplink device, or another equally isolated mechanism. It must not silently make the complete main routing table reachable from every VPC.

Two egress modes should be considered:

- **Routed egress:** preserve the Pod source address. The external network must have a return route for the VPC CIDRs through the selected node or an advertised next hop.
- **SNAT egress:** translate traffic to a VPC-specific egress identity. Rules must be scoped by VRF/interface and must not rely only on a global source-CIDR ipset. Each VPC needs a defined conntrack zone or equivalent isolation, and return traffic must recover the correct zone before conntrack lookup.

In both modes, only nodes whose host uplink is ready should be published as logical-router next hops. The design must define ECMP or active/standby selection, node failure behavior, route withdrawal, source-address selection, reverse-path filtering, and IPv4/IPv6 behavior. External egress must not create a route between VPCs or expose unrelated host and cluster networks. Stateful SNAT failover must not claim connection preservation unless conntrack state is synchronized.

Acceptance tests should cover multiple VPCs reaching the same external destination, routed return traffic, SNAT return traffic, node failure and route withdrawal, asymmetric paths, and verification that no VPC can use another VPC routing table or egress identity.

#### Initial scope and compatibility constraints

The first implementation should explicitly limit the supported topology:

- Support routed Overlay custom VPCs first.
- Reject pure Underlay subnets without U2O because their traffic does not traverse the custom VPC logical router.
- Require Pod CIDRs of host-access VPCs to be non-overlapping with the default VPC and every other host-access VPC.
- Keep TProxy enabled until the complete probe matrix has been validated.
- Do not add host-based `natOutgoing` for custom VPCs in the first version. Existing OVN-native SNAT or VpcEgressGateway should remain the preferred egress path.
- Reject coexistence with `dynamicRouting.maintainVrf=true` from #7085 until both features have a single VRF owner and a shared routing-table allocation model.

The non-overlapping-CIDR restriction is important. Kubelet probe requests only contain `PodIP:port`; they do not carry a VPC or VRF identity. A normal kubelet socket also does not automatically select a Linux VRF. Destination-based policy routing can steer non-overlapping CIDRs, but it cannot distinguish two VPCs containing the same `PodIP:port`. The current TProxy map has a similar Pod-IP identity limitation.

Linux VRF should also not be treated as a network-namespace security boundary. VRFs isolate Layer 3 FIBs, while sockets, netfilter, conntrack, and sysctls are still shared in the host network namespace. The implementation therefore needs:

- explicit INPUT, FORWARD, OUTPUT, and NAT rules scoped by the VRF or real interface;
- a deliberate listener policy instead of globally exposing every unbound host listener through `tcp_l3mdev_accept` or `udp_l3mdev_accept`;
- a documented conntrack-zone strategy if overlapping tuples or host NAT are supported later;
- IPv4, IPv6, reverse-path filtering, ICMP error, fragmentation, and asymmetric-return-path tests.

If overlapping VPC CIDRs, no probe proxy, shared host NAT, and strict host isolation must all be supported simultaneously, a per-VPC network namespace or a probe mechanism carrying an explicit VPC identity is likely required instead of VRF-only host access.

#### Lifecycle and validation requirements

- Interface names must respect the Linux 15-character limit.
- Routing table IDs must not conflict with the current TProxy table (`10001`), Subnet policy routing tables, dynamic-routing VRF IDs, or existing host VRFs.
- The controller should publish logical-router node policies and API Service entries only after the daemon reports the node attachment ready.
- Reconciliation and garbage collection must cover VPC enable, disable, and delete; node add and delete; daemon, controller, and OVS restart; partial failure; and upgrade rollback.
- Generated OVN and Linux objects need ownership metadata so cleanup cannot remove user-managed objects.
- A degraded node must be visible through per-VPC conditions instead of only the global `NodeNetworkUnavailable` condition.

Suggested delivery phases:

1. IPv4, non-overlapping Overlay prototype for node-to-Pod and Pod-to-controlled-node-service traffic.
2. Complete lifecycle, dual-stack support, API Service projection, ACLs, and the full kubelet probe matrix.
3. Optional work on host-network routed/SNAT egress, overlapping CIDRs, a VPC-aware probe path, conntrack zones, Underlay with U2O, and integration with dynamic routing.

### Who will benefit from this feature?

Users running tenant workloads in custom VPCs who need Kubernetes health probes, transparent API access, controlled node-service access, and simpler DNS or control-plane components without attaching every workload to the default VPC.

### Anything else?

Related existing behavior and discussions:

- Custom VPC Service connectivity report: #2787
- Node access to a custom VPC workload through a NAT gateway: #6124
- OVN dynamic routing and VRF ownership: #7085
- Current VPC DNS design: https://kubeovn.github.io/docs/stable/en/vpc/vpc-internal-dns/
- Linux VRF documentation: https://docs.kernel.org/networking/vrf.html

The proposed feature should be named around **host access** in the API. VRF is an implementation mechanism and does not, by itself, provide complete host namespace isolation.

**Comment by zhangzujian** [comment]
@oilbeater @changluyi @zbb88888 @SkalaNetworks Could you please review this FR?

**Comment by zhangzujian** [comment]
Updated feasibility result (**per-VPC VRFs + policy rules, no leak veths, `tcp_l3mdev_accept=0`**): **routed forwarding passes, transparent TCP host access does not**.

Prototype and reproduction:

- Commit: https://github.com/zhangzujian/kube-ovn/commit/197e5ce14
- Run: `bash hack/prototypes/issue-7130-vrf-host-access/run.sh`
- Environment: Linux 6.18.33.2-microsoft-standard-WSL2, IPv4

The prototype still creates six anonymous, process-owned network namespaces: two Pods, two simulated VPC routers, one simulated host, and one external network. The real root network namespace receives no interfaces, addresses, routes, rules, sysctls, or netfilter rules; its configuration fingerprint was identical before and after the run.

This revision removes all of the previous route-leak devices and addresses:

- no `leak1v` / `leak1m` or `leak2v` / `leak2m`;
- no `198.18.x.x` transit addresses;
- no nftables/iptables rules, conntrack zones, or NAT;
- `net.ipv4.tcp_l3mdev_accept` is explicitly kept at `0`.

Each VRF table now contains only its Pod route, connected host-transit route, and an unreachable default. The simulated host uses the following rule ordering:

```text
0:   lookup local
40:  from 10.10.1.0/24 to 203.0.113.0/24 lookup main
41:  from 10.10.2.0/24 to 203.0.113.0/24 lookup main
50:  iif h1vpc lookup 1001
51:  iif h2vpc lookup 1002
100: to 10.10.1.0/24 lookup 1001
101: to 10.10.2.0/24 lookup 1002
1000: lookup l3mdev-table
32766: lookup main
```

The narrow egress rules run before the ingress guards. The ingress guards keep all other packets from each VPC in their original table, where the unreachable default prevents cross-VPC fallback. Lower-priority destination rules serve locally generated host traffic and external returns.

Observed results:

- Both Pods reached their own host-transit addresses.
- Both Pods reached the simulated host's main-domain local address through the local table.
- A plain host wildcard listener on `0.0.0.0:18081` correctly remained unreachable from both VRFs while `tcp_l3mdev_accept=0`.
- `ip route get` for both Pod addresses selected the expected VPC table and transit source address.
- Ordinary host ICMP sockets reached both Pods through the destination rules.
- Ordinary, VRF-unaware host TCP clients still timed out, despite the correct FIB result.
- The same TCP clients succeeded when explicitly executed in `vrf1` or `vrf2`, with source addresses `172.31.1.2` and `172.31.2.2`.
- VPC 1 could not reach VPC 2, and VPC 2 could not reach VPC 1.
- Both VPCs reached the same external TCP server through the host main uplink. The server observed the original sources `10.10.1.2` and `10.10.2.2`.
- The root-network-namespace fingerprint remained unchanged, and `tcp_l3mdev_accept` was still `0` at the end.

Implications for #7130:

1. Policy rules can replace the leak veth pairs and their extra addresses for ICMP and selected-prefix routed forwarding.
2. Policy rules solve FIB selection, but they do not associate a default-domain TCP socket with the selected VPC VRF. They are therefore insufficient by themselves for transparent, unmodified kubelet TCP/HTTP/HTTPS/gRPC probes.
3. Keeping `tcp_l3mdev_accept=0` is viable, but TCP host access then needs an explicitly VRF-scoped client/listener, a narrow proxy, or packet re-entry into the main domain.
4. TProxy must remain enabled until a transparent TCP probe mechanism is separately proven.
5. SNAT, default-route leakage, OVN/OVS integration, IPv6, lifecycle, and failure withdrawal remain outside this prototype.

<details>
<summary>Full prototype script</summary>

```bash
#!/usr/bin/env bash
set -euo pipefail

# PROTOTYPE ONLY: validate the Linux VRF data-path premise proposed in issue #7130.
# Every mutable network object lives in an anonymous process-owned network namespace.

declare -A ns_pid=()
declare -a holder_pids=()
declare -a server_pids=()
scratch_dir=

cleanup() {
  local status=$?
  local pid
  for pid in "${server_pids[@]}"; do
    kill "$pid" 2>/dev/null || true
  done
  for pid in "${holder_pids[@]}"; do
    kill "$pid" 2>/dev/null || true
  done
  wait 2>/dev/null || true
  if [[ -n "$scratch_dir" && -d "$scratch_dir" ]]; then
    rm -rf -- "$scratch_dir"
  fi
  return "$status"
}
trap cleanup EXIT INT TERM

fail() {
  printf 'FAIL: %s\n' "$*" >&2
  exit 1
}

pass() {
  printf 'PASS: %s\n' "$*"
}

require_command() {
  command -v "$1" >/dev/null 2>&1 || fail "required command not found: $1"
}

root_network_fingerprint() {
  {
    ip -o link show
    ip -o address show
    ip route show table all
    ip rule show
    nft list ruleset | sed -E 's/counter packets [0-9]+ bytes [0-9]+/counter packets N bytes N/g'
    sysctl -n net.ipv4.ip_forward
  } | sha256sum | awk '{print $1}'
}

start_namespace() {
  local name=$1
  local root_netns
  local current_netns

  root_netns=$(readlink /proc/self/ns/net)
  unshare --net -- sleep infinity &
  local pid=$!
  holder_pids+=("$pid")

  for _ in $(seq 1 100); do
    if [[ -r /proc/$pid/ns/net ]]; then
      current_netns=$(readlink "/proc/$pid/ns/net")
      if [[ "$current_netns" != "$root_netns" ]]; then
        ns_pid["$name"]=$pid
        ns "$name" ip link set lo up
        return
      fi
    fi
    sleep 0.01
  done
  fail "network namespace $name did not start"
}

ns() {
  local name=$1
  shift
  nsenter --target "${ns_pid[$name]}" --net -- "$@"
}

add_cross_namespace_veth() {
  local left_ns=$1
  local left_if=$2
  local right_ns=$3
  local right_if=$4

  ip link add name "$left_if" netns "${ns_pid[$left_ns]}" \
    type veth peer name "$right_if" netns "${ns_pid[$right_ns]}"
  ns "$left_ns" ip link set "$left_if" up
  ns "$right_ns" ip link set "$right_if" up
}

disable_rp_filter() {
  local name=$1
  local interface

  ns "$name" sysctl -qw net.ipv4.conf.all.rp_filter=0
  ns "$name" sysctl -qw net.ipv4.conf.default.rp_filter=0
  while read -r interface; do
    ns "$name" sysctl -qw "net.ipv4.conf.$interface.rp_filter=0"
  done < <(ns "$name" ip -o link show | awk -F': ' '{print $2}' | cut -d@ -f1)
}

start_echo_server() {
  local name=$1
  local address=$2
  local port=$3
  local connections=$4
  local log_file=$5

  nsenter --target "${ns_pid[$name]}" --net -- \
    python3 -u -c '
import socket
import sys

address = sys.argv[1]
port = int(sys.argv[2])
connections = int(sys.argv[3])
with socket.socket() as listener:
    listener.setsockopt(socket.SOL_SOCKET, socket.SO_REUSEADDR, 1)
    listener.bind((address, port))
    listener.listen()
    for _ in range(connections):
        connection, peer = listener.accept()
        with connection:
            connection.sendall((peer[0] + "\n").encode())
' "$address" "$port" "$connections" >"$log_file" 2>&1 &
  server_pids+=("$!")
}

tcp_peer() {
  local name=$1
  local address=$2
  local port=$3

  ns "$name" python3 -c '
import socket
import sys
import time

address = sys.argv[1]
port = int(sys.argv[2])
last_error = None
for _ in range(50):
    try:
        with socket.create_connection((address, port), timeout=1) as connection:
            print(connection.recv(128).decode().strip())
            raise SystemExit(0)
    except OSError as error:
        last_error = error
        time.sleep(0.05)
raise SystemExit(f"connection failed: {last_error}")
' "$address" "$port"
}

tcp_peer_in_vrf() {
  local name=$1
  local vrf=$2
  local address=$3
  local port=$4

  ns "$name" ip vrf exec "$vrf" python3 -c '
import socket
import sys
import time

address = sys.argv[1]
port = int(sys.argv[2])
last_error = None
for _ in range(50):
    try:
        with socket.create_connection((address, port), timeout=1) as connection:
            print(connection.recv(128).decode().strip())
            raise SystemExit(0)
    except OSError as error:
        last_error = error
        time.sleep(0.05)
raise SystemExit(f"connection failed: {last_error}")
' "$address" "$port"
}

assert_equal() {
  local actual=$1
  local expected=$2
  local description=$3
  [[ "$actual" == "$expected" ]] || fail "$description: expected $expected, got $actual"
  pass "$description ($actual)"
}

for command in ip nft nsenter unshare python3 ping sha256sum sysctl; do
  require_command "$command"
done
[[ $(id -u) -eq 0 ]] || fail "this prototype must run as root"

root_before=$(root_network_fingerprint)
scratch_dir=$(mktemp -d)

printf 'Creating isolated topology...\n'
for name in host vpc1 vpc2 pod1 pod2 external; do
  start_namespace "$name"
done

add_cross_namespace_veth pod1 p1eth vpc1 v1pod
add_cross_namespace_veth vpc1 v1host host h1vpc
add_cross_namespace_veth pod2 p2eth vpc2 v2pod
add_cross_namespace_veth vpc2 v2host host h2vpc
add_cross_namespace_veth host uplink0 external ext0

ns host ip link add vrf1 type vrf table 1001
ns host ip link add vrf2 type vrf table 1002
ns host ip link set vrf1 up
ns host ip link set vrf2 up
ns host ip link set h1vpc master vrf1
ns host ip link set h2vpc master vrf2

ns pod1 ip address add 10.10.1.2/24 dev p1eth
ns pod1 ip route add default via 10.10.1.1
ns vpc1 ip address add 10.10.1.1/24 dev v1pod
ns vpc1 ip address add 172.31.1.1/30 dev v1host
ns vpc1 ip route add default via 172.31.1.2

ns pod2 ip address add 10.10.2.2/24 dev p2eth
ns pod2 ip route add default via 10.10.2.1
ns vpc2 ip address add 10.10.2.1/24 dev v2pod
ns vpc2 ip address add 172.31.2.1/30 dev v2host
ns vpc2 ip route add default via 172.31.2.2

ns host ip address add 172.31.1.2/30 dev h1vpc
ns host ip route add table 1001 10.10.1.0/24 via 172.31.1.1 dev h1vpc
ns host ip route add table 1001 unreachable default metric 4278198272

ns host ip address add 172.31.2.2/30 dev h2vpc
ns host ip route add table 1002 10.10.2.0/24 via 172.31.2.1 dev h2vpc
ns host ip route add table 1002 unreachable default metric 4278198272

ns host ip address add 203.0.113.1/24 dev uplink0
ns external ip address add 203.0.113.2/24 dev ext0
ns external ip route add 10.10.1.0/24 via 203.0.113.1
ns external ip route add 10.10.2.0/24 via 203.0.113.1

# The narrow egress rules run first. The ingress guards then keep every other
# packet from a VPC in its original table, before the destination rules make
# Pod CIDRs reachable to locally generated host traffic and external returns.
ns host ip rule add priority 40 from 10.10.1.0/24 to 203.0.113.0/24 lookup main
ns host ip rule add priority 41 from 10.10.2.0/24 to 203.0.113.0/24 lookup main
ns host ip rule add priority 50 iif h1vpc lookup 1001
ns host ip rule add priority 51 iif h2vpc lookup 1002
ns host ip rule add priority 100 to 10.10.1.0/24 lookup 1001
ns host ip rule add priority 101 to 10.10.2.0/24 lookup 1002

for name in host vpc1 vpc2 external; do
  ns "$name" sysctl -qw net.ipv4.ip_forward=1
  disable_rp_filter "$name"
done
ns host sysctl -qw net.ipv4.tcp_l3mdev_accept=0

printf '\nSimulated host state:\n'
ns host ip -brief link show
printf '\nVRF routes:\n'
ns host ip route show table 1001
ns host ip route show table 1002
printf '\nMain-table routes and policy rules:\n'
ns host ip route show table main
ns host ip rule show

printf '\nValidating Pod/host connectivity...\n'
ns pod1 ping -q -c 2 -W 1 172.31.1.2 >/dev/null
pass "VPC 1 Pod reaches its host-transit address"
ns pod2 ping -q -c 2 -W 1 172.31.2.2 >/dev/null
pass "VPC 2 Pod reaches its host-transit address"
ns pod1 ping -q -c 2 -W 1 203.0.113.1 >/dev/null
pass "VPC 1 Pod reaches a main-domain host-local address through the local table"
ns pod2 ping -q -c 2 -W 1 203.0.113.1 >/dev/null
pass "VPC 2 Pod reaches a main-domain host-local address through the local table"

start_echo_server host 0.0.0.0 18081 1 "$scratch_dir/host.log"
if peer=$(tcp_peer pod1 172.31.1.2 18081 2>/dev/null); then
  fail "plain host listener unexpectedly accepted VRF traffic while tcp_l3mdev_accept=0 from $peer"
fi
pass "tcp_l3mdev_accept=0 keeps a plain wildcard listener outside the VPC VRFs"
kill "${server_pids[-1]}" 2>/dev/null || true
wait "${server_pids[-1]}" 2>/dev/null || true

start_echo_server pod1 10.10.1.2 18091 1 "$scratch_dir/pod1.log"
start_echo_server pod2 10.10.2.2 18092 1 "$scratch_dir/pod2.log"
ns host ip route get 10.10.1.2
ns host ip route get 10.10.2.2
ns host ping -q -c 2 -W 1 10.10.1.2 >/dev/null
pass "an ordinary host ICMP socket reaches VPC 1 Pod through the destination policy rule"
ns host ping -q -c 2 -W 1 10.10.2.2 >/dev/null
pass "an ordinary host ICMP socket reaches VPC 2 Pod through the destination policy rule"
if peer=$(tcp_peer host 10.10.1.2 18091 2>/dev/null); then
  fail "a VRF-unaware host TCP socket unexpectedly reached VPC 1 Pod from $peer"
fi
pass "a VRF-unaware host TCP socket remains isolated from VPC 1 while tcp_l3mdev_accept=0"
if peer=$(tcp_peer host 10.10.2.2 18092 2>/dev/null); then
  fail "a VRF-unaware host TCP socket unexpectedly reached VPC 2 Pod from $peer"
fi
pass "a VRF-unaware host TCP socket remains isolated from VPC 2 while tcp_l3mdev_accept=0"
assert_equal "$(tcp_peer_in_vrf host vrf1 10.10.1.2 18091)" "172.31.1.2" \
  "a VRF-scoped host TCP socket reaches VPC 1 Pod"
assert_equal "$(tcp_peer_in_vrf host vrf2 10.10.2.2 18092)" "172.31.2.2" \
  "a VRF-scoped host TCP socket reaches VPC 2 Pod"

if ns pod1 ping -q -c 1 -W 1 10.10.2.2 >/dev/null 2>&1; then
  fail "VPC 1 unexpectedly reached VPC 2"
fi
pass "the VPC 1 ingress guard and unreachable default block traffic to VPC 2"
if ns pod2 ping -q -c 1 -W 1 10.10.1.2 >/dev/null 2>&1; then
  fail "VPC 2 unexpectedly reached VPC 1"
fi
pass "the VPC 2 ingress guard and unreachable default block traffic to VPC 1"

printf '\nValidating routed external egress...\n'
start_echo_server external 203.0.113.2 18080 2 "$scratch_dir/external.log"
assert_equal "$(tcp_peer pod1 203.0.113.2 18080)" "10.10.1.2" \
  "VPC 1 routed egress preserves the Pod source"
assert_equal "$(tcp_peer pod2 203.0.113.2 18080)" "10.10.2.2" \
  "VPC 2 routed egress preserves the Pod source"

root_after=$(root_network_fingerprint)
assert_equal "$root_after" "$root_before" "root network namespace remains unchanged"
assert_equal "$(ns host sysctl -n net.ipv4.tcp_l3mdev_accept)" "0" \
  "the simulated host keeps tcp_l3mdev_accept disabled"

printf '\nVERDICT: policy rules replace the leak veths for ICMP and routed forwarding without consuming extra addresses.\n'
printf 'With tcp_l3mdev_accept disabled, transparent host TCP sockets remain unavailable; an explicitly VRF-scoped client works.\n'
```

</details>

**Comment by SkalaNetworks** [comment]
A few questions/remarks:
- What are the benefits of the NAT-through-host? This bypasses any need for an egress/NAT gateway, which is good, but also adds a new third option to NAT out of a VPC (4th option if we count natOutgoing for subnets in the default VPC). I could see this as a new easy to setup option, but also as even more options to do the same thing.
- Can this support IPv6, the document specifies non-overlapping subnets with the podCIDR, does that include IPV4/IPv6/DualStack?
- "The short ID, interface name, VRF name, routing table ID, transit allocation, and readiness conditions should be persisted in VPC status instead of being derived from process-local state." This makes sense, but does that mean the ID is non-stable? If yes, what happens if the status is lost for some reason? This could not be a problem at all, but I wanna check.
- Different VPCs with the feature activated must not contain "overlapping CIDRs". Does that mean that VPC 1 and VPC 2 can't both have the feature activated at the same time if they contain a subnet 10.10.0.0/24? It would make sense, but that is pretty restricting. That's as if they were running in the same VPC in terms of restrictions (can't have 2 subnets with the same CIDR in the same VPC). Would there be a way to circumvent that somehow? SNAT is obviously a possibility to map everything to non-overlapping ranges, but that sounds like quite a headache.

**Comment by zhangzujian** [comment]
@SkalaNetworks 

> What are the benefits of the NAT-through-host? This bypasses any need for an egress/NAT gateway, which is good, but also adds a new third option to NAT out of a VPC (4th option if we count natOutgoing for subnets in the default VPC). I could see this as a new easy to setup option, but also as even more options to do the same thing.

The original motivation for this feature is to provide users with a simple and convenient way to use a VPC while retaining access to kube-dns. At this point, it is still just an early idea and the design is not yet mature. Direct communication between the host/kubelet and pods in the VPC, as well as NAT-through-host, are extensions built on top of this basic capability.

> Can this support IPv6, the document specifies non-overlapping subnets with the podCIDR, does that include IPV4/IPv6/DualStack?

In theory, it should support IPv4, IPv6, and DualStack.

> "The short ID, interface name, VRF name, routing table ID, transit allocation, and readiness conditions should be persisted in VPC status instead of being derived from process-local state." This makes sense, but does that mean the ID is non-stable? If yes, what happens if the status is lost for some reason? This could not be a problem at all, but I wanna check.

The controller is responsible for generating a globally unique ID and persisting it in the VPC status.

> Different VPCs with the feature activated must not contain "overlapping CIDRs". Does that mean that VPC 1 and VPC 2 can't both have the feature activated at the same time if they contain a subnet 10.10.0.0/24? It would make sense, but that is pretty restricting. That's as if they were running in the same VPC in terms of restrictions (can't have 2 subnets with the same CIDR in the same VPC). Would there be a way to circumvent that somehow? SNAT is obviously a possibility to map everything to non-overlapping ranges, but that sounds like quite a headache.

This is a compromise made after weighing the trade-offs. At the moment, I have not found a better solution.

**Comment by SkalaNetworks** [comment]
I have to say it is a very interesting feature, especially to reach the API server, as running anything that needs API access is a pain in custom subnets.

I usually use Kube-OVN in multi-tenant envs where subnet CIDRs collide all the time, so this makes it a bit harder to work with, but I believe this is already a good beginning to solve quite a lot of issues when using custom Subnets.

I'll gladly review the PR if you start working on an implementation.


One thing I'd find useful is an easy way to see the routes within the VRF at a glance (in a status or anything)


Also, this PR https://github.com/kubeovn/kube-ovn/pull/7085 is identified in your FR but rejected as a potential way to help solve the problem. I don't really know or understand that new OVN feature, but considering it relates to VRF, can't it be useful?

**Comment by zhangzujian** [comment]
> I have to say it is a very interesting feature, especially to reach the API server, as running anything that needs API access is a pain in custom subnets.

Accessing the API server may still have some limitations or require additional host configuration. We need to investigate and validate this further.

> One thing I'd find useful is an easy way to see the routes within the VRF at a glance (in a status or anything)

Perhaps we could add the computed routes and rules to the status.

> Also, this PR #7085 is identified in your FR but rejected as a potential way to help solve the problem. I don't really know or understand that new OVN feature, but considering it relates to VRF, can't it be useful?

I am not very familiar with this feature either, so I need to look into it further.

**Comment by zhangzujian** [comment]
## Two-node validation on a real Kube-OVN cluster

I repeated the persistent netns prototype on both nodes of a real two-node cluster running Kube-OVN `v1.15.19` and Linux `5.15.0-56-generic` (IPv4). The same result was reproduced independently on the control-plane and worker nodes.

### Kernel prerequisite

Both nodes had `CONFIG_NET_VRF=m`, but the minimal node image did not contain `vrf.ko`; `ip link add ... type vrf` therefore returned `Unknown device type`. I extracted the exact `vrf.ko` from the official Ubuntu `linux-modules-extra-5.15.0-56-generic_5.15.0-56.62_amd64.deb`, verified the package SHA256 `e1db5a959a0bb59a166bc7b897aab8982694df6e3f5103aefa73021f49387504`, installed the 57,073-byte module on each node, ran `depmod`, and loaded it. The installed module SHA256 is `d62f6213c2c6f7fc11d29d6467896bd130748ca5cc453bfc3a25f66d8ddc145a`.

This is an environment prerequisite, not a requirement to download a module on every deployment: no extra action is needed when VRF is built into the kernel or the matching module is already installed.

### Persistent topology on each node

The validation creates and intentionally retains the same eight named network namespaces on each node:

```text
w19-dpod -> w19-def  -> w19-host(main) -> w19-ext
w19-pod1 -> w19-vpc1 -> h1vpc/vrf1(table 1001) -- policy rules --> main
w19-pod2 -> w19-vpc2 -> h2vpc/vrf2(table 1002) -- policy rules --> main
```

- Default VPC Pod/router: `10.10.0.2/24` -> `10.10.0.1`, host transit `172.30.0.1/30` <-> `172.30.0.2/30`; no VRF.
- Custom VPC 1: Pod `10.10.1.2/24`, router `10.10.1.1`, host transit `172.31.1.1/30` <-> `172.31.1.2/30`, `vrf1`, table `1001`.
- Custom VPC 2: Pod `10.10.2.2/24`, router `10.10.2.1`, host transit `172.31.2.1/30` <-> `172.31.2.2/30`, `vrf2`, table `1002`.
- Simulated main uplink/external: `203.0.113.1/24` <-> `203.0.113.2/24`.
- Simple listeners only: `python3 -m http.server <port>` on ports `18080`, `18081`, `18090`, `18091`, and `18092`.
- No leak veths, no `198.18.0.0/15` addresses, no NAT, no netfilter changes, and no conntrack zones.

The final custom-VPC rules on each simulated host are:

```text
0:    lookup local
30:   iif lo      to 10.10.1.0/24 lookup 1001
31:   iif lo      to 10.10.2.0/24 lookup 1002
32:   iif uplink0 to 10.10.1.0/24 lookup 1001
33:   iif uplink0 to 10.10.2.0/24 lookup 1002
40:   iif vrf1 from 10.10.1.0/24 to 203.0.113.0/24 lookup main
41:   iif vrf2 from 10.10.2.0/24 to 203.0.113.0/24 lookup main
50:   iif vrf1 lookup 1001
51:   iif vrf2 lookup 1002
1000: l3mdev
32766: lookup main
```

Each VRF table contains only the connected host-transit route, its Pod CIDR route, and `unreachable default metric 4278198272`. Main has no route to either custom Pod CIDR.

### Results reproduced on both nodes

- Default VPC compatibility passed: Pod-to-host ICMP/TCP, host-to-Pod ICMP/TCP, and routed external TCP all succeeded through main.
- Both custom Pods reached their own host-transit address and a main-domain host-local address with ICMP.
- With `tcp_l3mdev_accept=0`, a plain host wildcard listener was unreachable from both custom VRFs, as expected.
- Ordinary host ICMP reached both custom Pods through the `iif lo` destination rules.
- VRF-unaware host TCP could not reach either custom Pod; the same clients succeeded under `ip vrf exec vrf1/vrf2`.
- Default-to-custom, custom-to-default, and custom1-to-custom2/custom2-to-custom1 traffic all remained isolated.
- Both custom Pods reached the same external listener through selected-prefix main-table routing; the external server observed the original sources `10.10.1.2` and `10.10.2.2`.
- The real node root network configuration fingerprint was unchanged on both nodes after normalizing counters and generated timestamps. The real-node and simulated-host `tcp_l3mdev_accept` values both remained `0`.

Normalized root-network fingerprints were `82441b2bf303a6ba7798ede9ba765adbc0c6c26d87dab19c1bf618728075ae76` and `d4c40019e31bb8f3e8d0c78d9f18258ae0c5b96a953e7ae3ba7b52acb125e1dc`.

### Important Linux 5.15 finding

For packets received through a VRF slave, policy-rule matching on this kernel sees the ingress L3 domain as the VRF master. Rules using `iif h1vpc/h2vpc` did not match and fell through to the VRF unreachable default. The correct selectors were `iif vrf1/vrf2`; `h1vpc/h2vpc` remain the table next-hop devices. This should be reflected in any daemon implementation and tested across supported kernels.

### Design implication

The default VPC does not need a VRF. Keeping it in main preserves existing behavior, while isolation is maintained by omitting custom Pod CIDR routes from main and by placing all non-selected custom-VPC ingress behind the VRF-table guards. Policy rules eliminate leak veth pairs and their extra addresses for ICMP and selected-prefix routed forwarding.

They still do not make an unmodified default-domain TCP socket VRF-aware. With `tcp_l3mdev_accept=0`, transparent kubelet TCP/HTTP/HTTPS/gRPC probing still requires an explicit VRF socket context, a narrow proxy, or another VPC-aware mechanism. TProxy should remain until that path is implemented and validated.

All namespaces, links, addresses, routes, rules, VRFs, listener processes, logs, and result files are intentionally retained on both validation nodes. The final script is also retained as `/root/issue-7130-vrf-w19.sh` (SHA256 `8d53f6cf6fa0be53d5c950dd7435e7dec7c6cff931a10f4ddb6785321482262b`).

<details>
<summary>Full persistent two-node validation script</summary>

The script assumes the matching Linux VRF module is already available. It intentionally contains no cleanup path.

```bash
#!/usr/bin/env bash
set -euo pipefail

# Persistent IPv4 feasibility lab for kubeovn/kube-ovn issue #7130.
# All mutable network objects are created inside named w19-* network namespaces.
# The script intentionally has no cleanup path: the user requested that both
# nodes retain the complete lab after validation.

readonly RESULT_LOG=/root/issue-7130-vrf-w19-results.txt
readonly ROOT_BEFORE=/root/issue-7130-vrf-w19-root-before.txt
readonly ROOT_AFTER=/root/issue-7130-vrf-w19-root-after.txt

exec > >(tee "$RESULT_LOG") 2>&1

fail() {
  printf 'FAIL: %s\n' "$*" >&2
  exit 1
}

pass() {
  printf 'PASS: %s\n' "$*"
}

require_command() {
  command -v "$1" >/dev/null 2>&1 || fail "required command not found: $1"
}

root_network_state() {
  {
    ip -o link show
    ip -o address show
    ip route show table all
    ip -6 route show table all
    ip rule show
    ip -6 rule show
    sysctl -n net.ipv4.ip_forward
    sysctl -n net.ipv4.tcp_l3mdev_accept
    sysctl -n net.ipv4.udp_l3mdev_accept
    if command -v nft >/dev/null 2>&1; then
      nft list ruleset 2>/dev/null |
        sed -E 's/counter packets [0-9]+ bytes [0-9]+/counter packets N bytes N/g'
    fi
    if command -v iptables-save >/dev/null 2>&1; then
      iptables-save -c 2>/dev/null |
        sed -E 's/\[[0-9]+:[0-9]+\]/[N:N]/g; /^# (Generated by|Completed on) /d'
    fi
  } | sed -E 's/valid_lft [^ ]+ preferred_lft [^ ]+/valid_lft X preferred_lft X/g'
}

add_veth() {
  local left_ns=$1
  local left_if=$2
  local right_ns=$3
  local right_if=$4

  if ip -n "$left_ns" link show "$left_if" >/dev/null 2>&1 &&
     ip -n "$right_ns" link show "$right_if" >/dev/null 2>&1; then
    printf 'Resuming retained veth: %s/%s <-> %s/%s\n' "$left_ns" "$left_if" "$right_ns" "$right_if"
    return
  fi
  if ip -n "$left_ns" link show "$left_if" >/dev/null 2>&1 ||
     ip -n "$right_ns" link show "$right_if" >/dev/null 2>&1; then
    fail "incomplete retained veth: $left_ns/$left_if <-> $right_ns/$right_if"
  fi

  ip -n "$left_ns" link add "$left_if" \
    type veth peer name "$right_if" netns "$right_ns"
  ip -n "$left_ns" link set "$left_if" up
  ip -n "$right_ns" link set "$right_if" up
}

enable_router() {
  local namespace=$1
  local interface

  ip netns exec "$namespace" sysctl -qw net.ipv4.ip_forward=1
  ip netns exec "$namespace" sysctl -qw net.ipv4.conf.all.rp_filter=0
  ip netns exec "$namespace" sysctl -qw net.ipv4.conf.default.rp_filter=0
  while read -r interface; do
    ip netns exec "$namespace" sysctl -qw "net.ipv4.conf.${interface}.rp_filter=0"
  done < <(ip -n "$namespace" -o link show | awk -F': ' '{print $2}' | cut -d@ -f1)
}

start_http_server() {
  local namespace=$1
  local port=$2
  local label=$3
  local log_file="/root/issue-7130-vrf-w19-${label}.log"
  local pid_file="/run/issue-7130-vrf-w19-${label}.pid"

  ip netns exec "$namespace" \
    nohup python3 -u -m http.server "$port" >"$log_file" 2>&1 </dev/null &
  printf '%s\n' "$!" >"$pid_file"
}

wait_for_http_server() {
  local namespace=$1
  local port=$2

  for _ in $(seq 1 100); do
    if ip netns exec "$namespace" ss -ltnH "sport = :$port" | grep -q .; then
      return
    fi
    sleep 0.1
  done
  fail "HTTP server did not listen in time: $namespace:$port"
}

expect_ping_success() {
  local label=$1
  local namespace=$2
  local destination=$3

  ip netns exec "$namespace" ping -q -c 2 -W 1 "$destination" >/dev/null || fail "$label"
  pass "$label"
}

expect_ping_failure() {
  local label=$1
  local namespace=$2
  local destination=$3

  if ip netns exec "$namespace" ping -q -c 1 -W 1 "$destination" >/dev/null 2>&1; then
    fail "$label unexpectedly succeeded"
  fi
  pass "$label"
}

expect_http_success() {
  local label=$1
  local namespace=$2
  local url=$3

  ip netns exec "$namespace" curl -fsS --connect-timeout 1 --max-time 3 "$url" >/dev/null || fail "$label"
  pass "$label"
}

expect_http_failure() {
  local label=$1
  local namespace=$2
  local url=$3

  if ip netns exec "$namespace" curl -fsS --connect-timeout 1 --max-time 2 "$url" >/dev/null 2>&1; then
    fail "$label unexpectedly succeeded"
  fi
  pass "$label"
}

expect_vrf_http_success() {
  local label=$1
  local vrf=$2
  local url=$3

  ip netns exec w19-host ip vrf exec "$vrf" \
    curl -fsS --connect-timeout 1 --max-time 3 "$url" >/dev/null || fail "$label"
  pass "$label"
}

for command in ip modprobe python3 ping curl ss sha256sum sysctl sed awk cut; do
  require_command "$command"
done
[[ $(id -u) -eq 0 ]] || fail 'this lab must run as root'

# Ubuntu ships VRF as a loadable kernel module. Loading it changes no root
# network-namespace object and is required before creating VRFs in w19-host.
modprobe vrf
printf 'Kernel VRF module: loaded\n'

printf 'Node: %s\n' "$(hostname)"
printf 'Kernel: %s\n' "$(uname -r)"
printf 'Started: %s\n' "$(date --iso-8601=seconds)"
printf 'Persistence: enabled; this script performs no cleanup.\n'

root_network_state >"$ROOT_BEFORE"
root_before_hash=$(sha256sum "$ROOT_BEFORE" | awk '{print $1}')
root_tcp_before=$(sysctl -n net.ipv4.tcp_l3mdev_accept)
printf 'Root network fingerprint before: %s\n' "$root_before_hash"

for namespace in w19-host w19-def w19-dpod w19-vpc1 w19-pod1 w19-vpc2 w19-pod2 w19-ext; do
  if ip netns list | awk '{print $1}' | grep -Fxq "$namespace"; then
    printf 'Resuming retained namespace: %s\n' "$namespace"
  else
    ip netns add "$namespace"
  fi
  ip -n "$namespace" link set lo up
done

add_veth w19-dpod eth0 w19-def dpod
add_veth w19-def dhost w19-host hdef
add_veth w19-pod1 eth0 w19-vpc1 v1pod
add_veth w19-vpc1 v1host w19-host h1vpc
add_veth w19-pod2 eth0 w19-vpc2 v2pod
add_veth w19-vpc2 v2host w19-host h2vpc
add_veth w19-host uplink0 w19-ext ext0

ip -n w19-host link show vrf1 >/dev/null 2>&1 || ip -n w19-host link add vrf1 type vrf table 1001
ip -n w19-host link show vrf2 >/dev/null 2>&1 || ip -n w19-host link add vrf2 type vrf table 1002
ip -n w19-host link set vrf1 up
ip -n w19-host link set vrf2 up
ip -n w19-host link set h1vpc master vrf1
ip -n w19-host link set h2vpc master vrf2

# Default VPC: no explicit VRF. It remains in the simulated host main table.
ip -n w19-dpod address add 10.10.0.2/24 dev eth0
ip -n w19-dpod route add default via 10.10.0.1
ip -n w19-def address add 10.10.0.1/24 dev dpod
ip -n w19-def address add 172.30.0.1/30 dev dhost
ip -n w19-def route add default via 172.30.0.2
ip -n w19-host address add 172.30.0.2/30 dev hdef
ip -n w19-host route add 10.10.0.0/24 via 172.30.0.1 dev hdef

# Custom VPC 1 and its host-transit attachment.
ip -n w19-pod1 address add 10.10.1.2/24 dev eth0
ip -n w19-pod1 route add default via 10.10.1.1
ip -n w19-vpc1 address add 10.10.1.1/24 dev v1pod
ip -n w19-vpc1 address add 172.31.1.1/30 dev v1host
ip -n w19-vpc1 route add default via 172.31.1.2
ip -n w19-host address add 172.31.1.2/30 dev h1vpc
ip -n w19-host route add table 1001 10.10.1.0/24 via 172.31.1.1 dev h1vpc
ip -n w19-host route add table 1001 unreachable default metric 4278198272

# Custom VPC 2 and its host-transit attachment.
ip -n w19-pod2 address add 10.10.2.2/24 dev eth0
ip -n w19-pod2 route add default via 10.10.2.1
ip -n w19-vpc2 address add 10.10.2.1/24 dev v2pod
ip -n w19-vpc2 address add 172.31.2.1/30 dev v2host
ip -n w19-vpc2 route add default via 172.31.2.2
ip -n w19-host address add 172.31.2.2/30 dev h2vpc
ip -n w19-host route add table 1002 10.10.2.0/24 via 172.31.2.1 dev h2vpc
ip -n w19-host route add table 1002 unreachable default metric 4278198272

# Simulated host main uplink and routed external return paths.
ip -n w19-host address add 203.0.113.1/24 dev uplink0
ip -n w19-ext address add 203.0.113.2/24 dev ext0
ip -n w19-ext route add 10.10.0.0/24 via 203.0.113.1
ip -n w19-ext route add 10.10.1.0/24 via 203.0.113.1
ip -n w19-ext route add 10.10.2.0/24 via 203.0.113.1

# Narrow policy-routing bridge between each custom VRF and selected host-main
# destinations. There are no leak veths, leak addresses, NAT, or netfilter rules.
ip -n w19-host rule add priority 30 iif lo to 10.10.1.0/24 lookup 1001
ip -n w19-host rule add priority 31 iif lo to 10.10.2.0/24 lookup 1002
ip -n w19-host rule add priority 32 iif uplink0 to 10.10.1.0/24 lookup 1001
ip -n w19-host rule add priority 33 iif uplink0 to 10.10.2.0/24 lookup 1002
ip -n w19-host rule add priority 40 iif vrf1 from 10.10.1.0/24 to 203.0.113.0/24 lookup main
ip -n w19-host rule add priority 41 iif vrf2 from 10.10.2.0/24 to 203.0.113.0/24 lookup main
ip -n w19-host rule add priority 50 iif vrf1 lookup 1001
ip -n w19-host rule add priority 51 iif vrf2 lookup 1002

for namespace in w19-host w19-def w19-vpc1 w19-vpc2; do
  enable_router "$namespace"
done
ip netns exec w19-host sysctl -qw net.ipv4.tcp_l3mdev_accept=0

# Every HTTP server uses only Python's simple positional listen-port argument.
start_http_server w19-host 18081 host
start_http_server w19-dpod 18090 dpod
start_http_server w19-pod1 18091 pod1
start_http_server w19-pod2 18092 pod2
start_http_server w19-ext 18080 external
wait_for_http_server w19-host 18081
wait_for_http_server w19-dpod 18090
wait_for_http_server w19-pod1 18091
wait_for_http_server w19-pod2 18092
wait_for_http_server w19-ext 18080

printf '\nValidating default-VPC compatibility...\n'
expect_ping_success 'default Pod reaches a simulated host main-local address' w19-dpod 203.0.113.1
expect_http_success 'default Pod reaches the plain host wildcard TCP listener' w19-dpod http://203.0.113.1:18081/
expect_http_success 'ordinary host TCP reaches the default-VPC Pod' w19-host http://10.10.0.2:18090/
expect_http_success 'default Pod reaches the external network through host main' w19-dpod http://203.0.113.2:18080/

printf '\nValidating custom-VPC host access...\n'
expect_ping_success 'VPC 1 Pod reaches its host-transit address' w19-pod1 172.31.1.2
expect_ping_success 'VPC 2 Pod reaches its host-transit address' w19-pod2 172.31.2.2
expect_ping_success 'VPC 1 Pod reaches a simulated host main-local address' w19-pod1 203.0.113.1
expect_ping_success 'VPC 2 Pod reaches a simulated host main-local address' w19-pod2 203.0.113.1
expect_http_failure 'tcp_l3mdev_accept=0 keeps the plain host listener outside VPC 1' w19-pod1 http://203.0.113.1:18081/
expect_http_failure 'tcp_l3mdev_accept=0 keeps the plain host listener outside VPC 2' w19-pod2 http://203.0.113.1:18081/

ip netns exec w19-host ip route get 10.10.1.2
ip netns exec w19-host ip route get 10.10.2.2
expect_ping_success 'ordinary host ICMP reaches the VPC 1 Pod' w19-host 10.10.1.2
expect_ping_success 'ordinary host ICMP reaches the VPC 2 Pod' w19-host 10.10.2.2
expect_http_failure 'VRF-unaware host TCP remains isolated from the VPC 1 Pod' w19-host http://10.10.1.2:18091/
expect_http_failure 'VRF-unaware host TCP remains isolated from the VPC 2 Pod' w19-host http://10.10.2.2:18092/
expect_vrf_http_success 'VRF-scoped host TCP reaches the VPC 1 Pod' vrf1 http://10.10.1.2:18091/
expect_vrf_http_success 'VRF-scoped host TCP reaches the VPC 2 Pod' vrf2 http://10.10.2.2:18092/

printf '\nValidating VPC isolation...\n'
expect_ping_failure 'default VPC cannot reach custom VPC 1' w19-dpod 10.10.1.2
expect_ping_failure 'default VPC cannot reach custom VPC 2' w19-dpod 10.10.2.2
expect_ping_failure 'custom VPC 1 cannot reach the default VPC' w19-pod1 10.10.0.2
expect_ping_failure 'custom VPC 2 cannot reach the default VPC' w19-pod2 10.10.0.2
expect_ping_failure 'custom VPC 1 cannot reach custom VPC 2' w19-pod1 10.10.2.2
expect_ping_failure 'custom VPC 2 cannot reach custom VPC 1' w19-pod2 10.10.1.2

printf '\nValidating routed external egress...\n'
expect_http_success 'VPC 1 reaches the external network through selected-prefix host main routing' w19-pod1 http://203.0.113.2:18080/
expect_http_success 'VPC 2 reaches the external network through selected-prefix host main routing' w19-pod2 http://203.0.113.2:18080/
sleep 1
grep -q '10.10.0.2' /root/issue-7130-vrf-w19-external.log || fail 'external server did not observe the default Pod source'
pass 'external server observed the default Pod source 10.10.0.2'
grep -q '10.10.1.2' /root/issue-7130-vrf-w19-external.log || fail 'external server did not observe the VPC 1 Pod source'
pass 'routed VPC 1 egress preserves source 10.10.1.2'
grep -q '10.10.2.2' /root/issue-7130-vrf-w19-external.log || fail 'external server did not observe the VPC 2 Pod source'
pass 'routed VPC 2 egress preserves source 10.10.2.2'

printf '\nFinal simulated host network state:\n'
ip -n w19-host -brief link show
ip -n w19-host -brief address show
printf '\nMain table:\n'
ip -n w19-host route show table main
printf '\nVRF table 1001:\n'
ip -n w19-host route show table 1001
printf '\nVRF table 1002:\n'
ip -n w19-host route show table 1002
printf '\nRules:\n'
ip -n w19-host rule show
printf '\nNamespace inventory:\n'
for namespace in w19-host w19-def w19-dpod w19-vpc1 w19-pod1 w19-vpc2 w19-pod2 w19-ext; do
  printf -- '--- %s ---\n' "$namespace"
  ip -n "$namespace" -brief address show
  ip -n "$namespace" route show table all
done

root_network_state >"$ROOT_AFTER"
root_after_hash=$(sha256sum "$ROOT_AFTER" | awk '{print $1}')
printf 'Root network fingerprint after:  %s\n' "$root_after_hash"
if [[ "$root_after_hash" != "$root_before_hash" ]]; then
  diff -u "$ROOT_BEFORE" "$ROOT_AFTER" || true
  fail 'actual node root network namespace changed during the lab'
fi
pass 'actual node root network namespace fingerprint is unchanged'

root_tcp_after=$(sysctl -n net.ipv4.tcp_l3mdev_accept)
[[ "$root_tcp_after" == "$root_tcp_before" ]] || fail 'actual node root tcp_l3mdev_accept changed'
[[ $(ip netns exec w19-host sysctl -n net.ipv4.tcp_l3mdev_accept) == 0 ]] || fail 'simulated host tcp_l3mdev_accept is not 0'
pass "actual node root tcp_l3mdev_accept remains $root_tcp_after; simulated host value is 0"

printf '\nVERDICT: VRF plus narrow policy rules works for ICMP and routed selected-prefix egress without leak veths or extra leak addresses.\n'
printf 'A plain TCP listener remains unreachable across a custom VRF with tcp_l3mdev_accept=0; explicit VRF socket context is still required.\n'
printf 'All w19-* namespaces, links, addresses, routes, rules, VRFs, servers, logs, and this result are intentionally retained.\n'
```

</details>

**Comment by zhangzujian** [comment]
## Revised two-node validation with the real host network, default VPC, and external network

I replaced the previous fully simulated host/default-VPC/external topology with a persistent lab that uses the actual node root network namespace, the existing Kube-OVN `ovn0`, real default-VPC Pods, and a real external destination.

The old `w19-*` lab was removed from both nodes first: eight namespaces and five Python HTTP listeners per node were deleted. The historical scripts, results, logs, and the installed `vrf.ko` were preserved.

### Retained topology

- Real host: each node root network namespace.
- Real default VPC: existing `ovn-default` (`10.3.0.0/16`) through existing `ovn0`; no VRF is added for it.
- Real default-VPC test Pods: DaemonSet `default/issue-7130-default-vpc-w24`, Pod IPs `10.3.0.78` on `192.168.138.44` and `10.3.0.79` on `192.168.131.81`.
- Real kube-dns Service: `10.4.0.10:53/UDP,TCP`, current endpoint `10.3.0.8`.
- Custom VPC 1: root `ovn1` enslaved to `vrf1/table 1001`, router namespace `w24-vpc1`, Pod namespace `w24-pod1`, Pod `10.10.1.2/24`.
- Custom VPC 2: root `ovn2` enslaved to `vrf2/table 1002`, router namespace `w24-vpc2`, Pod namespace `w24-pod2`, Pod `10.10.2.2/24`.
- Real external target: `idp.alauda.cn`, currently `192.168.143.171:443`, reached through the real `eth0` and host main table.

Only the custom VPC routers and Pods remain simulated. There is no simulated host namespace, external namespace, default-VPC router, or default-VPC Pod namespace.

### Routing details

There is no leak veth, leak address, new NAT rule, netfilter rule, or conntrack zone. The two transit links remain necessary to connect each simulated router to `ovn1`/`ovn2`. The Pod-CIDR routes use the existing node address as preferred source, for example:

```text
10.10.1.0/24 via 172.31.1.1 dev ovn1 src <node-ip>
10.10.2.0/24 via 172.31.2.1 dev ovn2 src <node-ip>
```

This preferred source is important: without it, an ordinary host request selects the transit address and the reply is not delivered to the default host socket context. No additional host identity address is allocated.

The script sets `rp_filter=0` only on the newly created `ovn1` and `ovn2`; both inherit the node default value `2`, which otherwise drops valid policy-routed replies. It does not change the global/default value, `ovn0`, `eth0`, `tcp_l3mdev_accept`, main routes, or netfilter configuration.

The explicit rules precede the kernel-created priority-1000 l3mdev rule. Guards send the other custom VPC, the real default Pod CIDR, and the join CIDR back to the originating VRF table before the selected main-table egress rule. The real kube-dns ClusterIP does not require a broad default-VPC leak: kube-proxy/IPVS registers it as a local Service address and conntrack completes the Service flow locally.

### Results reproduced on both nodes

- 27 node-script assertions passed and zero failed on each node.
- Ordinary host TCP reaches the real default-VPC DaemonSet Pod through existing `ovn0`.
- Both real default-VPC Pods reach their node plain listener and the real external target.
- Both custom VPC Pods resolve `kubernetes.default.svc.cluster.local` through the real kube-dns Service over both UDP and TCP.
- Custom Pod -> real node main-local ICMP succeeds; ordinary host -> custom Pod ICMP succeeds.
- With `tcp_l3mdev_accept=0`, a plain host wildcard listener remains unreachable from custom VPCs, and a VRF-unaware host TCP client remains unable to reach a custom Pod. A simple listener/client explicitly executed in the matching VRF succeeds.
- Custom VPC 1, custom VPC 2, and ordinary default-VPC Pods remain mutually isolated, except for the explicitly tested kube-dns Service semantics.
- Route-only custom-VPC traffic reaches the real host uplink, but it does **not** complete an end-to-end external connection because the external network has neither a return route for `10.10.1.0/24`/`10.10.2.0/24` nor matching SNAT. `tcpdump` observed the SYNs on real `eth0` with original sources `10.10.1.2` and `10.10.2.2`. Therefore real bidirectional external access still requires an external return route or per-VPC SNAT; policy rules alone cannot provide it.
- The protected fingerprints of existing `ovn0`, host main routes, sysctls, and netfilter configuration were identical before and after on both nodes. `tcp_l3mdev_accept` remained `0`.

All new `w24-*` namespaces, `ovn1`/`ovn2`, `vrf1`/`vrf2`, tables, rules, listeners, logs, results, the DaemonSet, and its Pods are intentionally retained.

Final node script: 464 lines, SHA-256 `fc29d95f40cd84a136a27b3aa1e1dbc687310e06fc7e35204673eead4040f9e0`.
DaemonSet manifest SHA-256: `1ab2a7f4b72b51858d4394227e4c4646449c8e44c61443f0ac73ef4ab4187c30`.
Default-VPC validation script SHA-256: `73b5861f1716e0233d71a5d0c4bbf7f9c8d78ced9cd8f486c0b3f5ace0414f8e`.

<details>
<summary>Real default-VPC DaemonSet manifest</summary>

```yaml
apiVersion: apps/v1
kind: DaemonSet
metadata:
  name: issue-7130-default-vpc-w24
  namespace: default
  labels:
    app: issue-7130-default-vpc-w24
spec:
  selector:
    matchLabels:
      app: issue-7130-default-vpc-w24
  template:
    metadata:
      labels:
        app: issue-7130-default-vpc-w24
    spec:
      tolerations:
        - operator: Exists
      containers:
        - name: server
          image: registry.alauda.cn:60070/acp/kube-ovn:v1.15.19
          imagePullPolicy: IfNotPresent
          command: ["python3", "-m", "http.server", "18090"]
          ports:
            - name: http
              containerPort: 18090
              protocol: TCP
          readinessProbe:
            tcpSocket:
              port: 18090
            initialDelaySeconds: 1
            periodSeconds: 2
          resources:
            requests:
              cpu: 5m
              memory: 16Mi
            limits:
              cpu: 100m
              memory: 64Mi
```

</details>

<details>
<summary>Full persistent per-node VRF validation script</summary>

```bash
#!/usr/bin/env bash
set -euo pipefail

# Persistent IPv4 feasibility lab for kubeovn/kube-ovn issue #7130.
#
# This revision uses the real node root network namespace, the existing ovn0
# attachment for the default VPC, and a real external destination. Only the two
# custom VPC routers and Pods are simulated in named network namespaces.
# The script intentionally has no cleanup path; all w24 resources are retained.

readonly DEFAULT_POD_IP=${DEFAULT_POD_IP:?set DEFAULT_POD_IP to the issue-7130-default-vpc-w24 Pod IP on this node}
readonly DEFAULT_POD_CIDR=${DEFAULT_POD_CIDR:-10.3.0.0/16}
readonly DEFAULT_JOIN_CIDR=${DEFAULT_JOIN_CIDR:-100.64.0.0/16}
readonly KUBE_DNS_SERVICE_IP=${KUBE_DNS_SERVICE_IP:-10.4.0.10}
readonly EXTERNAL_IP=${EXTERNAL_IP:-192.168.143.171}
readonly EXTERNAL_PORT=${EXTERNAL_PORT:-443}
readonly EXTERNAL_URL=${EXTERNAL_URL:-https://192.168.143.171/}

readonly RESULT_LOG=/root/issue-7130-vrf-w24-results.txt
readonly PROTECTED_BEFORE=/root/issue-7130-vrf-w24-protected-before.txt
readonly PROTECTED_AFTER=/root/issue-7130-vrf-w24-protected-after.txt

exec > >(tee "$RESULT_LOG") 2>&1

fail() {
  printf 'FAIL: %s\n' "$*" >&2
  exit 1
}

pass() {
  printf 'PASS: %s\n' "$*"
}

require_command() {
  command -v "$1" >/dev/null 2>&1 || fail "required command not found: $1"
}

protected_root_state() {
  {
    ip -d link show ovn0
    ip -o address show dev ovn0
    ip -4 route show table main
    ip -6 route show table main
    sysctl -n net.ipv4.ip_forward
    sysctl -n net.ipv4.tcp_l3mdev_accept
    sysctl -n net.ipv4.udp_l3mdev_accept
    if command -v nft >/dev/null 2>&1; then
      nft list ruleset 2>/dev/null |
        sed -E 's/counter packets [0-9]+ bytes [0-9]+/counter packets N bytes N/g'
    fi
    if command -v iptables-save >/dev/null 2>&1; then
      iptables-save -c 2>/dev/null |
        sed -E 's/\[[0-9]+:[0-9]+\]/[N:N]/g; /^# (Generated by|Completed on) /d'
    fi
  } | sed -E 's/valid_lft [^ ]+ preferred_lft [^ ]+/valid_lft X preferred_lft X/g'
}

namespace_exists() {
  ip netns list | awk '{print $1}' | grep -Fxq "$1"
}

ensure_namespace() {
  local namespace=$1
  if namespace_exists "$namespace"; then
    printf 'Resuming retained namespace: %s\n' "$namespace"
  else
    ip netns add "$namespace"
  fi
  ip -n "$namespace" link set lo up
}

ensure_root_veth() {
  local root_if=$1
  local peer_ns=$2
  local peer_if=$3

  if ip link show "$root_if" >/dev/null 2>&1 &&
     ip -n "$peer_ns" link show "$peer_if" >/dev/null 2>&1; then
    printf 'Resuming retained veth: root/%s <-> %s/%s\n' "$root_if" "$peer_ns" "$peer_if"
    return
  fi
  if ip link show "$root_if" >/dev/null 2>&1 ||
     ip -n "$peer_ns" link show "$peer_if" >/dev/null 2>&1; then
    fail "incomplete retained veth: root/$root_if <-> $peer_ns/$peer_if"
  fi

  ip link add "$root_if" type veth peer name "$peer_if" netns "$peer_ns"
}

ensure_namespaced_veth() {
  local left_ns=$1
  local left_if=$2
  local right_ns=$3
  local right_if=$4

  if ip -n "$left_ns" link show "$left_if" >/dev/null 2>&1 &&
     ip -n "$right_ns" link show "$right_if" >/dev/null 2>&1; then
    printf 'Resuming retained veth: %s/%s <-> %s/%s\n' "$left_ns" "$left_if" "$right_ns" "$right_if"
    return
  fi
  if ip -n "$left_ns" link show "$left_if" >/dev/null 2>&1 ||
     ip -n "$right_ns" link show "$right_if" >/dev/null 2>&1; then
    fail "incomplete retained veth: $left_ns/$left_if <-> $right_ns/$right_if"
  fi

  ip -n "$left_ns" link add "$left_if" type veth peer name "$right_if" netns "$right_ns"
}

ensure_address() {
  local namespace=$1
  local address=$2
  local interface=$3

  if [[ $namespace == root ]]; then
    ip -o address show dev "$interface" | awk '{print $4}' | grep -Fxq "$address" ||
      ip address add "$address" dev "$interface"
  else
    ip -n "$namespace" -o address show dev "$interface" | awk '{print $4}' | grep -Fxq "$address" ||
      ip -n "$namespace" address add "$address" dev "$interface"
  fi
}

ensure_rule() {
  local priority=$1
  shift
  local current
  local token

  current=$(ip -4 rule show priority "$priority")
  if [[ -z $current ]]; then
    ip -4 rule add priority "$priority" "$@"
  else
    for token in "$@"; do
      case "$token" in
        iif | from | to | lookup)
          continue
          ;;
      esac
      grep -Fqw "$token" <<<"$current" ||
        fail "rule priority $priority is occupied by an unexpected rule: $current"
    done
    printf 'Resuming retained rule: %s\n' "$current"
  fi
}

enable_router() {
  local namespace=$1
  local interface

  ip netns exec "$namespace" sysctl -qw net.ipv4.ip_forward=1
  ip netns exec "$namespace" sysctl -qw net.ipv4.conf.all.rp_filter=0
  ip netns exec "$namespace" sysctl -qw net.ipv4.conf.default.rp_filter=0
  while read -r interface; do
    ip netns exec "$namespace" sysctl -qw "net.ipv4.conf.${interface}.rp_filter=0"
  done < <(ip -n "$namespace" -o link show | awk -F': ' '{print $2}' | cut -d@ -f1)
}

start_server() {
  local context=$1
  local port=$2
  local label=$3
  local log_file="/root/issue-7130-vrf-w24-${label}.log"
  local pid_file="/run/issue-7130-vrf-w24-${label}.pid"
  local pid

  if [[ -s $pid_file ]]; then
    pid=$(sed -n '1p' "$pid_file")
    if kill -0 "$pid" 2>/dev/null; then
      [[ $(ps -p "$pid" -o args=) == "python3 -m http.server $port" ]] ||
        fail "retained PID belongs to an unexpected process: $pid_file"
      printf 'Resuming retained server: %s pid=%s\n' "$label" "$pid"
      return
    fi
  fi

  case "$context" in
    root)
      nohup python3 -m http.server "$port" >"$log_file" 2>&1 </dev/null &
      ;;
    vrf1 | vrf2)
      nohup ip vrf exec "$context" python3 -m http.server "$port" >"$log_file" 2>&1 </dev/null &
      ;;
    w24-pod1 | w24-pod2)
      ip netns exec "$context" nohup python3 -m http.server "$port" >"$log_file" 2>&1 </dev/null &
      ;;
    *)
      fail "unsupported server context: $context"
      ;;
  esac
  printf '%s\n' "$!" >"$pid_file"
}

wait_for_server() {
  local context=$1
  local port=$2
  for _ in $(seq 1 100); do
    if [[ $context == root ]]; then
      ss -ltnH "sport = :$port" | grep -q . && return
    else
      ip netns exec "$context" ss -ltnH "sport = :$port" | grep -q . && return
    fi
    sleep 0.1
  done
  fail "HTTP server did not listen in time: $context:$port"
}

expect_ping_success() {
  local label=$1
  local namespace=$2
  local destination=$3

  ip netns exec "$namespace" ping -q -c 2 -W 1 "$destination" >/dev/null || fail "$label"
  pass "$label"
}

expect_ping_failure() {
  local label=$1
  local namespace=$2
  local destination=$3

  if ip netns exec "$namespace" ping -q -c 1 -W 1 "$destination" >/dev/null 2>&1; then
    fail "$label unexpectedly succeeded"
  fi
  pass "$label"
}

expect_http_success() {
  local label=$1
  shift
  "$@" >/dev/null || fail "$label"
  pass "$label"
}

expect_http_failure() {
  local label=$1
  shift
  if "$@" >/dev/null 2>&1; then
    fail "$label unexpectedly succeeded"
  fi
  pass "$label"
}

expect_dns_success() {
  local label=$1
  local namespace=$2
  local transport=$3
  local tcp_option=()

  [[ $transport == tcp ]] && tcp_option=(+tcp)
  ip netns exec "$namespace" dig "${tcp_option[@]}" +time=2 +tries=1 +short \
    "@${KUBE_DNS_SERVICE_IP}" kubernetes.default.svc.cluster.local A | grep -q . || fail "$label"
  pass "$label"
}

for command in ip modprobe python3 ping curl dig ss sha256sum sysctl sed awk cut grep; do
  require_command "$command"
done
[[ $(id -u) -eq 0 ]] || fail 'this lab must run as root'

modprobe vrf
[[ $(sysctl -n net.ipv4.ip_forward) == 1 ]] || fail 'the real node must already have IPv4 forwarding enabled'
[[ $(sysctl -n net.ipv4.tcp_l3mdev_accept) == 0 ]] || fail 'tcp_l3mdev_accept must remain disabled'
ip link show ovn0 >/dev/null 2>&1 || fail 'the existing Kube-OVN ovn0 interface is missing'
ip -4 route get "$DEFAULT_POD_IP" | grep -qw ovn0 || fail "$DEFAULT_POD_IP is not reached through the existing ovn0 interface"
python3 -c 'import socket,sys; s=socket.create_connection((sys.argv[1],int(sys.argv[2])),5); s.close()' \
  "$EXTERNAL_IP" "$EXTERNAL_PORT" || fail 'the real node itself cannot reach the selected external target'

uplink_if=$(ip -4 route get "$EXTERNAL_IP" | awk '/ dev /{for(i=1;i<=NF;i++) if($i=="dev") print $(i+1); exit}')
node_ip=$(ip -4 route get "$EXTERNAL_IP" | awk '/ src /{for(i=1;i<=NF;i++) if($i=="src") print $(i+1); exit}')
[[ -n $uplink_if && -n $node_ip ]] || fail 'could not discover the real node uplink and source address'

printf 'Node: %s\n' "$(hostname)"
printf 'Kernel: %s\n' "$(uname -r)"
printf 'Existing default-VPC attachment: ovn0\n'
printf 'Real node uplink: %s (%s)\n' "$uplink_if" "$node_ip"
printf 'Real default-VPC Pod: %s\n' "$DEFAULT_POD_IP"
printf 'Real kube-dns Service: %s:53/UDP,TCP\n' "$KUBE_DNS_SERVICE_IP"
printf 'Real external target: %s:%s\n' "$EXTERNAL_IP" "$EXTERNAL_PORT"
printf 'Started: %s\n' "$(date --iso-8601=seconds)"
printf 'Persistence: enabled; this script performs no cleanup.\n'

protected_root_state >"$PROTECTED_BEFORE"
protected_before_hash=$(sha256sum "$PROTECTED_BEFORE" | awk '{print $1}')

for namespace in w24-vpc1 w24-pod1 w24-vpc2 w24-pod2; do
  ensure_namespace "$namespace"
done

ensure_root_veth ovn1 w24-vpc1 v1host
ensure_root_veth ovn2 w24-vpc2 v2host
ensure_namespaced_veth w24-vpc1 v1pod w24-pod1 eth0
ensure_namespaced_veth w24-vpc2 v2pod w24-pod2 eth0

ip link show vrf1 >/dev/null 2>&1 || ip link add vrf1 type vrf table 1001
ip link show vrf2 >/dev/null 2>&1 || ip link add vrf2 type vrf table 1002
ip link set vrf1 up
ip link set vrf2 up
ip link set ovn1 master vrf1
ip link set ovn2 master vrf2
sysctl -qw net.ipv4.conf.ovn1.rp_filter=0
sysctl -qw net.ipv4.conf.ovn2.rp_filter=0

for interface in ovn1 ovn2; do
  ip link set "$interface" up
done
for item in w24-vpc1:v1host w24-vpc1:v1pod w24-vpc2:v2host w24-vpc2:v2pod w24-pod1:eth0 w24-pod2:eth0; do
  namespace=${item%%:*}
  interface=${item##*:}
  ip -n "$namespace" link set "$interface" up
done

ensure_address root 172.31.1.2/30 ovn1
ensure_address w24-vpc1 172.31.1.1/30 v1host
ensure_address w24-vpc1 10.10.1.1/24 v1pod
ensure_address w24-pod1 10.10.1.2/24 eth0
ip -n w24-pod1 route replace default via 10.10.1.1
ip -n w24-vpc1 route replace default via 172.31.1.2
ip -4 route replace table 1001 10.10.1.0/24 via 172.31.1.1 dev ovn1 src "$node_ip"
ip -4 route replace table 1001 unreachable default metric 4278198272

ensure_address root 172.31.2.2/30 ovn2
ensure_address w24-vpc2 172.31.2.1/30 v2host
ensure_address w24-vpc2 10.10.2.1/24 v2pod
ensure_address w24-pod2 10.10.2.2/24 eth0
ip -n w24-pod2 route replace default via 10.10.2.1
ip -n w24-vpc2 route replace default via 172.31.2.2
ip -4 route replace table 1002 10.10.2.0/24 via 172.31.2.1 dev ovn2 src "$node_ip"
ip -4 route replace table 1002 unreachable default metric 4278198272

# Locally originated host traffic selects the target custom-VPC table.
ensure_rule 100 iif lo to 10.10.1.0/24 lookup 1001
ensure_rule 101 iif lo to 10.10.2.0/24 lookup 1002

# Return traffic arriving from the real node uplink selects the source VPC.
ensure_rule 110 iif "$uplink_if" to 10.10.1.0/24 lookup 1001
ensure_rule 111 iif "$uplink_if" to 10.10.2.0/24 lookup 1002

# Guard the real default VPC, its join network, and the other custom VPC before
# allowing selected custom-VPC traffic to use the real host main table.
ensure_rule 120 iif vrf1 from 10.10.1.0/24 to 10.10.2.0/24 lookup 1001
ensure_rule 121 iif vrf2 from 10.10.2.0/24 to 10.10.1.0/24 lookup 1002
ensure_rule 122 iif vrf1 from 10.10.1.0/24 to "$DEFAULT_POD_CIDR" lookup 1001
ensure_rule 123 iif vrf2 from 10.10.2.0/24 to "$DEFAULT_POD_CIDR" lookup 1002
ensure_rule 124 iif vrf1 from 10.10.1.0/24 to "$DEFAULT_JOIN_CIDR" lookup 1001
ensure_rule 125 iif vrf2 from 10.10.2.0/24 to "$DEFAULT_JOIN_CIDR" lookup 1002
ensure_rule 130 iif vrf1 from 10.10.1.0/24 lookup main
ensure_rule 131 iif vrf2 from 10.10.2.0/24 lookup main

enable_router w24-vpc1
enable_router w24-vpc2

# All listeners use only Python's standard positional port argument.
start_server root 18081 host
start_server vrf1 18191 host-vrf1
start_server vrf2 18192 host-vrf2
start_server w24-pod1 18091 pod1
start_server w24-pod2 18092 pod2
wait_for_server root 18081
wait_for_server root 18191
wait_for_server root 18192
wait_for_server w24-pod1 18091
wait_for_server w24-pod2 18092

printf '\nValidating the real default VPC through the existing ovn0...\n'
expect_http_success 'ordinary host TCP reaches the real default-VPC Pod through ovn0' \
  curl -fsS --connect-timeout 2 --max-time 5 "http://${DEFAULT_POD_IP}:18090/"
ip -4 route get "$DEFAULT_POD_IP"

printf '\nValidating access to the real default-VPC kube-dns Service...\n'
expect_dns_success 'VPC 1 Pod resolves through the real kube-dns Service over UDP' w24-pod1 udp
expect_dns_success 'VPC 1 Pod resolves through the real kube-dns Service over TCP' w24-pod1 tcp
expect_dns_success 'VPC 2 Pod resolves through the real kube-dns Service over UDP' w24-pod2 udp
expect_dns_success 'VPC 2 Pod resolves through the real kube-dns Service over TCP' w24-pod2 tcp

printf '\nValidating custom-VPC host access in the real node namespace...\n'
expect_ping_success 'VPC 1 Pod reaches the real node main-local address' w24-pod1 "$node_ip"
expect_ping_success 'VPC 2 Pod reaches the real node main-local address' w24-pod2 "$node_ip"
expect_http_failure 'tcp_l3mdev_accept=0 keeps the plain host listener outside VPC 1' \
  ip netns exec w24-pod1 curl -fsS --connect-timeout 1 --max-time 2 "http://${node_ip}:18081/"
expect_http_failure 'tcp_l3mdev_accept=0 keeps the plain host listener outside VPC 2' \
  ip netns exec w24-pod2 curl -fsS --connect-timeout 1 --max-time 2 "http://${node_ip}:18081/"
expect_http_success 'VPC 1 Pod reaches a simple listener explicitly scoped to vrf1' \
  ip netns exec w24-pod1 curl -fsS --connect-timeout 1 --max-time 3 "http://${node_ip}:18191/"
expect_http_success 'VPC 2 Pod reaches a simple listener explicitly scoped to vrf2' \
  ip netns exec w24-pod2 curl -fsS --connect-timeout 1 --max-time 3 "http://${node_ip}:18192/"

ping -q -c 2 -W 1 10.10.1.2 >/dev/null || fail 'ordinary host ICMP does not reach VPC 1 Pod'
pass 'ordinary host ICMP reaches VPC 1 Pod'
ping -q -c 2 -W 1 10.10.2.2 >/dev/null || fail 'ordinary host ICMP does not reach VPC 2 Pod'
pass 'ordinary host ICMP reaches VPC 2 Pod'
expect_http_failure 'VRF-unaware host TCP remains isolated from VPC 1 Pod' \
  curl -fsS --connect-timeout 1 --max-time 2 http://10.10.1.2:18091/
expect_http_failure 'VRF-unaware host TCP remains isolated from VPC 2 Pod' \
  curl -fsS --connect-timeout 1 --max-time 2 http://10.10.2.2:18092/
expect_http_success 'VRF-scoped host TCP reaches VPC 1 Pod' \
  ip vrf exec vrf1 curl -fsS --connect-timeout 1 --max-time 3 http://10.10.1.2:18091/
expect_http_success 'VRF-scoped host TCP reaches VPC 2 Pod' \
  ip vrf exec vrf2 curl -fsS --connect-timeout 1 --max-time 3 http://10.10.2.2:18092/

printf '\nValidating isolation from the real default VPC and between custom VPCs...\n'
expect_ping_failure 'custom VPC 1 cannot reach the real default-VPC Pod' w24-pod1 "$DEFAULT_POD_IP"
expect_ping_failure 'custom VPC 2 cannot reach the real default-VPC Pod' w24-pod2 "$DEFAULT_POD_IP"
expect_ping_failure 'custom VPC 1 cannot reach custom VPC 2' w24-pod1 10.10.2.2
expect_ping_failure 'custom VPC 2 cannot reach custom VPC 1' w24-pod2 10.10.1.2

printf '\nValidating the route-only boundary against a real external destination...\n'
for item in w24-pod1:10.10.1.2:vpc1 w24-pod2:10.10.2.2:vpc2; do
  namespace=${item%%:*}
  remainder=${item#*:}
  pod_ip=${remainder%%:*}
  label=${item##*:}
  capture_log="/root/issue-7130-vrf-w24-external-${label}-wire.log"
  capture_pid=
  if command -v tcpdump >/dev/null 2>&1; then
    timeout 12 tcpdump -l -nn -i "$uplink_if" -c 1 \
      "tcp and src host $pod_ip and dst host $EXTERNAL_IP and dst port $EXTERNAL_PORT" \
      >"$capture_log" 2>&1 &
    capture_pid=$!
    sleep 0.5
  fi
  expect_http_failure "$label has no end-to-end external-network access without return routing or SNAT" \
    ip netns exec "$namespace" curl -kfsS --connect-timeout 3 --max-time 5 "$EXTERNAL_URL"
  if [[ -n $capture_pid ]]; then
    wait "$capture_pid" || true
    grep -Eq "IP ${pod_ip//./\\.}\.[0-9]+ > ${EXTERNAL_IP//./\\.}\.${EXTERNAL_PORT}" "$capture_log" ||
      fail "$label traffic was not observed on the real uplink with its original Pod source"
    pass "$label SYN leaves the real uplink with original source $pod_ip"
    sed -n '1,10p' "$capture_log"
  fi
done

printf '\nFinal real host VRF state:\n'
ip -brief link show ovn0
ip -brief link show ovn1
ip -brief link show ovn2
ip -brief link show vrf1
ip -brief link show vrf2
printf '\nVRF table 1001:\n'
ip -4 route show table 1001
printf '\nVRF table 1002:\n'
ip -4 route show table 1002
printf '\nRules:\n'
ip -4 rule show
printf '\nCustom namespace inventory:\n'
for namespace in w24-vpc1 w24-pod1 w24-vpc2 w24-pod2; do
  printf -- '--- %s ---\n' "$namespace"
  ip -n "$namespace" -brief address show
  ip -n "$namespace" route show table all
done

protected_root_state >"$PROTECTED_AFTER"
protected_after_hash=$(sha256sum "$PROTECTED_AFTER" | awk '{print $1}')
printf 'Protected root fingerprint before: %s\n' "$protected_before_hash"
printf 'Protected root fingerprint after:  %s\n' "$protected_after_hash"
if [[ $protected_after_hash != "$protected_before_hash" ]]; then
  diff -u "$PROTECTED_BEFORE" "$PROTECTED_AFTER" || true
  fail 'ovn0, main routes, sysctls, or netfilter changed unexpectedly'
fi
pass 'existing ovn0, main routes, sysctls, and netfilter configuration are unchanged'
pass 'tcp_l3mdev_accept remains 0'

printf '\nVERDICT: the real node root namespace can host ovn1/ovn2 plus vrf1/vrf2 without a leak veth or leak address.\n'
printf 'The existing ovn0 and real default VPC remain in main; custom VPCs use tables 1001 and 1002.\n'
printf 'All w24 namespaces, ovn1/ovn2, VRFs, routes, rules, listeners, logs, and results are intentionally retained.\n'
```

</details>

<details>
<summary>Real default-VPC validation script</summary>

```bash
#!/usr/bin/env bash
set -euo pipefail

# Run on the control-plane node after both per-node labs are active.

readonly SELECTOR='app=issue-7130-default-vpc-w24'

fail() {
  printf 'FAIL: %s\n' "$*" >&2
  exit 1
}

pass() {
  printf 'PASS: %s\n' "$*"
}

kubectl -n default rollout status daemonset/issue-7130-default-vpc-w24 --timeout=180s

while read -r pod node pod_ip; do
  [[ -n $pod && -n $node && -n $pod_ip ]] || fail 'incomplete default-VPC Pod record'
  kubectl -n default exec "$pod" -- ping -q -c 2 -W 1 "$node" >/dev/null ||
    fail "$pod cannot reach node $node"
  pass "$pod reaches its real node $node"

  kubectl -n default exec "$pod" -- \
    curl -fsS --connect-timeout 2 --max-time 5 "http://${node}:18081/" >/dev/null ||
    fail "$pod cannot reach the plain node listener"
  pass "$pod reaches the plain node listener with tcp_l3mdev_accept=0"

  kubectl -n default exec "$pod" -- \
    curl -kfsS --connect-timeout 5 --max-time 10 https://idp.alauda.cn/ >/dev/null ||
    fail "$pod cannot reach the real external network"
  pass "$pod reaches the real external network"

  if kubectl -n default exec "$pod" -- ping -q -c 1 -W 1 10.10.1.2 >/dev/null 2>&1; then
    fail "$pod unexpectedly reaches custom VPC 1"
  fi
  pass "$pod remains isolated from custom VPC 1"

  if kubectl -n default exec "$pod" -- ping -q -c 1 -W 1 10.10.2.2 >/dev/null 2>&1; then
    fail "$pod unexpectedly reaches custom VPC 2"
  fi
  pass "$pod remains isolated from custom VPC 2"
done < <(
  kubectl -n default get pods -l "$SELECTOR" \
    -o jsonpath='{range .items[*]}{.metadata.name}{" "}{.spec.nodeName}{" "}{.status.podIP}{"\n"}{end}'
)
```

</details>

**Comment by zhangzujian** [comment]
## Follow-up: Kubernetes API access from both custom VPCs on both nodes

I kept the existing `w24` lab unchanged and tested Kubernetes API access from both simulated custom VPC Pods on both real nodes. No address, route, rule, VRF, sysctl, netfilter rule, or Kubernetes resource was added or changed for this follow-up.

### Live targets

- Kubernetes Service: `10.4.0.1:443`
- Current API endpoint: `192.168.138.44:6443`
- Worker node: `192.168.131.81`
- Control-plane/API node: `192.168.138.44`
- Custom VPC 1 Pod: `w24-pod1`, `10.10.1.2`
- Custom VPC 2 Pod: `w24-pod2`, `10.10.2.2`
- `net.ipv4.tcp_l3mdev_accept=0` on both nodes

The request was an HTTPS `GET /version`. `curl -k` was used only to test the network/TLS/HTTP path without installing the cluster CA in the synthetic namespaces. A successful response was `HTTP 200`; both successful custom-VPC requests returned `gitVersion=v1.35.5-0`, `platform=linux/amd64`.

### Result matrix

| Source node | Source namespace | API Service `10.4.0.1:443` | Direct endpoint `192.168.138.44:6443` |
| --- | --- | --- | --- |
| Worker `192.168.131.81` | `w24-pod1` / VPC 1 | **PASS**, HTTP 200 | **FAIL**, connect timeout |
| Worker `192.168.131.81` | `w24-pod2` / VPC 2 | **PASS**, HTTP 200 | **FAIL**, connect timeout |
| Control plane `192.168.138.44` | `w24-pod1` / VPC 1 | **FAIL**, connection refused | **FAIL**, connection refused |
| Control plane `192.168.138.44` | `w24-pod2` / VPC 2 | **FAIL**, connection refused | **FAIL**, connection refused |

As a baseline, both real default-VPC DaemonSet Pods (`10.3.0.78` on the control plane and `10.3.0.79` on the worker) reached `10.4.0.1:443/version` with HTTP 200.

### Why the nodes differ

On the worker, the existing kube-proxy rule marks Service traffic from outside the default Pod CIDR for masquerading:

```text
-A KUBE-SERVICES ! -s 10.3.0.0/16 ... -j KUBE-MARK-MASQ
```

Therefore, the worker-side Service path is DNATed to `192.168.138.44:6443` and SNATed to the worker node address. That gives the remote API endpoint a valid return path. It is a real successful API response, but it depends on the request being forwarded to a remote endpoint through the Service/NAT path.

Direct endpoint access bypasses that Service SNAT. A worker-side capture showed the preserved custom source leaving the real interface twice without any reply:

```text
eth0 Out IP 10.10.1.2.40103 > 192.168.138.44.6443: Flags [S]
eth0 Out IP 10.10.1.2.40103 > 192.168.138.44.6443: Flags [S]
```

This is the same return-path limitation observed for real external access: route/rule steering gets the original-source SYN out, but it does not provide an upstream return route or SNAT.

On the control-plane node, the only API endpoint is local. `kube-apiserver` listens on the default-VRF wildcard `*:6443`, while the request enters through `ovn1` or `ovn2` enslaved to a VRF and `tcp_l3mdev_accept` remains disabled. A capture of the Service request showed an immediate reset:

```text
ovn1 In  IP 10.10.1.2.55242 > 10.4.0.1.443: Flags [S]
ovn1 Out IP 10.4.0.1.443 > 10.10.1.2.55242: Flags [R.]
```

Policy routing can select a routing table, but it does not make a default-VRF TCP listener eligible for an incoming VRF flow. Consequently, route/rule-only handling is not sufficient when the selected API endpoint is local.

### Conclusion

The current route/rule design does **not** provide node-independent Kubernetes API access while `tcp_l3mdev_accept=0`:

- it happens to work on the non-API worker through kube-proxy Service SNAT to a remote endpoint;
- it fails on the API node when the endpoint is local;
- direct endpoint access fails without a return route or controlled SNAT.

To keep `tcp_l3mdev_accept=0`, the implementation needs a narrow API projection, for example a per-VRF proxy/socket bound to the VRF, or a non-local default-network API load-balancer/proxy target with controlled SNAT and return routing. An `ip rule` alone cannot solve the local TCP socket lookup or the missing return path. This can remain limited to the API VIP/port and does not require leaking the complete default VPC Pod CIDR.

I did not enable `tcp_l3mdev_accept` and did not add a workaround during this validation.

### Validation script

The same script is retained on both nodes as `/root/issue-7130-vrf-w25-validate-apiserver.sh`.

SHA-256: `84d316b04c65029321a5d1e2c495566d6c3d63909dcb402f2f6b5da3e70d2a2f`

```bash
#!/usr/bin/env bash
set -uo pipefail

command -v curl
printf 'node=%s tcp_l3mdev_accept=%s\n' \
  "$(hostname)" "$(sysctl -n net.ipv4.tcp_l3mdev_accept)"

failures=0

for ns in w24-pod1 w24-pod2; do
  for target in 10.4.0.1:443 192.168.138.44:6443; do
    host="${target%:*}"
    route="$(ip netns exec "$ns" ip route get "$host" | sed -n '1p')"
    result="$(
      ip netns exec "$ns" curl \
        --noproxy '*' \
        --connect-timeout 3 \
        --max-time 5 \
        -k \
        -sS \
        -o /dev/null \
        -w 'http=%{http_code} remote=%{remote_ip}:%{remote_port} connect=%{time_connect} total=%{time_total}' \
        "https://$target/version"
    )"
    rc=$?
    status=PASS
    if [[ $rc -ne 0 || $result != http=200\ * ]]; then
      status=FAIL
      ((failures += 1))
    fi
    printf '%s ns=%s target=%s rc=%s %s route=[%s]\n' \
      "$status" "$ns" "$target" "$rc" "$result" "$route"
  done
done

printf 'SUMMARY failures=%s\n' "$failures"
exit "$((failures > 0))"
```

The result files are retained on both nodes as `/root/issue-7130-vrf-w25-apiserver-results.txt`:

- worker SHA-256: `e7ad884bc243f7ae23878f6cf4df023b1e58bbfa23888a14f1568411408f8a36`
- control-plane SHA-256: `c3d2fe968fbf6410a6e66b32067d3544cd2c8ad74eeda1aaa9922a2489a715e0`
