### ISSUE TITLE
[BUG] VLAN priority tagged packets (vlan=0) get dropped by OVN

### ISSUE THREAD

**Issue by kvaps** [kubeovn/kube-ovn#5650]
Crossposted to https://github.com/cilium/cilium/issues/41371

### Kube-OVN Version

v1.13.15

### Kubernetes Version

v1.33.2

### Operation-system/Kernel Version

```
Talos (v1.10.5)   6.12.35-talos
```

### Description

Hey, we run cilium and kube-ovn in chaining mode. Cilium running in kube-proxy-replacement mode.

We have issue with `externalTrafficPolicy=Cluster` when traffic comes to one node and should be routed to pod running on another node.

### Steps To Reproduce

- Take two nodes: `node1` and `node2`
- Setup `kube-ovn` and `cilium`
- Run nginx pod on `node1`
- Create service and specify in `.spec.externalIPs` the public IP of `node2`
- Send packets to node2 public IP

### Current Behavior

`tcpdump -i any port 80` on input node shows that packet is coming on `enp98s0` then it DNAT'ed by cilium to pod IP and sent to `ovn0`:

```
10:23:42.858125 enp98s0 In  IP 5.6.7.8.60421 > 1.2.3.4.80: Flags [S], seq 135515977, win 65535, options [mss 1460,nop,wscale 6,nop,nop,TS val 1518876366 ecr 0,sackOK,eol], length 0
10:23:42.858145 ovn0  Out IP 1.2.3.4.60421 > 10.244.0.111.80: Flags [S], seq 135515977, win 65535, options [mss 1460,nop,wscale 6,nop,nop,TS val 1518876366 ecr 0,sackOK,eol], length 0
10
```

### Expected Behavior

I expected that packet will be processed to `geneve` interface later. But it seems they just get dropped by OVN.

If I run `tcpdump -ee` I can see that packets have `vlan=0` assigned:

```
14:25:10.538214 66:0d:e7:b9:60:a0 > 82:c8:ba:03:93:b9, ethertype 802.1Q (0x8100), length 82: vlan 0, p 0, ethertype IPv4 (0x0800), 1.2.3.4.49184 > 10.244.0.12.80: Flags [S], seq 3623648735, win 65535, options [mss 1460,nop,wscale 6,nop,nop,TS val 1443654524 ecr 0,sackOK,eol], length 0
```

It seems Cisco have feature which can't be reconfigured. There is a bug reported on Cisco bug tracker that some routers might send packets with `vlan=0`, not `vlan=1`:

- https://community.cisco.com/t5/unified-computing-system-discussions/cisco-ucs-nexus-802-1p-tagging-vlan0-on-traffic-between-blades/m-p/3756287#M28394
- https://bst.cloudapps.cisco.com/bugsearch/bug/CSCuu29425

And workaround for linux bridge `net.bridge.bridge-nf-filter-vlan-tagged = 1` which is not working for OVN.

**Comment by oilbeater** [comment]
I understand your use case. However, OVN doesn't support manually adding the `strip_vlan` action for logical switch ports on the `ovn0` interface. As an alternative, you could try injecting an eBPF program that uses `bpf_skb_vlan_pop` to remove the tag before the packet enters `ovn0`.
