### ISSUE TITLE
Underlay 子网 在vlan 非0 时无法连通网关

### ISSUE THREAD

**Issue by zyxfei** [kubeovn/kube-ovn#1399]
# Expected Behavior
Underlay模式下，子网配置 vlan id 2000，可以正常连通网关
# Actual Behavior
 ping 网关不通
# Steps to Reproduce the Problem
1.   k8s 使用标准安装脚本部署kubeovn 
2.  配置 subnet相关crd

```
apiVersion: kubeovn.io/v1
kind: ProviderNetwork
metadata:
  name: net1
spec:
  customInterfaces:
    - interface: bond0
      nodes:
        -k8sgpunode03-1217k8sovnv3
        -k8sgpunode04-1217k8sovnv3
  defaultInterface: bond0
  excludeNodes:
    -k8scpunode01-1217k8sovnv3
    -k8scpunode02-1217k8sovnv3
---

apiVersion: kubeovn.io/v1
kind: Vlan
metadata:
  name: vlan1
spec:
  id: 2000
  provider: net1

---
apiVersion: kubeovn.io/v1
kind: Subnet
metadata:
  name: subnet1
spec:
  cidrBlock: 172.17.0.0/16
  gateway: 172.17.0.1
  vlan: vlan1
---
apiVersion: kubeovn.io/v1
kind: Subnet
metadata:
  name: subnet1
spec:
  disableGatewayCheck: true
  excludeIps:
    - 7.34.72.65..7.34.72.113
  gateway: 7.34.72.65
  namespaces:
    - default
 ```

3.  建立容器测试连通性
```
apiVersion: apps/v1
kind: Deployment
metadata:
  name: pingtest
  namespace: default
  labels:
    app: pingtest
spec:
  replicas: 2
  selector:
    matchLabels:
      app: pingtest
  template:
    metadata:
      creationTimestamp: null
      labels:
        app: pingtest
      annotations:
        kubectl.kubernetes.io/restartedAt: '2022-03-24T03:10:15Z'
    spec:
      containers:
        - name: busybox
          image: praqma/network-multitool
          command:
            - sleep
            - infinity
          resources: {}
          terminationMessagePath: /dev/termination-log
          terminationMessagePolicy: File
          imagePullPolicy: Always
      restartPolicy: Always
      terminationGracePeriodSeconds: 30
      dnsPolicy: ClusterFirst
      securityContext: {}
      schedulerName: default-scheduler
  strategy:
    type: RollingUpdate
    rollingUpdate:
      maxUnavailable: 25%
      maxSurge: 25%
  revisionHistoryLimit: 10
  progressDeadlineSeconds: 600

```

# Additional Info

- Kubernetes version:
  ```
    Client Version: version.Info{Major:"1", Minor:"21", GitVersion:"v1.21.7", GitCommit:"1f86634ff08f37e54e8bfcd86bc90b61c98f84d4", GitTreeState:"clean", BuildDate:"2021-11-17T14:41:19Z", GoVersion:"go1.16.10", Compiler:"gc", Platform:"linux/amd64"}
    Server Version: version.Info{Major:"1", Minor:"21", GitVersion:"v1.21.7", GitCommit:"1f86634ff08f37e54e8bfcd86bc90b61c98f84d4", GitTreeState:"clean", BuildDate:"2021-11-17T14:35:38Z", GoVersion:"go1.16.10", Compiler:"gc", Platform:"linux/amd64"}
  ```
- kube-ovn version:
  
  ```
  1.9.1
  ```
- operation-system/kernel version:
  
  ```
  "Ubuntu 20.04.3 LTS"
   5.13.0-28-generic
  ```

- tcpdump
  ```
    root@k8sgpunode04-1217k8sovnv3:~# tcpdump -i 37056563e349_h
    tcpdump: verbose output suppressed, use -v or -vv for full protocol decode
    listening on 37056563e349_h, link-type EN10MB (Ethernet), capture size 262144 bytes
    15:10:29.722635 ARP, Request who-has 7.34.72.65 tell 7.34.72.120, length 28
    15:10:30.746582 ARP, Request who-has 7.34.72.65 tell 7.34.72.120, length 28
    15:10:31.770581 ARP, Request who-has 7.34.72.65 tell 7.34.72.120, length 28
    15:10:32.794664 ARP, Request who-has 7.34.72.65 tell 7.34.72.120, length 28
    
    root@k8sgpunode04-1217k8sovnv3:~# tcpdump  -i  br-net1  -nn -e vlan
    tcpdump: verbose output suppressed, use -v or -vv for full protocol decode
    listening on br-net1, link-type EN10MB (Ethernet), capture size 262144 bytes
    15:15:45.082645 00:00:00:ac:fa:09 > ff:ff:ff:ff:ff:ff, ethertype 802.1Q (0x8100), length 46: vlan 2000, p 0, ethertype ARP, Request who-has 7.34.72.65 tell 7.34.72.120, length 28
    15:15:46.106769 00:00:00:ac:fa:09 > ff:ff:ff:ff:ff:ff, ethertype 802.1Q (0x8100), length 46: vlan 2000, p 0, ethertype ARP, Request who-has 7.34.72.65 tell 7.34.72.120, length 28
    15:15:47.130875 00:00:00:ac:fa:09 > ff:ff:ff:ff:ff:ff, ethertype 802.1Q (0x8100), length 46: vlan 2000, p 0, ethertype ARP, Request who-has 7.34.72.65 tell 7.34.72.120, length 28
     
    设置vlan_id=0后，可以pod可以正常通信。
  ```

**Comment by zhangzujian** [comment]
vlan id 设置为非零时，使用的网卡（即此处的 bond0）需要连接到交换机上 vlan tag 为 vlan id 的 trunk 口。

**Comment by zyxfei** [comment]
交换机配置如下：
![image](https://user-images.githubusercontent.com/14983449/159867585-30da41df-9a57-4d48-93dd-fd4de3628cd0.png)

**Comment by zhangzujian** [comment]
经确认，物理网关发送的 arp 响应包没有带 vlan tag。

**Comment by oilbeater** [comment]
@zyxfei any update on this?
