### ISSUE TITLE
Connection rest by peer when visit pod from host

### ISSUE THREAD

**Issue by oilbeater** [kubeovn/kube-ovn#1426]
# Expected Behavior

Host can visit pod by curl

# Actual Behavior

curl returns `curl: (56) Recv failure: Connection reset by peer`

# Steps to Reproduce the Problem

It's not appeared in all env, maybe it related to multiple nic in host. Adding the join cidr to address set  `ovn.cluster.overlay.subnets.IPv4` can resolve this issue

```bash
[root@liumengxin-ovn1-192 ~]# ip route
default via 192.168.128.1 dev eth0 proto static metric 100
10.16.0.0/16 via 100.64.0.1 dev ovn0
100.64.0.0/16 dev ovn0 proto kernel scope link src 100.64.0.2
172.17.0.0/16 via 100.64.0.1 dev ovn0
192.168.128.0/20 dev eth0 proto kernel scope link src 192.168.137.176 metric 100
[root@liumengxin-ovn1-192 ~]# curl 10.16.0.2:8080
curl: (56) Recv failure: Connection reset by peer
[root@liumengxin-ovn1-192 ~]# kubectl ko nbctl add address_set ovn.cluster.overlay.subnets.IPv4 addresses "100.64.0.0/16"
[root@liumengxin-ovn1-192 ~]# curl 10.16.0.2:8080
404 page not found
```

# Additional Info

tcpdump shows wrong address `100.64.0.3` for server response

```
10:13:59.784058 IP 100.64.0.2.44394 > 10.16.0.4.8080: Flags [S], seq 2738321126, win 27200, options [mss 1360,sackOK,TS val 3184492917 ecr 0,nop,wscale 9], length 0
10:13:59.784551 IP 10.16.0.4.8080 > 100.64.0.2.44394: Flags [S.], seq 4222561886, ack 2738321127, win 26960, options [mss 1360,sackOK,TS val 2853124386 ecr 3184492917,nop,wscale 9], length 0
10:13:59.784587 IP 100.64.0.2.44394 > 10.16.0.4.8080: Flags [.], ack 1, win 54, options [nop,nop,TS val 3184492918 ecr 2853124386], length 0
10:13:59.784709 IP 100.64.0.2.44394 > 10.16.0.4.8080: Flags [P.], seq 1:79, ack 1, win 54, options [nop,nop,TS val 3184492918 ecr 2853124386], length 78: HTTP: GET / HTTP/1.1
10:13:59.784900 IP 100.64.0.3.8080 > 100.64.0.2.44394: Flags [.], ack 2738321205, win 53, options [nop,nop,TS val 2853124386 ecr 3184492918], length 0
10:13:59.784935 IP 100.64.0.2.44394 > 100.64.0.3.8080: Flags [R], seq 2738321205, win 0, length 0
10:13:59.785308 IP 100.64.0.3.8080 > 100.64.0.2.44394: Flags [P.], seq 0:176, ack 1, win 53, options [nop,nop,TS val 2853124386 ecr 3184492918], length 176: HTTP: HTTP/1.1 404 Not Found
10:13:59.785340 IP 100.64.0.2.44394 > 100.64.0.3.8080: Flags [R], seq 2738321205, win 0, length 0
10:13:59.985355 IP 100.64.0.2.44394 > 10.16.0.4.8080: Flags [P.], seq 1:79, ack 1, win 54, options [nop,nop,TS val 3184493119 ecr 2853124386], length 78: HTTP: GET / HTTP/1.1
10:13:59.985808 IP 10.16.0.4.8080 > 100.64.0.2.44394: Flags [R], seq 4222561887, win 0, length 0
```

- kube-ovn version:
  
  ```
  master
  ```
