### ISSUE TITLE
Iptables DNAT to VPC pod does not allow SSH from node

### ISSUE THREAD

**Issue by hurmaan-ahmed** [kubeovn/kube-ovn#6124]
# Iptables DNAT to VPC pod does not allow SSH from node

## Summary
I am trying to SSH into a pod that lives in a custom Kube-OVN VPC using an `IptablesEIP` + `IptablesDnatRule`. SSH works **from another pod inside the VPC**, but it **fails from the node** using the EIP and external port. I think I am missing something in the DNAT setup.

## Expected
`ssh -p 30222 root@192.168.1.14` should connect to the pod running `sshd`.

## Actual
`ssh -p 30222 root@192.168.1.14` fails from the node.

## Working test
From another pod inside the VPC, I can SSH into the pod using its pod IP `10.0.0.10` (the pod has `sshd` running).

## Resources in use
VPC and network definitions:
- `Vpc` `test-enclave`
- `Subnet` `test-enclave-subnet` (10.0.0.0/24)
- `Subnet` `ovn-vpc-external-network` (192.168.1.0/24)
- `NetworkAttachmentDefinition` `ovn-vpc-external-network` (macvlan on `enp1s0`)

NAT gateway + SNAT:
- `VpcNatGateway` `gw1` (lan IP 10.0.0.254)
- `IptablesEIP` `eip-random`
- `IptablesSnatRule` `snat01` (internal CIDR 10.0.0.0/24)

Workload + DNAT:
- `Pod` `sshd-test` (image `rastasheep/ubuntu-sshd:18.04`)
- `Service` `ssh-test-nodeport` (NodePort 30222)
- `IptablesEIP` `ssh-test-eip` (v4ip 192.168.1.14)
- `IptablesDnatRule` `ssh-test-dnat` (externalPort 30222 -> internalIp 10.0.0.10:22)

## Full manifests

VPC + external network:
```yaml
apiVersion: kubeovn.io/v1
kind: Vpc
metadata:
  name: test-enclave
spec:
  staticRoutes:
  - cidr: 0.0.0.0/0
    nextHopIP: 10.0.0.254
    policy: policyDst
  namespaces:
    - test-enclave
  defaultSubnet: test-enclave-subnet
---
apiVersion: kubeovn.io/v1
kind: Subnet
metadata:
  name: test-enclave-subnet
spec:
  vpc: test-enclave
  protocol: IPv4
  cidrBlock: 10.0.0.0/24
  gateway: 10.0.0.1
  natOutgoing: true
  private: false
  namespaces:
    - test-enclave
---
apiVersion: kubeovn.io/v1
kind: Subnet
metadata:
  name: ovn-vpc-external-network
spec:
  protocol: IPv4
  provider: ovn-vpc-external-network.kube-system
  cidrBlock: 192.168.1.0/24
  gateway: 192.168.1.1  # IP address of the physical gateway
  excludeIps:
  - 192.168.1.1..192.168.1.10
---
apiVersion: "k8s.cni.cncf.io/v1"
kind: NetworkAttachmentDefinition
metadata:
  name: ovn-vpc-external-network
  namespace: kube-system
spec:
  config: '{
      "cniVersion": "0.3.0",
      "type": "macvlan",
      "master": "enp1s0",
      "mode": "bridge",
      "ipam": {
        "type": "kube-ovn",
        "server_socket": "/run/openvswitch/kube-ovn-daemon.sock",
        "provider": "ovn-vpc-external-network.kube-system"
      }
    }'
```

NAT gateway + SNAT:
```yaml
kind: VpcNatGateway
apiVersion: kubeovn.io/v1
metadata:
  name: gw1
  namespace: test-enclave
spec:
  vpc: test-enclave
  lanIp: 10.0.0.254
  subnet: test-enclave-subnet
  externalSubnets:
    - ovn-vpc-external-network
---
kind: IptablesEIP
apiVersion: kubeovn.io/v1
metadata:
  name: eip-random
spec:
  natGwDp: gw1
  externalSubnet: ovn-vpc-external-network
---
kind: IptablesSnatRule
apiVersion: kubeovn.io/v1
metadata:
  name: snat01
spec:
  eip: eip-random
  internalCIDR: 10.0.0.0/24
```

Workload + DNAT:
```yaml
apiVersion: v1
kind: Pod
metadata:
  name: sshd-test
  namespace: test-enclave
  annotations:
    kubeovn.io/subnet: test-enclave-subnet
  labels:
    app: ssh-test
spec:
  containers:
    - name: test
      image: rastasheep/ubuntu-sshd:18.04
---
apiVersion: v1
kind: Service
metadata:
  name: ssh-test-nodeport
  namespace: test-enclave
spec:
  type: NodePort
  selector:
    app: ssh-test
  ports:
    - name: ssh
      port: 22
      targetPort: 22
      nodePort: 30222
---
apiVersion: kubeovn.io/v1
kind: IptablesEIP
metadata:
  name: ssh-test-eip
spec:
  v4ip: 192.168.1.14
  natGwDp: gw1
  externalSubnet: ovn-vpc-external-network
---
apiVersion: kubeovn.io/v1
kind: IptablesDnatRule
metadata:
  name: ssh-test-dnat
spec:
  eip: ssh-test-eip
  externalPort: "30222"
  internalIp: 10.0.0.10
  internalPort: "22"
  protocol: tcp
```

## Question
Is there anything else required for DNAT from a node into a pod in a custom VPC? Should the DNAT rule target the pod IP directly (as above), or should it point to the NodePort service instead?

**Comment by hurmaan-ahmed** [comment]
failed to ExecuteCommandInContainer, errOutput: iptables v1.8.11 (legacy): unknown protocol "10.0.0.12" specified
Try `iptables -h' or 'iptables --help' for more information.
failed to exec command "/usr/sbin/iptables-legacy -t nat -A SHARED_DNAT -p 10.0.0.12 -d 192.168.1.13 --dport tcp -j DNAT --to-destination 22:"
E0103 20:50:38.175504       7 vpc_nat_gateway.go:657] command terminated with exit code 2
E0103 20:50:38.175522       7 vpc_nat_gw_nat.go:1433] failed to create dnat, err: command terminated with exit code 2
E0103 20:50:38.175536       7 vpc_nat_gw_nat.go:430] failed to create dnat, command terminated with exit code 2
E0103 20:50:38.175596       7 controller.go:1442] "Unhandled Error" err="error syncing add iptables dnat rule \"ssh-test-dnat\": command terminated with exit code 2, requeuing" logger="UnhandledError"

I am seeing this error inside of the kube-ovn-controller @dosu. Where 10.0.0.12 is the IP of the SSHD Pod

**Comment by hurmaan-ahmed** [comment]
```yaml
apiVersion: kubeovn.io/v1
kind: IptablesDnatRule
metadata:
  name: ssh-test-dnat
spec:
  eip: ssh-test-eip
  protocol: tcp
  internalIp: 10.0.0.12
  internalPort: "22"
```

This is my YAML definition. I do have protocol set. How come its failing?

**Comment by hurmaan-ahmed** [comment]
So it turns out I need external port? Otherwise it fails to create the DNAT rule

**Comment by hurmaan-ahmed** [comment]
```
localuser@debian:~/Documents/test$ kubectl get dnat
NAME            EIP            PROTOCOL   V4IP           V6IP   INTERNALIP   EXTERNALPORT   INTERNALPORT   NATGWDP   READY
ssh-test-dnat   ssh-test-eip   tcp        192.168.1.13          10.0.0.12    30222          22             gw1       true
localuser@debian:~/Documents/test$ ssh -p 30222 root@192.168.1.13
ssh: connect to host 192.168.1.13 port 30222: No route to host
```
I am still unable to SSH into the pod in the VPC with this particular DNAT rule. I also added an externalPort=30222 which is the nodeport port

**Comment by zbb88888** [comment]
@hurmaan-ahmed Hi， thanks for your info！

which kube-ovn version are you using?
 

```

---
apiVersion: kubeovn.io/v1
kind: IptablesDnatRule
metadata:
  name: ssh-test-dnat
spec:
  eip: ssh-test-eip
  externalPort: "30222"
  internalIp: 10.0.0.10
  internalPort: "22"
  protocol: tcp # the tcp should exist with -p ： -p tcp

failed to ExecuteCommandInContainer, errOutput: iptables v1.8.11 (legacy): unknown protocol "10.0.0.12" specified
Try `iptables -h' or 'iptables --help' for more information.
failed to exec command "/usr/sbin/iptables-legacy -t nat -A SHARED_DNAT -p 10.0.0.12 -d 192.168.1.13 --dport tcp -j DNAT --to-destination 22:"


```

**Comment by hurmaan-ahmed** [comment]
Hey @zbb88888 , I am using the latest stable version 1.15.

**Comment by zbb88888** [comment]
> apiVersion: kubeovn.io/v1
> kind: IptablesDnatRule
> metadata:
>   name: ssh-test-dnat
> spec:
>   eip: ssh-test-eip
>   protocol: tcp
>   internalIp: 10.0.0.12
>   internalPort: "22"
> This is my YAML definition. I do have protocol set. How come its failing?

you lost the externalPort here

**Comment by hurmaan-ahmed** [comment]
> > apiVersion: kubeovn.io/v1
> > kind: IptablesDnatRule
> > metadata:
> >   name: ssh-test-dnat
> > spec:
> >   eip: ssh-test-eip
> >   protocol: tcp
> >   internalIp: 10.0.0.12
> >   internalPort: "22"
> > This is my YAML definition. I do have protocol set. How come its failing?
> 
> you lost the externalPort here

So I added that back once I realized it was required for the iptables rule to be set properly. When I added that back, the iptables command worked. However still no ssh access

**Comment by zbb88888** [comment]
can you ping the ssh-test-eip on the node? please show the result

**Comment by hurmaan-ahmed** [comment]
> can you ping the ssh-test-eip on the node? please show the result

```
kubectl get eip
NAME           IP             MAC                 NAT    NATGWDP   READY
eip-random     192.168.1.16   ca:13:4b:6c:a8:00   snat   gw1       true
ssh-test-eip   192.168.1.17   62:2b:0b:66:25:33   dnat   gw1       true
localuser@debian:~$ ping 192.168.1.17
PING 192.168.1.17 (192.168.1.17) 56(84) bytes of data.
^C
--- 192.168.1.17 ping statistics ---
3 packets transmitted, 0 received, 100% packet loss, time 2025ms
```

Ping doesn't work when pinging from the node but if I ping from the gateway pod it does work:

```
vpc-nat-gw-gw1-0:/kube-ovn# ping 192.168.1.17
PING 192.168.1.17 (192.168.1.17) 56(84) bytes of data.
64 bytes from 192.168.1.17: icmp_seq=1 ttl=64 time=0.039 ms
64 bytes from 192.168.1.17: icmp_seq=2 ttl=64 time=0.036 ms
64 bytes from 192.168.1.17: icmp_seq=3 ttl=64 time=0.044 ms
```

Note that EIP changed because I deleted and recreated it, but its the same set up as before.

**Comment by zbb88888** [comment]
please run `iptables-legacy-save` to show if there is dnat rule. 


and  `tcpdump -i any tcp and port 22` to show the flow ?

**Comment by hurmaan-ahmed** [comment]
> please run `iptables-legacy-save` to show if there is dnat rule.
> 
> and `tcpdump -i any tcp and port 22` to show the flow ?

```
vpc-nat-gw-gw1-0:/kube-ovn# iptables-legacy-save
# Generated by iptables-save v1.8.11 on Sun Jan  4 05:19:32 2026
*nat
:PREROUTING ACCEPT [1508:248008]
:INPUT ACCEPT [1508:248008]
:OUTPUT ACCEPT [1:84]
:POSTROUTING ACCEPT [1:84]
:DNAT_FILTER - [0:0]
:EXCLUSIVE_DNAT - [0:0]
:EXCLUSIVE_SNAT - [0:0]
:SHARED_DNAT - [0:0]
:SHARED_SNAT - [0:0]
:SNAT_FILTER - [0:0]
-A PREROUTING -j DNAT_FILTER
-A POSTROUTING -j SNAT_FILTER
-A DNAT_FILTER -j EXCLUSIVE_DNAT
-A DNAT_FILTER -j SHARED_DNAT
-A SHARED_DNAT -d 192.168.1.17/32 -p tcp -m tcp --dport 30222 -j DNAT --to-destination 10.0.0.12:22
-A SHARED_SNAT -s 10.0.0.0/24 -o net1 -j SNAT --to-source 192.168.1.16 --random-fully
-A SNAT_FILTER -j EXCLUSIVE_SNAT
-A SNAT_FILTER -j SHARED_SNAT
COMMIT
# Completed on Sun Jan  4 05:19:32 2026
```

I ran the `iptables-legacy-save` command on the gateway and the DNAT rule is present.

On the gateway node I ran that tcp dump to capture ssh traffic and from my node I ran `ssh -p 30222 root@192.168.1.17` (192.168.1.17 is the IP address of the EIP). The output was unforunately not good because there were no packets captured:

```
vpc-nat-gw-gw1-0:/kube-ovn# tcpdump -i any tcp and port 22
tcpdump: WARNING: any: That device doesn't support promiscuous mode
(Promiscuous mode not supported on the "any" device)
tcpdump: verbose output suppressed, use -v[v]... for full protocol decode
listening on any, link-type LINUX_SLL2 (Linux cooked v2), snapshot length 262144 bytes
^C
0 packets captured
0 packets received by filter
0 packets dropped by kernel
```

**Comment by zbb88888** [comment]
Could you please use  `tcpdump -i any icmp ` to show the ping flows?

**Comment by hurmaan-ahmed** [comment]
> Could you please use `tcpdump -i any icmp ` to show the ping flows?

Running that tcpdump command in the gateway pod. From the node if I ping the gateway pod, as expected, there is no ping response. From the SSH pod running in the test-enclave VPC, I can successfully ping the gateway pod as well as the internet (google dns server 8.8.8.8)

```
vpc-nat-gw-gw1-0:/kube-ovn# tcpdump -i any icmp
tcpdump: WARNING: any: That device doesn't support promiscuous mode
(Promiscuous mode not supported on the "any" device)
tcpdump: verbose output suppressed, use -v[v]... for full protocol decode
listening on any, link-type LINUX_SLL2 (Linux cooked v2), snapshot length 262144 bytes
05:33:05.562208 eth0  In  IP 10.0.0.12 > vpc-nat-gw-gw1-0: ICMP echo request, id 13, seq 1, length 64
05:33:05.562431 eth0  Out IP vpc-nat-gw-gw1-0 > 10.0.0.12: ICMP echo reply, id 13, seq 1, length 64
05:33:06.563821 eth0  In  IP 10.0.0.12 > vpc-nat-gw-gw1-0: ICMP echo request, id 13, seq 2, length 64
05:33:06.563870 eth0  Out IP vpc-nat-gw-gw1-0 > 10.0.0.12: ICMP echo reply, id 13, seq 2, length 64
05:33:07.564246 eth0  In  IP 10.0.0.12 > vpc-nat-gw-gw1-0: ICMP echo request, id 13, seq 3, length 64
05:33:07.564287 eth0  Out IP vpc-nat-gw-gw1-0 > 10.0.0.12: ICMP echo reply, id 13, seq 3, length 64
05:33:08.580602 eth0  In  IP 10.0.0.12 > vpc-nat-gw-gw1-0: ICMP echo request, id 13, seq 4, length 64
05:33:08.580635 eth0  Out IP vpc-nat-gw-gw1-0 > 10.0.0.12: ICMP echo reply, id 13, seq 4, length 64
05:33:09.605196 eth0  In  IP 10.0.0.12 > vpc-nat-gw-gw1-0: ICMP echo request, id 13, seq 5, length 64
05:33:09.605220 eth0  Out IP vpc-nat-gw-gw1-0 > 10.0.0.12: ICMP echo reply, id 13, seq 5, length 64
05:33:10.624582 eth0  In  IP 10.0.0.12 > vpc-nat-gw-gw1-0: ICMP echo request, id 13, seq 6, length 64
05:33:10.624618 eth0  Out IP vpc-nat-gw-gw1-0 > 10.0.0.12: ICMP echo reply, id 13, seq 6, length 64
05:33:11.648649 eth0  In  IP 10.0.0.12 > vpc-nat-gw-gw1-0: ICMP echo request, id 13, seq 7, length 64
05:33:11.648682 eth0  Out IP vpc-nat-gw-gw1-0 > 10.0.0.12: ICMP echo reply, id 13, seq 7, length 64
05:33:12.672653 eth0  In  IP 10.0.0.12 > vpc-nat-gw-gw1-0: ICMP echo request, id 13, seq 8, length 64
05:33:12.672697 eth0  Out IP vpc-nat-gw-gw1-0 > 10.0.0.12: ICMP echo reply, id 13, seq 8, length 64
05:33:13.700571 eth0  In  IP 10.0.0.12 > vpc-nat-gw-gw1-0: ICMP echo request, id 13, seq 9, length 64
05:33:13.700608 eth0  Out IP vpc-nat-gw-gw1-0 > 10.0.0.12: ICMP echo reply, id 13, seq 9, length 64
05:33:37.578839 eth0  In  IP 10.0.0.12 > 8.8.8.8: ICMP echo request, id 15, seq 1, length 64
05:33:37.579337 net1  Out IP 192.168.1.16 > 8.8.8.8: ICMP echo request, id 29599, seq 1, length 64
05:33:37.583614 net1  In  IP 8.8.8.8 > 192.168.1.16: ICMP echo reply, id 29599, seq 1, length 64
05:33:37.583630 eth0  Out IP 8.8.8.8 > 10.0.0.12: ICMP echo reply, id 15, seq 1, length 64
05:33:38.579990 eth0  In  IP 10.0.0.12 > 8.8.8.8: ICMP echo request, id 15, seq 2, length 64
05:33:38.580025 net1  Out IP 192.168.1.16 > 8.8.8.8: ICMP echo request, id 29599, seq 2, length 64
05:33:38.583600 net1  In  IP 8.8.8.8 > 192.168.1.16: ICMP echo reply, id 29599, seq 2, length 64
05:33:38.583626 eth0  Out IP 8.8.8.8 > 10.0.0.12: ICMP echo reply, id 15, seq 2, length 64
05:33:39.580695 eth0  In  IP 10.0.0.12 > 8.8.8.8: ICMP echo request, id 15, seq 3, length 64
05:33:39.580734 net1  Out IP 192.168.1.16 > 8.8.8.8: ICMP echo request, id 29599, seq 3, length 64
05:33:39.583635 net1  In  IP 8.8.8.8 > 192.168.1.16: ICMP echo reply, id 29599, seq 3, length 64
05:33:39.583662 eth0  Out IP 8.8.8.8 > 10.0.0.12: ICMP echo reply, id 15, seq 3, length 64
05:33:40.581196 eth0  In  IP 10.0.0.12 > 8.8.8.8: ICMP echo request, id 15, seq 4, length 64
05:33:40.581230 net1  Out IP 192.168.1.16 > 8.8.8.8: ICMP echo request, id 29599, seq 4, length 64
05:33:40.587681 net1  In  IP 8.8.8.8 > 192.168.1.16: ICMP echo reply, id 29599, seq 4, length 64
05:33:40.587744 eth0  Out IP 8.8.8.8 > 10.0.0.12: ICMP echo reply, id 15, seq 4, length 64
05:33:41.583200 eth0  In  IP 10.0.0.12 > 8.8.8.8: ICMP echo request, id 15, seq 5, length 64
05:33:41.583232 net1  Out IP 192.168.1.16 > 8.8.8.8: ICMP echo request, id 29599, seq 5, length 64
05:33:41.587800 net1  In  IP 8.8.8.8 > 192.168.1.16: ICMP echo reply, id 29599, seq 5, length 64
05:33:41.587836 eth0  Out IP 8.8.8.8 > 10.0.0.12: ICMP echo reply, id 15, seq 5, length 64
05:33:42.584636 eth0  In  IP 10.0.0.12 > 8.8.8.8: ICMP echo request, id 15, seq 6, length 64
05:33:42.584673 net1  Out IP 192.168.1.16 > 8.8.8.8: ICMP echo request, id 29599, seq 6, length 64
05:33:42.587812 net1  In  IP 8.8.8.8 > 192.168.1.16: ICMP echo reply, id 29599, seq 6, length 64
05:33:42.587837 eth0  Out IP 8.8.8.8 > 10.0.0.12: ICMP echo reply, id 15, seq 6, length 64
05:33:43.586178 eth0  In  IP 10.0.0.12 > 8.8.8.8: ICMP echo request, id 15, seq 7, length 64
05:33:43.586214 net1  Out IP 192.168.1.16 > 8.8.8.8: ICMP echo request, id 29599, seq 7, length 64
05:33:43.591949 net1  In  IP 8.8.8.8 > 192.168.1.16: ICMP echo reply, id 29599, seq 7, length 64
05:33:43.591975 eth0  Out IP 8.8.8.8 > 10.0.0.12: ICMP echo reply, id 15, seq 7, length 64
05:33:44.587286 eth0  In  IP 10.0.0.12 > 8.8.8.8: ICMP echo request, id 15, seq 8, length 64
05:33:44.587316 net1  Out IP 192.168.1.16 > 8.8.8.8: ICMP echo request, id 29599, seq 8, length 64
05:33:44.591533 net1  In  IP 8.8.8.8 > 192.168.1.16: ICMP echo reply, id 29599, seq 8, length 64
05:33:44.591566 eth0  Out IP 8.8.8.8 > 10.0.0.12: ICMP echo reply, id 15, seq 8, length 64
```

10.0.0.12 is the IP address of the SSHD pod that is running in the VPC. This atleast confirms that the SNAT rule to reach the external network is working.

**Comment by zbb88888** [comment]
> From the node if I ping the gateway pod, as expected, there is no ping response.

the result is `node to vpc-nat-gw (on the same node)` is not accessable, the problem is macvlan L2 bridge not support the `harpin`  way.

we can consider to support it later

**Comment by hurmaan-ahmed** [comment]
> > From the node if I ping the gateway pod, as expected, there is no ping response.
> 
> the result is `node to vpc-nat-gw (on the same node)` is not accessable, the problem is macvlan L2 bridge not support the `harpin` way.
> 
> we can consider to support it later

Yup I expected the ping response to not work. How about SSH or any other service that I want to access inside of the VPC from externally?

**Comment by zbb88888** [comment]
you can not use gw located node, any other node should be ok

**Comment by hurmaan-ahmed** [comment]
> you can not use gw located node, any other node should be ok

Is it possible to achieve the SSH from outside the cluster (so that it is not originating from the node)? I have a single node cluster for testing purposes as of now.

**Comment by hurmaan-ahmed** [comment]
> > you can not use gw located node, any other node should be ok
> 
> Is it possible to achieve the SSH from outside the cluster (so that it is not originating from the node)? I have a single node cluster for testing purposes as of now.

Any ideas how I can accomplish this?

**Comment by zbb88888** [comment]
like ipvlan l2 mode in https://github.com/AliyunContainerService/terway。

maybe, we can create a macvlan sub interface on the node, and set all macvlan sub ip/32 in the routes via dev "node-mac-sub-interface".

dev "node-mac-sub-interface" use the "k8s node ip"/32

**Comment by hurmaan-ahmed** [comment]
> like ipvlan l2 mode in https://github.com/AliyunContainerService/terway。
> 
> maybe, we can create a macvlan sub interface on the node, and set all macvlan sub ip/32 in the routes via dev "node-mac-sub-interface".
> 
> dev "node-mac-sub-interface" use the "k8s node ip"/32

Is this something that has to be implemented or is it something I can do? Basically I want to be able to ssh into that pod by giving it an EIP and port and accessing from the external network

**Comment by zbb88888** [comment]
@hurmaan-ahmed  Thanks for your help. I think you can try the way, which i mentioned above.

1. get the k8s node ip
2. create macvlan l2 sub interface as the pod using macvlan cni, but just in the k8s node, manually
3. set the (1) k8s node ip/32 address on the (2) macvlan l2 sub interface
4. add routes via dev on the (2) macvlan l2 sub interface for  all the nat gw pod net1 ip 

after this, 

i think, you can ssh from the nat gw pod located node to the pod fip.


After the successfult test, you can consider to make a PR!

**Comment by hurmaan-ahmed** [comment]
> @hurmaan-ahmed  Thanks for your help. I think you can try the way, which i mentioned above.
> 
> 1. get the k8s node ip
> 2. create macvlan l2 sub interface as the pod using macvlan cni, but just in the k8s node, manually
> 3. set the (1) k8s node ip/32 address on the (2) macvlan l2 sub interface
> 4. add routes via dev on the (2) macvlan l2 sub interface for  all the nat gw pod net1 ip 
> 
> after this, 
> 
> i think, you can ssh from the nat gw pod located node to the pod fip.
> 
> 
> After the successfult test, you can consider to make a PR! 
> 
> 

Do you think you would be able to assist with this? I am not that knowledgeable when it comes to macvlan stuff. Would this solution allow me to ssh from the external network onto the pod?

**Comment by zbb88888** [comment]
these step is just a guide, which can solve node can not access vpc nat gw eip(just when eip nat gw on the node).

you can use AI, to help you make it much more clear.

**Comment by hurmaan-ahmed** [comment]
> these step is just a guide, which can solve node can not access vpc nat gw eip(just when eip nat gw on the node).
> 
> you can use AI, to help you make it much more clear.

Okay I will give this a try and get back to you!

**Comment by hurmaan-ahmed** [comment]
> these step is just a guide, which can solve node can not access vpc nat gw eip(just when eip nat gw on the node).
> 
> you can use AI, to help you make it much more clear.

Woohoo! I just got this to work, I will share the details in the morning. I did what you asked and it worked!

**Comment by hurmaan-ahmed** [comment]
Steps I did to get it to work:

1. NODE_IP=$(kubectl get node <node-name> -o jsonpath='{.status.addresses[?(@.type=="InternalIP")].address}')
echo $NODE_IP
2. ip link add macvlan-node0 link enp1s0 type macvlan mode bridge
    ip link set macvlan-node0 up
3. ip addr add ${NODE_IP}/32 dev macvlan-node0
4. ip route add EIP/32 dev macvlan-node0
 
After doing this SSH worked! Thank you for the help kind sir.

**Comment by zbb88888** [comment]
> Steps I did to get it to work:
> 
> 1. NODE_IP=$(kubectl get node  -o jsonpath='{.status.addresses[?(@.type=="InternalIP")].address}')
>    echo $NODE_IP
> 2. ip link add macvlan-node0 link enp1s0 type macvlan mode bridge
>    ip link set macvlan-node0 up
> 3. ip addr add ${NODE_IP}/32 dev macvlan-node0
> 4. ip route add EIP/32 dev macvlan-node0
> 
> After doing this SSH worked! Thank you for the help kind sir.

@hurmaan-ahmed Hi, Do you have the time and interest to submit a PR?

**Comment by hurmaan-ahmed** [comment]
> > Steps I did to get it to work:
> > 
> > 1. NODE_IP=$(kubectl get node  -o jsonpath='{.status.addresses[?(@.type=="InternalIP")].address}')
> >    echo $NODE_IP
> > 2. ip link add macvlan-node0 link enp1s0 type macvlan mode bridge
> >    ip link set macvlan-node0 up
> > 3. ip addr add ${NODE_IP}/32 dev macvlan-node0
> > 4. ip route add EIP/32 dev macvlan-node0
> > 
> > After doing this SSH worked! Thank you for the help kind sir.
> 
> @hurmaan-ahmed Hi, Do you have the time and interest to submit a PR?

Unfortunately I won't have the time to work on thi
