### ISSUE TITLE
When enabling pod mirror, traffic with existing flows does not get mirrored

### ISSUE THREAD

**Issue by Cynerva** [kubeovn/kube-ovn#2801]
# Expected Behavior

I have the kube-ovn-cni container configured with `--mirror-iface=mirror0`, and a simple pod named `nginx`. From a kubernetes node I can curl the pod in a loop with:

```
while true; do curl $nginx_pod_ip; sleep 5; done
```

When I annotate the nginx pod to enable traffic mirroring:

```
kubectl annotate pod nginx ovn.kubernetes.io/mirror=true
```

and I run tcpdump on the mirror0 interface of the kubernetes node that's hosting the nginx pod:

```
sudo tcpdump -ni mirror0
```

I expect the tcpdump output to show network packets between the Kubernetes node and the nginx pod, each time curl runs.

# Actual Behavior

Traffic from the looped curl is not mirrored to mirror0, even for several minutes after the annotation was added.

However, this applies only to the looped curl. If I curl nginx from a different kubernetes node that has not been running curl in a loop, the traffic from that curl gets mirrored, but the looped curl still does not. To show you what I mean, here is a snippet from tcpdump with added comments:

```
$ sudo tcpdump -ni any dst 192.168.0.24 and tcp[tcpflags] == tcp-syn

# Packet from other node is mirrored
18:25:01.956680 genev_sys_6081 P   IP 100.64.0.2.35614 > 192.168.0.24.80: Flags [S], seq 145828129, win 65280, options [mss 1360,sackOK,TS val 758389552 ecr 0,nop,wscale 7], length 0
18:25:01.957455 e4315f7d8256_h Out IP 100.64.0.2.35614 > 192.168.0.24.80: Flags [S], seq 145828129, win 65280, options [mss 1360,sackOK,TS val 758389552 ecr 0,nop,wscale 7], length 0
18:25:01.957460 mirror0 P   IP 100.64.0.2.35614 > 192.168.0.24.80: Flags [S], seq 145828129, win 65280, options [mss 1360,sackOK,TS val
758389552 ecr 0,nop,wscale 7], length 0

# Later, packet from looped curl on local node is still not mirrored
18:25:04.661133 ovn0  Out IP 100.64.0.3.54694 > 192.168.0.24.80: Flags [S], seq 3548940708, win 65280, options [mss 1360,sackOK,TS val 369282046 ecr 0,nop,wscale 7], length 0
18:25:04.661195 e4315f7d8256_h Out IP 100.64.0.3.54694 > 192.168.0.24.80: Flags [S], seq 3548940708, win 65280, options [mss 1360,sackOK,TS val 369282046 ecr 0,nop,wscale 7], length 0
```

The issue only occurs if curl is looped with an interval of 10 seconds or lower. With an 11 second sleep, the traffic starts to mirror after the first full sleep. This correlates with expiration of idle flows in ovs as determined by the `max-idle` config, which defaults to 10 seconds as seen [here](https://github.com/openvswitch/ovs/blob/965c2955e6750f503b55d5c0af516cbb7b45f7ae/ofproto/ofproto.h#L320). If I change the max-idle config to 20 seconds with `kubectl ko vsctl juju-bb1929-1 set open . other_config:max-idle=20000` then the behavior changes such that I now need a 21 second sleep to make traffic start to mirror.

In other words, I can see existing flows with ovs-dpctl:

```
$ kubectl exec -n kube-system kube-ovn-cni-7rlhx -- ovs-dpctl dump-flows | grep 192.168.0.24
recirc_id(0x56063),in_port(4),ct_state(+new-est-rel-rpl+trk),ct_mark(0/0x1),eth(src=00:00:00:52:3e:10,dst=00:00:00:2a:3a:08),eth_type(0x0800),ipv4(src=100.64.0.2/255.255.255.254,dst=192.168.0.24,proto=6,ttl=64,frag=no), packets:207, bytes:15318, used:1.909s, flags:S, actions:ct(commit,zone=7,mark=0/0x1,nat(src)),set(eth(src=00:00:00:2d:e3:6a,dst=00:00:00:df:96:77)),set(ipv4(ttl=63)),ct(zone=13,nat),recirc(0x5b3c2)
recirc_id(0x56063),in_port(4),ct_state(-new+est-rel-rpl+trk),ct_mark(0/0x1),eth(src=00:00:00:52:3e:10,dst=00:00:00:2a:3a:08),eth_type(0x0800),ipv4(src=100.64.0.2/255.255.255.254,dst=192.168.0.24,proto=6,ttl=64,frag=no), packets:1247, bytes:98110, used:1.910s, flags:FP., actions:ct_clear,set(eth(src=00:00:00:2d:e3:6a,dst=00:00:00:df:96:77)),set(ipv4(ttl=63)),ct(zone=13,nat),recirc(0x5b3c2)
```

If I stop the curl loop for 11 seconds, then the flows disappear:

```
$ kubectl exec -n kube-system kube-ovn-cni-7rlhx -- ovs-dpctl dump-flows | grep 192.168.0.24
# Nothing
```

Now if I start the loop again, new flows get created and the traffic starts to mirror:
```
$ sudo tcpdump -ni any dst 192.168.0.24 and tcp[tcpflags] == tcp-syn
18:33:29.620049 ovn0  Out IP 100.64.0.3.59808 > 192.168.0.24.80: Flags [S], seq 2729364935, win 65280, options [mss 1360,sackOK,TS val 369787005 ecr 0,nop,wscale 7], length 0
18:33:29.620914 e4315f7d8256_h Out IP 100.64.0.3.59808 > 192.168.0.24.80: Flags [S], seq 2729364935, win 65280, options [mss 1360,sackOK,TS val 369787005 ecr 0,nop,wscale 7], length 0
18:33:29.620919 mirror0 P   IP 100.64.0.3.59808 > 192.168.0.24.80: Flags [S], seq 2729364935, win 65280, options [mss 1360,sackOK,TS val 369787005 ecr 0,nop,wscale 7], length 0
```

It seems like there is a cache somewhere in ovs that is not getting cleared until the flow expires, but I am not sure how to investigate further.

I have seen three different events that make traffic start to mirror as expected:
1. Sleeping 11+ seconds to let existing flows expire, as described above
2. Creating or deleting a different pod on the same Kubernetes node
3. Restarting kube-ovn-cni with `kubectl rollout restart -n kube-system daemonset/kube-ovn-cni`

This issue occurs for me with kube-ovn 1.11.5, but does not occur with kube-ovn 1.10.4.

# Steps to Reproduce the Problem

1. Deploy kubernetes with kube-ovn
1. Configure kube-ovn-cni with `--mirror-iface=mirror0`
1. Deploy a simple nginx pod to serve http traffic
1. Get the pod IP and, from any Kubernetes node, start a background loop with `while true; do curl $nginx_pod_ip; sleep 5; done`
1. Annotate the pod with `kubectl annotate pod nginx ovn.kubernetes.io/mirror=true`
1. On the kubernetes node that hosts the nginx pod, run `sudo tcpdump -ni mirror0`

# Additional Info

- Kubernetes version:

  **Output of `kubectl version`:**

  ```
  Client Version: v1.27.1
  Kustomize Version: v5.0.1
  Server Version: v1.27.1
  ```

- kube-ovn version:
  
  ```
  1.11.5
  ```

- operation-system/kernel version:
  
  **Output of `awk -F '=' '/PRETTY_NAME/ { print $2 }' /etc/os-release`:**
  **Output of `uname -r`:**
  ```
  "Ubuntu 22.04.2 LTS"
  5.15.0-71-generic
  ```

**Comment by oilbeater** [comment]
@Cynerva Thanks for the detailed analysis. I guess it may related to the vswitchd flow revalidation. We upgrade ovs between 1.11.5 and 1.10.4, I think in 1.10.4 the ovs will flush the flow cache when mirror config updated however it will not in the latest version
